

================================================================
== Vitis HLS Report for 'cshake256_simple_absorb_Pipeline_VITIS_LOOP_529_1'
================================================================
* Date:           Tue May 20 14:30:08 2025

* Version:        2024.2.2 (Build 6049644 on Mar  5 2025)
* Project:        sikep503_hls
* Solution:       solution1 (Vivado IP Flow Target)
* Product family: zynq
* Target device:  xc7z020-clg484-1


================================================================
== Performance Estimates
================================================================
+ Timing: 
    * Summary: 
    +--------+----------+----------+------------+
    |  Clock |  Target  | Estimated| Uncertainty|
    +--------+----------+----------+------------+
    |ap_clk  |  10.00 ns|  6.622 ns|     2.70 ns|
    +--------+----------+----------+------------+

+ Latency: 
    * Summary: 
    +---------+---------+----------+----------+-----+-----+------------------------------------------------+
    |  Latency (cycles) |  Latency (absolute) |  Interval |                    Pipeline                    |
    |   min   |   max   |    min   |    max   | min | max |                      Type                      |
    +---------+---------+----------+----------+-----+-----+------------------------------------------------+
    |       27|       27|  0.270 us|  0.270 us|   26|   26|  loop auto-rewind stp (delay=0 clock cycles(s))|
    +---------+---------+----------+----------+-----+-----+------------------------------------------------+

    + Detail: 
        * Instance: 
        N/A

        * Loop: 
        +--------------------+---------+---------+----------+-----------+-----------+------+----------+
        |                    |  Latency (cycles) | Iteration|  Initiation Interval  | Trip |          |
        |      Loop Name     |   min   |   max   |  Latency |  achieved |   target  | Count| Pipelined|
        +--------------------+---------+---------+----------+-----------+-----------+------+----------+
        |- VITIS_LOOP_529_1  |       25|       25|         1|          1|          1|    25|       yes|
        +--------------------+---------+---------+----------+-----------+-----------+------+----------+

============================================================
+ Verbose Summary: Synthesis Manager
============================================================
InlineROM: 1
ExposeGlobal: 0
============================================================
+ Verbose Summary: CDFG Model
============================================================
IsTopModel: 0
ResetActiveHigh: 1
IsCombinational: 0
IsDatapathOnly: 0
HasWiredReturn: 1
HasMFsm: 2
HasVarLatency: 1
IsPipeline: 0
IsRtlPipelined: 0
IsInstanceOverlapped: 0
IsDontTouch: 0
HasImplIP: 0
IsGatedGlobalClock: 0

+ Individual pipeline summary: 
  * Pipeline-0: initiation interval (II) = 1, depth = 1


============================================================
+ Verbose Summary: Schedule
============================================================
* Number of FSM states : 1
* Pipeline : 1
  Pipeline-0 : II = 1, D = 1, States = { 1 }
* Dataflow Pipeline: 0

* FSM state transitions: 
1 --> 

* FSM state operations: 

State 1 <SV = 0> <Delay = 6.62>
ST_1 : Operation 4 [1/1] (0.00ns)   --->   "%i = alloca i32 1" [src/sha3/fips202.c:527]   --->   Operation 4 'alloca' 'i' <Predicate = true> <Delay = 0.00>
ST_1 : Operation 5 [1/1] (0.00ns)   --->   "%specbramwithbyteenable_ln0 = specbramwithbyteenable void @_ssdm_op_SpecBRAMWithByteEnable, i64 %s"   --->   Operation 5 'specbramwithbyteenable' 'specbramwithbyteenable_ln0' <Predicate = true> <Delay = 0.00>
ST_1 : Operation 6 [1/1] (1.58ns)   --->   "%store_ln527 = store i5 0, i5 %i" [src/sha3/fips202.c:527]   --->   Operation 6 'store' 'store_ln527' <Predicate = true> <Delay = 1.58>
ST_1 : Operation 7 [1/1] (0.00ns)   --->   "%br_ln0 = br void %for.inc"   --->   Operation 7 'br' 'br_ln0' <Predicate = true> <Delay = 0.00>
ST_1 : Operation 8 [1/1] (0.00ns)   --->   "%i_275 = load i5 %i" [src/sha3/fips202.c:529]   --->   Operation 8 'load' 'i_275' <Predicate = true> <Delay = 0.00>
ST_1 : Operation 9 [1/1] (1.78ns)   --->   "%icmp_ln529 = icmp_eq  i5 %i_275, i5 25" [src/sha3/fips202.c:529]   --->   Operation 9 'icmp' 'icmp_ln529' <Predicate = true> <Delay = 1.78> <CoreInst = "Cmp">   --->   Core 9 'Cmp' <Latency = 0> <II = 1> <Delay = 1.78> <FuncUnit> <Opcode : 'seteq' 'setne' 'setle' 'setge' 'setlt' 'setgt'> <InPorts = 2> <OutPorts = 1>
ST_1 : Operation 10 [1/1] (1.78ns)   --->   "%add_ln529 = add i5 %i_275, i5 1" [src/sha3/fips202.c:529]   --->   Operation 10 'add' 'add_ln529' <Predicate = true> <Delay = 1.78> <CoreInst = "Adder">   --->   Core 1 'Adder' <Latency = 0> <II = 1> <Delay = 1.78> <FuncUnit> <Opcode : 'add' 'sub'> <InPorts = 2> <OutPorts = 1>
ST_1 : Operation 11 [1/1] (0.00ns)   --->   "%br_ln529 = br i1 %icmp_ln529, void %for.inc.split, void %for.end.exitStub" [src/sha3/fips202.c:529]   --->   Operation 11 'br' 'br_ln529' <Predicate = true> <Delay = 0.00>
ST_1 : Operation 12 [1/1] (0.00ns)   --->   "%specpipeline_ln527 = specpipeline void @_ssdm_op_SpecPipeline, i32 4294967295, i32 0, i32 0, i32 0, void @empty_44" [src/sha3/fips202.c:527]   --->   Operation 12 'specpipeline' 'specpipeline_ln527' <Predicate = (!icmp_ln529)> <Delay = 0.00>
ST_1 : Operation 13 [1/1] (0.00ns)   --->   "%speclooptripcount_ln527 = speclooptripcount void @_ssdm_op_SpecLoopTripCount, i64 25, i64 25, i64 25" [src/sha3/fips202.c:527]   --->   Operation 13 'speclooptripcount' 'speclooptripcount_ln527' <Predicate = (!icmp_ln529)> <Delay = 0.00>
ST_1 : Operation 14 [1/1] (0.00ns)   --->   "%specloopname_ln529 = specloopname void @_ssdm_op_SpecLoopName, void @empty_1" [src/sha3/fips202.c:529]   --->   Operation 14 'specloopname' 'specloopname_ln529' <Predicate = (!icmp_ln529)> <Delay = 0.00>
ST_1 : Operation 15 [1/1] (0.00ns)   --->   "%zext_ln530 = zext i5 %i_275" [src/sha3/fips202.c:530]   --->   Operation 15 'zext' 'zext_ln530' <Predicate = (!icmp_ln529)> <Delay = 0.00>
ST_1 : Operation 16 [1/1] (0.00ns)   --->   "%s_addr = getelementptr i64 %s, i32 0, i32 %zext_ln530" [src/sha3/fips202.c:530]   --->   Operation 16 'getelementptr' 's_addr' <Predicate = (!icmp_ln529)> <Delay = 0.00>
ST_1 : Operation 17 [1/1] ( I:3.25ns O:3.25ns )   --->   "%store_ln530 = store void @_ssdm_op_Write.bram.i64, i5 %s_addr, i64 0, i8 255" [src/sha3/fips202.c:530]   --->   Operation 17 'store' 'store_ln530' <Predicate = (!icmp_ln529)> <Delay = 3.25> <CoreInst = "RAM">   --->   Core 81 'RAM' <Latency = 1> <II = 1> <Delay = 3.25> <Storage> <Opcode : 'load' 'store'> <Ports = 2> <Width = 64> <Depth = 25> <RAM>
ST_1 : Operation 18 [1/1] (1.58ns)   --->   "%store_ln527 = store i5 %add_ln529, i5 %i" [src/sha3/fips202.c:527]   --->   Operation 18 'store' 'store_ln527' <Predicate = (!icmp_ln529)> <Delay = 1.58>
ST_1 : Operation 19 [1/1] (0.00ns)   --->   "%br_ln529 = br void %for.inc" [src/sha3/fips202.c:529]   --->   Operation 19 'br' 'br_ln529' <Predicate = (!icmp_ln529)> <Delay = 0.00>
ST_1 : Operation 20 [1/1] (1.58ns)   --->   "%ret_ln0 = ret"   --->   Operation 20 'ret' 'ret_ln0' <Predicate = (icmp_ln529)> <Delay = 1.58>


============================================================
+ Verbose Summary: Timing violations
============================================================
Target clock period: 10.000ns, clock uncertainty: 2.700ns.

 <State 1>: 6.622ns
The critical path consists of the following:
	'store' operation 0 bit ('store_ln527', src/sha3/fips202.c:527) of constant 0 on local variable 'i', src/sha3/fips202.c:527 [4]  (1.588 ns)
	'load' operation 5 bit ('i', src/sha3/fips202.c:529) on local variable 'i', src/sha3/fips202.c:527 [7]  (0.000 ns)
	'icmp' operation 1 bit ('icmp_ln529', src/sha3/fips202.c:529) [8]  (1.780 ns)
	'store' operation 0 bit ('store_ln530', src/sha3/fips202.c:530) of constant <constant:_ssdm_op_Write.bram.i64> on array 's' [17]  (3.254 ns)


============================================================
+ Verbose Summary: Binding
============================================================
N/A
* FSMD analyzer results:
  - Output states:
 - Input state : 
  - Chain level:
	State 1


============================================================
+ Verbose Summary: Datapath Resource usage 
============================================================
N/A
