

================================================================
== Vitis HLS Report for 'fp2inv503_mont_Pipeline_VITIS_LOOP_23_1'
================================================================
* Date:           Tue May 20 14:32:00 2025

* Version:        2024.2.2 (Build 6049644 on Mar  5 2025)
* Project:        sikep503_hls
* Solution:       solution1 (Vivado IP Flow Target)
* Product family: zynq
* Target device:  xc7z020-clg484-1


================================================================
== Performance Estimates
================================================================
+ Timing: 
    * Summary: 
    +--------+----------+----------+------------+
    |  Clock |  Target  | Estimated| Uncertainty|
    +--------+----------+----------+------------+
    |ap_clk  |  10.00 ns|  5.842 ns|     2.70 ns|
    +--------+----------+----------+------------+

+ Latency: 
    * Summary: 
    +---------+---------+----------+----------+-----+-----+------------------------------------------------+
    |  Latency (cycles) |  Latency (absolute) |  Interval |                    Pipeline                    |
    |   min   |   max   |    min   |    max   | min | max |                      Type                      |
    +---------+---------+----------+----------+-----+-----+------------------------------------------------+
    |       19|       19|  0.190 us|  0.190 us|   18|   18|  loop auto-rewind stp (delay=0 clock cycles(s))|
    +---------+---------+----------+----------+-----+-----+------------------------------------------------+

    + Detail: 
        * Instance: 
        N/A

        * Loop: 
        +-------------------+---------+---------+----------+-----------+-----------+------+----------+
        |                   |  Latency (cycles) | Iteration|  Initiation Interval  | Trip |          |
        |     Loop Name     |   min   |   max   |  Latency |  achieved |   target  | Count| Pipelined|
        +-------------------+---------+---------+----------+-----------+-----------+------+----------+
        |- VITIS_LOOP_23_1  |       17|       17|         3|          2|          1|     8|       yes|
        +-------------------+---------+---------+----------+-----------+-----------+------+----------+

============================================================
+ Verbose Summary: Synthesis Manager
============================================================
InlineROM: 1
ExposeGlobal: 0
============================================================
+ Verbose Summary: CDFG Model
============================================================
IsTopModel: 0
ResetActiveHigh: 1
IsCombinational: 0
IsDatapathOnly: 0
HasWiredReturn: 1
HasMFsm: 2
HasVarLatency: 1
IsPipeline: 0
IsRtlPipelined: 0
IsInstanceOverlapped: 0
IsDontTouch: 0
HasImplIP: 0
IsGatedGlobalClock: 0

+ Individual pipeline summary: 
  * Pipeline-0: initiation interval (II) = 2, depth = 3


============================================================
+ Verbose Summary: Schedule
============================================================
* Number of FSM states : 3
* Pipeline : 1
  Pipeline-0 : II = 2, D = 3, States = { 1 2 3 }
* Dataflow Pipeline: 0

* FSM state transitions: 
1 --> 2 
2 --> 3 
3 --> 

* FSM state operations: 

State 1 <SV = 0> <Delay = 4.91>
ST_1 : Operation 6 [1/1] (0.00ns)   --->   "%i = alloca i32 1" [src/generic/fp_generic.c:20->src/fpx.c:319]   --->   Operation 6 'alloca' 'i' <Predicate = true> <Delay = 0.00>
ST_1 : Operation 7 [1/1] (1.58ns)   --->   "%store_ln20 = store i4 0, i4 %i" [src/generic/fp_generic.c:20->src/fpx.c:319]   --->   Operation 7 'store' 'store_ln20' <Predicate = true> <Delay = 1.58>
ST_1 : Operation 8 [1/1] (1.58ns)   --->   "%br_ln0 = br void %for.inc.i"   --->   Operation 8 'br' 'br_ln0' <Predicate = true> <Delay = 1.58>
ST_1 : Operation 9 [1/1] (0.00ns)   --->   "%i_271 = load i4 %i" [src/generic/fp_generic.c:24->src/fpx.c:319]   --->   Operation 9 'load' 'i_271' <Predicate = true> <Delay = 0.00>
ST_1 : Operation 10 [1/1] (1.73ns)   --->   "%icmp_ln23 = icmp_eq  i4 %i_271, i4 8" [src/generic/fp_generic.c:23->src/fpx.c:319]   --->   Operation 10 'icmp' 'icmp_ln23' <Predicate = true> <Delay = 1.73> <CoreInst = "Cmp">   --->   Core 9 'Cmp' <Latency = 0> <II = 1> <Delay = 1.73> <FuncUnit> <Opcode : 'seteq' 'setne' 'setle' 'setge' 'setlt' 'setgt'> <InPorts = 2> <OutPorts = 1>
ST_1 : Operation 11 [1/1] (1.73ns)   --->   "%add_ln23 = add i4 %i_271, i4 1" [src/generic/fp_generic.c:23->src/fpx.c:319]   --->   Operation 11 'add' 'add_ln23' <Predicate = true> <Delay = 1.73> <CoreInst = "Adder">   --->   Core 1 'Adder' <Latency = 0> <II = 1> <Delay = 1.73> <FuncUnit> <Opcode : 'add' 'sub'> <InPorts = 2> <OutPorts = 1>
ST_1 : Operation 12 [1/1] (0.00ns)   --->   "%br_ln23 = br i1 %icmp_ln23, void %for.inc.i.split, void %for.inc29.i.preheader.exitStub" [src/generic/fp_generic.c:23->src/fpx.c:319]   --->   Operation 12 'br' 'br_ln23' <Predicate = true> <Delay = 0.00>
ST_1 : Operation 13 [1/1] (0.00ns)   --->   "%trunc_ln24 = trunc i4 %i_271" [src/generic/fp_generic.c:24->src/fpx.c:319]   --->   Operation 13 'trunc' 'trunc_ln24' <Predicate = (!icmp_ln23)> <Delay = 0.00>
ST_1 : Operation 14 [1/1] (0.00ns)   --->   "%zext_ln24 = zext i3 %trunc_ln24" [src/generic/fp_generic.c:24->src/fpx.c:319]   --->   Operation 14 'zext' 'zext_ln24' <Predicate = (!icmp_ln23)> <Delay = 0.00>
ST_1 : Operation 15 [1/1] (0.00ns)   --->   "%t1_addr = getelementptr i64 %t1, i32 0, i32 %zext_ln24" [src/generic/fp_generic.c:24->src/fpx.c:319]   --->   Operation 15 'getelementptr' 't1_addr' <Predicate = (!icmp_ln23)> <Delay = 0.00>
ST_1 : Operation 16 [2/2] (2.32ns)   --->   "%t1_load = load i3 %t1_addr" [src/generic/fp_generic.c:24->src/fpx.c:319]   --->   Operation 16 'load' 't1_load' <Predicate = (!icmp_ln23)> <Delay = 2.32> <CoreInst = "RAM">   --->   Core 81 'RAM' <Latency = 1> <II = 1> <Delay = 2.32> <Storage> <Opcode : 'load' 'store'> <Ports = 2> <Width = 64> <Depth = 8> <RAM>
ST_1 : Operation 17 [1/1] (0.00ns)   --->   "%t1_1_addr = getelementptr i64 %t1_1, i32 0, i32 %zext_ln24" [src/generic/fp_generic.c:24->src/fpx.c:319]   --->   Operation 17 'getelementptr' 't1_1_addr' <Predicate = (!icmp_ln23)> <Delay = 0.00>
ST_1 : Operation 18 [2/2] (2.32ns)   --->   "%t1_1_load = load i3 %t1_1_addr" [src/generic/fp_generic.c:24->src/fpx.c:319]   --->   Operation 18 'load' 't1_1_load' <Predicate = (!icmp_ln23)> <Delay = 2.32> <CoreInst = "RAM">   --->   Core 81 'RAM' <Latency = 1> <II = 1> <Delay = 2.32> <Storage> <Opcode : 'load' 'store'> <Ports = 2> <Width = 64> <Depth = 8> <RAM>
ST_1 : Operation 19 [1/1] (1.58ns)   --->   "%store_ln20 = store i4 %add_ln23, i4 %i" [src/generic/fp_generic.c:20->src/fpx.c:319]   --->   Operation 19 'store' 'store_ln20' <Predicate = (!icmp_ln23)> <Delay = 1.58>

State 2 <SV = 1> <Delay = 5.84>
ST_2 : Operation 20 [1/1] (0.00ns)   --->   "%carry = phi i1 0, void %newFuncRoot, i1 %tmp, void %for.inc.i.split" [src/generic/fp_generic.c:23->src/fpx.c:319]   --->   Operation 20 'phi' 'carry' <Predicate = true> <Delay = 0.00>
ST_2 : Operation 21 [1/2] ( I:2.32ns O:2.32ns )   --->   "%t1_load = load i3 %t1_addr" [src/generic/fp_generic.c:24->src/fpx.c:319]   --->   Operation 21 'load' 't1_load' <Predicate = (!icmp_ln23)> <Delay = 2.32> <CoreInst = "RAM">   --->   Core 81 'RAM' <Latency = 1> <II = 1> <Delay = 2.32> <Storage> <Opcode : 'load' 'store'> <Ports = 2> <Width = 64> <Depth = 8> <RAM>
ST_2 : Operation 22 [1/1] (0.00ns)   --->   "%zext_ln24_41 = zext i1 %carry" [src/generic/fp_generic.c:24->src/fpx.c:319]   --->   Operation 22 'zext' 'zext_ln24_41' <Predicate = (!icmp_ln23)> <Delay = 0.00>
ST_2 : Operation 23 [1/1] (3.52ns)   --->   "%tempReg = add i64 %t1_load, i64 %zext_ln24_41" [src/generic/fp_generic.c:24->src/fpx.c:319]   --->   Operation 23 'add' 'tempReg' <Predicate = (!icmp_ln23)> <Delay = 3.52> <CoreInst = "Adder">   --->   Core 1 'Adder' <Latency = 0> <II = 1> <Delay = 3.52> <FuncUnit> <Opcode : 'add' 'sub'> <InPorts = 2> <OutPorts = 1>
ST_2 : Operation 24 [1/2] ( I:2.32ns O:2.32ns )   --->   "%t1_1_load = load i3 %t1_1_addr" [src/generic/fp_generic.c:24->src/fpx.c:319]   --->   Operation 24 'load' 't1_1_load' <Predicate = (!icmp_ln23)> <Delay = 2.32> <CoreInst = "RAM">   --->   Core 81 'RAM' <Latency = 1> <II = 1> <Delay = 2.32> <Storage> <Opcode : 'load' 'store'> <Ports = 2> <Width = 64> <Depth = 8> <RAM>
ST_2 : Operation 42 [1/1] (1.58ns)   --->   "%ret_ln0 = ret"   --->   Operation 42 'ret' 'ret_ln0' <Predicate = (icmp_ln23)> <Delay = 1.58>

State 3 <SV = 2> <Delay = 5.84>
ST_3 : Operation 25 [1/1] (0.00ns)   --->   "%specpipeline_ln20 = specpipeline void @_ssdm_op_SpecPipeline, i32 4294967295, i32 0, i32 0, i32 0, void @empty_44" [src/generic/fp_generic.c:20->src/fpx.c:319]   --->   Operation 25 'specpipeline' 'specpipeline_ln20' <Predicate = (!icmp_ln23)> <Delay = 0.00>
ST_3 : Operation 26 [1/1] (0.00ns)   --->   "%speclooptripcount_ln20 = speclooptripcount void @_ssdm_op_SpecLoopTripCount, i64 8, i64 8, i64 8" [src/generic/fp_generic.c:20->src/fpx.c:319]   --->   Operation 26 'speclooptripcount' 'speclooptripcount_ln20' <Predicate = (!icmp_ln23)> <Delay = 0.00>
ST_3 : Operation 27 [1/1] (0.00ns)   --->   "%specloopname_ln23 = specloopname void @_ssdm_op_SpecLoopName, void @empty_5" [src/generic/fp_generic.c:23->src/fpx.c:319]   --->   Operation 27 'specloopname' 'specloopname_ln23' <Predicate = (!icmp_ln23)> <Delay = 0.00>
ST_3 : Operation 28 [1/1] (3.52ns)   --->   "%add_ln24 = add i64 %t1_1_load, i64 %tempReg" [src/generic/fp_generic.c:24->src/fpx.c:319]   --->   Operation 28 'add' 'add_ln24' <Predicate = (!icmp_ln23)> <Delay = 3.52> <CoreInst = "Adder">   --->   Core 1 'Adder' <Latency = 0> <II = 1> <Delay = 3.52> <FuncUnit> <Opcode : 'add' 'sub'> <InPorts = 2> <OutPorts = 1>
ST_3 : Operation 29 [1/1] ( I:2.32ns O:2.32ns )   --->   "%store_ln24 = store i64 %add_ln24, i3 %t1_addr" [src/generic/fp_generic.c:24->src/fpx.c:319]   --->   Operation 29 'store' 'store_ln24' <Predicate = (!icmp_ln23)> <Delay = 2.32> <CoreInst = "RAM">   --->   Core 81 'RAM' <Latency = 1> <II = 1> <Delay = 2.32> <Storage> <Opcode : 'load' 'store'> <Ports = 2> <Width = 64> <Depth = 8> <RAM>
ST_3 : Operation 30 [1/1] (0.00ns) (grouped into LUT with out node xor_ln24_51)   --->   "%xor_ln24 = xor i64 %add_ln24, i64 %tempReg" [src/generic/fp_generic.c:24->src/fpx.c:319]   --->   Operation 30 'xor' 'xor_ln24' <Predicate = (!icmp_ln23)> <Delay = 0.00> <CoreInst = "LogicGate">   --->   Core 74 'LogicGate' <Latency = 0> <II = 1> <Delay = 0.99> <FuncUnit> <Opcode : 'and' 'or' 'xor'> <InPorts = 2> <OutPorts = 1>
ST_3 : Operation 31 [1/1] (0.00ns) (grouped into LUT with out node xor_ln24_51)   --->   "%xor_ln24_49 = xor i64 %t1_1_load, i64 %tempReg" [src/generic/fp_generic.c:24->src/fpx.c:319]   --->   Operation 31 'xor' 'xor_ln24_49' <Predicate = (!icmp_ln23)> <Delay = 0.00> <CoreInst = "LogicGate">   --->   Core 74 'LogicGate' <Latency = 0> <II = 1> <Delay = 0.99> <FuncUnit> <Opcode : 'and' 'or' 'xor'> <InPorts = 2> <OutPorts = 1>
ST_3 : Operation 32 [1/1] (0.00ns) (grouped into LUT with out node xor_ln24_51)   --->   "%or_ln24 = or i64 %xor_ln24, i64 %xor_ln24_49" [src/generic/fp_generic.c:24->src/fpx.c:319]   --->   Operation 32 'or' 'or_ln24' <Predicate = (!icmp_ln23)> <Delay = 0.00> <CoreInst = "LogicGate">   --->   Core 74 'LogicGate' <Latency = 0> <II = 1> <Delay = 0.99> <FuncUnit> <Opcode : 'and' 'or' 'xor'> <InPorts = 2> <OutPorts = 1>
ST_3 : Operation 33 [1/1] (0.00ns) (grouped into LUT with out node or_ln24_17)   --->   "%bit_sel = bitselect i1 @_ssdm_op_BitSelect.i1.i64.i64, i64 %tempReg, i64 63" [src/generic/fp_generic.c:24->src/fpx.c:319]   --->   Operation 33 'bitselect' 'bit_sel' <Predicate = (!icmp_ln23)> <Delay = 0.00>
ST_3 : Operation 34 [1/1] (0.00ns) (grouped into LUT with out node or_ln24_17)   --->   "%xor_ln24_56 = xor i1 %bit_sel, i1 1" [src/generic/fp_generic.c:24->src/fpx.c:319]   --->   Operation 34 'xor' 'xor_ln24_56' <Predicate = (!icmp_ln23)> <Delay = 0.00> <CoreInst = "LogicGate">   --->   Core 74 'LogicGate' <Latency = 0> <II = 1> <Delay = 0.97> <FuncUnit> <Opcode : 'and' 'or' 'xor'> <InPorts = 2> <OutPorts = 1>
ST_3 : Operation 35 [1/1] (0.00ns) (grouped into LUT with out node or_ln24_17)   --->   "%trunc_ln24_22 = trunc i64 %tempReg" [src/generic/fp_generic.c:24->src/fpx.c:319]   --->   Operation 35 'trunc' 'trunc_ln24_22' <Predicate = (!icmp_ln23)> <Delay = 0.00>
ST_3 : Operation 36 [1/1] (0.00ns) (grouped into LUT with out node or_ln24_17)   --->   "%xor_ln24_s = bitconcatenate i64 @_ssdm_op_BitConcatenate.i64.i1.i63, i1 %xor_ln24_56, i63 %trunc_ln24_22" [src/generic/fp_generic.c:24->src/fpx.c:319]   --->   Operation 36 'bitconcatenate' 'xor_ln24_s' <Predicate = (!icmp_ln23)> <Delay = 0.00>
ST_3 : Operation 37 [1/1] (0.00ns) (grouped into LUT with out node or_ln24_17)   --->   "%and_ln24 = and i64 %t1_load, i64 %xor_ln24_s" [src/generic/fp_generic.c:24->src/fpx.c:319]   --->   Operation 37 'and' 'and_ln24' <Predicate = (!icmp_ln23)> <Delay = 0.00> <CoreInst = "LogicGate">   --->   Core 74 'LogicGate' <Latency = 0> <II = 1> <Delay = 0.99> <FuncUnit> <Opcode : 'and' 'or' 'xor'> <InPorts = 2> <OutPorts = 1>
ST_3 : Operation 38 [1/1] (0.99ns) (out node of the LUT)   --->   "%xor_ln24_51 = xor i64 %or_ln24, i64 %add_ln24" [src/generic/fp_generic.c:24->src/fpx.c:319]   --->   Operation 38 'xor' 'xor_ln24_51' <Predicate = (!icmp_ln23)> <Delay = 0.99> <CoreInst = "LogicGate">   --->   Core 74 'LogicGate' <Latency = 0> <II = 1> <Delay = 0.99> <FuncUnit> <Opcode : 'and' 'or' 'xor'> <InPorts = 2> <OutPorts = 1>
ST_3 : Operation 39 [1/1] (0.99ns) (out node of the LUT)   --->   "%or_ln24_17 = or i64 %xor_ln24_51, i64 %and_ln24" [src/generic/fp_generic.c:24->src/fpx.c:319]   --->   Operation 39 'or' 'or_ln24_17' <Predicate = (!icmp_ln23)> <Delay = 0.99> <CoreInst = "LogicGate">   --->   Core 74 'LogicGate' <Latency = 0> <II = 1> <Delay = 0.99> <FuncUnit> <Opcode : 'and' 'or' 'xor'> <InPorts = 2> <OutPorts = 1>
ST_3 : Operation 40 [1/1] (0.00ns)   --->   "%tmp = bitselect i1 @_ssdm_op_BitSelect.i1.i64.i32, i64 %or_ln24_17, i32 63" [src/generic/fp_generic.c:23->src/fpx.c:319]   --->   Operation 40 'bitselect' 'tmp' <Predicate = (!icmp_ln23)> <Delay = 0.00>
ST_3 : Operation 41 [1/1] (0.00ns)   --->   "%br_ln23 = br void %for.inc.i" [src/generic/fp_generic.c:23->src/fpx.c:319]   --->   Operation 41 'br' 'br_ln23' <Predicate = (!icmp_ln23)> <Delay = 0.00>


============================================================
+ Verbose Summary: Timing violations
============================================================
Target clock period: 10.000ns, clock uncertainty: 2.700ns.

 <State 1>: 4.911ns
The critical path consists of the following:
	'store' operation 0 bit ('store_ln20', src/generic/fp_generic.c:20->src/fpx.c:319) of constant 0 on local variable 'i', src/generic/fp_generic.c:20->src/fpx.c:319 [4]  (1.588 ns)
	'load' operation 4 bit ('i', src/generic/fp_generic.c:24->src/fpx.c:319) on local variable 'i', src/generic/fp_generic.c:20->src/fpx.c:319 [8]  (0.000 ns)
	'icmp' operation 1 bit ('icmp_ln23', src/generic/fp_generic.c:23->src/fpx.c:319) [9]  (1.735 ns)
	'store' operation 0 bit ('store_ln20', src/generic/fp_generic.c:20->src/fpx.c:319) of variable 'add_ln23', src/generic/fp_generic.c:23->src/fpx.c:319 on local variable 'i', src/generic/fp_generic.c:20->src/fpx.c:319 [37]  (1.588 ns)

 <State 2>: 5.842ns
The critical path consists of the following:
	'load' operation 64 bit ('t1_load', src/generic/fp_generic.c:24->src/fpx.c:319) on array 't1' [19]  (2.322 ns)
	'add' operation 64 bit ('tempReg', src/generic/fp_generic.c:24->src/fpx.c:319) [21]  (3.520 ns)

 <State 3>: 5.842ns
The critical path consists of the following:
	'add' operation 64 bit ('x', src/generic/fp_generic.c:24->src/fpx.c:319) [24]  (3.520 ns)
	'store' operation 0 bit ('store_ln24', src/generic/fp_generic.c:24->src/fpx.c:319) of variable 'x', src/generic/fp_generic.c:24->src/fpx.c:319 on array 't1' [25]  (2.322 ns)


============================================================
+ Verbose Summary: Binding
============================================================
N/A
* FSMD analyzer results:
  - Output states:
 - Input state : 
  - Chain level:
	State 1
	State 2
	State 3


============================================================
+ Verbose Summary: Datapath Resource usage 
============================================================
N/A
