

================================================================
== Vitis HLS Report for 'fp2mul503_mont_133_Pipeline_VITIS_LOOP_349_1186'
================================================================
* Date:           Tue May 20 14:30:47 2025

* Version:        2024.2.2 (Build 6049644 on Mar  5 2025)
* Project:        sikep503_hls
* Solution:       solution1 (Vivado IP Flow Target)
* Product family: zynq
* Target device:  xc7z020-clg484-1


================================================================
== Performance Estimates
================================================================
+ Timing: 
    * Summary: 
    +--------+----------+----------+------------+
    |  Clock |  Target  | Estimated| Uncertainty|
    +--------+----------+----------+------------+
    |ap_clk  |  10.00 ns|  6.774 ns|     2.70 ns|
    +--------+----------+----------+------------+

+ Latency: 
    * Summary: 
    +---------+---------+----------+----------+-----+-----+------------------------------------------------+
    |  Latency (cycles) |  Latency (absolute) |  Interval |                    Pipeline                    |
    |   min   |   max   |    min   |    max   | min | max |                      Type                      |
    +---------+---------+----------+----------+-----+-----+------------------------------------------------+
    |       35|       35|  0.350 us|  0.350 us|   34|   34|  loop auto-rewind stp (delay=0 clock cycles(s))|
    +---------+---------+----------+----------+-----+-----+------------------------------------------------+

    + Detail: 
        * Instance: 
        N/A

        * Loop: 
        +--------------------+---------+---------+----------+-----------+-----------+------+----------+
        |                    |  Latency (cycles) | Iteration|  Initiation Interval  | Trip |          |
        |      Loop Name     |   min   |   max   |  Latency |  achieved |   target  | Count| Pipelined|
        +--------------------+---------+---------+----------+-----------+-----------+------+----------+
        |- VITIS_LOOP_349_1  |       33|       33|         3|          2|          1|    16|       yes|
        +--------------------+---------+---------+----------+-----------+-----------+------+----------+

============================================================
+ Verbose Summary: Synthesis Manager
============================================================
InlineROM: 1
ExposeGlobal: 0
============================================================
+ Verbose Summary: CDFG Model
============================================================
IsTopModel: 0
ResetActiveHigh: 1
IsCombinational: 0
IsDatapathOnly: 0
HasWiredReturn: 1
HasMFsm: 2
HasVarLatency: 1
IsPipeline: 0
IsRtlPipelined: 0
IsInstanceOverlapped: 0
IsDontTouch: 0
HasImplIP: 0
IsGatedGlobalClock: 0

+ Individual pipeline summary: 
  * Pipeline-0: initiation interval (II) = 2, depth = 3


============================================================
+ Verbose Summary: Schedule
============================================================
* Number of FSM states : 3
* Pipeline : 1
  Pipeline-0 : II = 2, D = 3, States = { 1 2 3 }
* Dataflow Pipeline: 0

* FSM state transitions: 
1 --> 2 
2 --> 3 
3 --> 

* FSM state operations: 

State 1 <SV = 0> <Delay = 4.95>
ST_1 : Operation 6 [1/1] (0.00ns)   --->   "%i_234 = alloca i32 1" [src/fpx.c:347->src/fpx.c:147->src/fpx.c:203]   --->   Operation 6 'alloca' 'i_234' <Predicate = true> <Delay = 0.00>
ST_1 : Operation 7 [1/1] (1.58ns)   --->   "%store_ln347 = store i5 0, i5 %i_234" [src/fpx.c:347->src/fpx.c:147->src/fpx.c:203]   --->   Operation 7 'store' 'store_ln347' <Predicate = true> <Delay = 1.58>
ST_1 : Operation 8 [1/1] (1.58ns)   --->   "%br_ln0 = br void %for.inc.i.i84"   --->   Operation 8 'br' 'br_ln0' <Predicate = true> <Delay = 1.58>
ST_1 : Operation 9 [1/1] (0.00ns)   --->   "%i = load i5 %i_234" [src/fpx.c:350->src/fpx.c:147->src/fpx.c:203]   --->   Operation 9 'load' 'i' <Predicate = true> <Delay = 0.00>
ST_1 : Operation 10 [1/1] (1.78ns)   --->   "%icmp_ln349 = icmp_eq  i5 %i, i5 16" [src/fpx.c:349->src/fpx.c:147->src/fpx.c:203]   --->   Operation 10 'icmp' 'icmp_ln349' <Predicate = true> <Delay = 1.78> <CoreInst = "Cmp">   --->   Core 9 'Cmp' <Latency = 0> <II = 1> <Delay = 1.78> <FuncUnit> <Opcode : 'seteq' 'setne' 'setle' 'setge' 'setlt' 'setgt'> <InPorts = 2> <OutPorts = 1>
ST_1 : Operation 11 [1/1] (1.78ns)   --->   "%add_ln349 = add i5 %i, i5 1" [src/fpx.c:349->src/fpx.c:147->src/fpx.c:203]   --->   Operation 11 'add' 'add_ln349' <Predicate = true> <Delay = 1.78> <CoreInst = "Adder">   --->   Core 1 'Adder' <Latency = 0> <II = 1> <Delay = 1.78> <FuncUnit> <Opcode : 'add' 'sub'> <InPorts = 2> <OutPorts = 1>
ST_1 : Operation 12 [1/1] (0.00ns)   --->   "%br_ln349 = br i1 %icmp_ln349, void %for.inc.i.i84.split, void %mp_addfastx2.exit.exitStub" [src/fpx.c:349->src/fpx.c:147->src/fpx.c:203]   --->   Operation 12 'br' 'br_ln349' <Predicate = true> <Delay = 0.00>
ST_1 : Operation 13 [1/1] (0.00ns)   --->   "%trunc_ln350 = trunc i5 %i" [src/fpx.c:350->src/fpx.c:147->src/fpx.c:203]   --->   Operation 13 'trunc' 'trunc_ln350' <Predicate = (!icmp_ln349)> <Delay = 0.00>
ST_1 : Operation 14 [1/1] (0.00ns)   --->   "%zext_ln350 = zext i4 %trunc_ln350" [src/fpx.c:350->src/fpx.c:147->src/fpx.c:203]   --->   Operation 14 'zext' 'zext_ln350' <Predicate = (!icmp_ln349)> <Delay = 0.00>
ST_1 : Operation 15 [1/1] (0.00ns)   --->   "%tt1_addr = getelementptr i64 %tt1, i32 0, i32 %zext_ln350" [src/fpx.c:350->src/fpx.c:147->src/fpx.c:203]   --->   Operation 15 'getelementptr' 'tt1_addr' <Predicate = (!icmp_ln349)> <Delay = 0.00>
ST_1 : Operation 16 [2/2] (3.25ns)   --->   "%tt1_load = load i4 %tt1_addr" [src/fpx.c:350->src/fpx.c:147->src/fpx.c:203]   --->   Operation 16 'load' 'tt1_load' <Predicate = (!icmp_ln349)> <Delay = 3.25> <CoreInst = "RAM">   --->   Core 81 'RAM' <Latency = 1> <II = 1> <Delay = 3.25> <Storage> <Opcode : 'load' 'store'> <Ports = 2> <Width = 64> <Depth = 16> <RAM>
ST_1 : Operation 17 [1/1] (0.00ns)   --->   "%tt2_addr = getelementptr i64 %tt2, i32 0, i32 %zext_ln350" [src/fpx.c:350->src/fpx.c:147->src/fpx.c:203]   --->   Operation 17 'getelementptr' 'tt2_addr' <Predicate = (!icmp_ln349)> <Delay = 0.00>
ST_1 : Operation 18 [2/2] (3.25ns)   --->   "%tt2_load = load i4 %tt2_addr" [src/fpx.c:350->src/fpx.c:147->src/fpx.c:203]   --->   Operation 18 'load' 'tt2_load' <Predicate = (!icmp_ln349)> <Delay = 3.25> <CoreInst = "RAM">   --->   Core 81 'RAM' <Latency = 1> <II = 1> <Delay = 3.25> <Storage> <Opcode : 'load' 'store'> <Ports = 2> <Width = 64> <Depth = 16> <RAM>
ST_1 : Operation 19 [1/1] (1.58ns)   --->   "%store_ln347 = store i5 %add_ln349, i5 %i_234" [src/fpx.c:347->src/fpx.c:147->src/fpx.c:203]   --->   Operation 19 'store' 'store_ln347' <Predicate = (!icmp_ln349)> <Delay = 1.58>

State 2 <SV = 1> <Delay = 6.77>
ST_2 : Operation 20 [1/1] (0.00ns)   --->   "%carry = phi i1 0, void %newFuncRoot, i1 %tmp, void %for.inc.i.i84.split" [src/fpx.c:349->src/fpx.c:147->src/fpx.c:203]   --->   Operation 20 'phi' 'carry' <Predicate = true> <Delay = 0.00>
ST_2 : Operation 21 [1/1] (0.00ns)   --->   "%speclooptripcount_ln0 = speclooptripcount void @_ssdm_op_SpecLoopTripCount, i64 16, i64 16, i64 16"   --->   Operation 21 'speclooptripcount' 'speclooptripcount_ln0' <Predicate = true> <Delay = 0.00>
ST_2 : Operation 22 [1/2] ( I:3.25ns O:3.25ns )   --->   "%tt1_load = load i4 %tt1_addr" [src/fpx.c:350->src/fpx.c:147->src/fpx.c:203]   --->   Operation 22 'load' 'tt1_load' <Predicate = (!icmp_ln349)> <Delay = 3.25> <CoreInst = "RAM">   --->   Core 81 'RAM' <Latency = 1> <II = 1> <Delay = 3.25> <Storage> <Opcode : 'load' 'store'> <Ports = 2> <Width = 64> <Depth = 16> <RAM>
ST_2 : Operation 23 [1/1] (0.00ns)   --->   "%zext_ln350_104 = zext i1 %carry" [src/fpx.c:350->src/fpx.c:147->src/fpx.c:203]   --->   Operation 23 'zext' 'zext_ln350_104' <Predicate = (!icmp_ln349)> <Delay = 0.00>
ST_2 : Operation 24 [1/1] (3.52ns)   --->   "%tempReg = add i64 %tt1_load, i64 %zext_ln350_104" [src/fpx.c:350->src/fpx.c:147->src/fpx.c:203]   --->   Operation 24 'add' 'tempReg' <Predicate = (!icmp_ln349)> <Delay = 3.52> <CoreInst = "Adder">   --->   Core 1 'Adder' <Latency = 0> <II = 1> <Delay = 3.52> <FuncUnit> <Opcode : 'add' 'sub'> <InPorts = 2> <OutPorts = 1>
ST_2 : Operation 25 [1/2] ( I:3.25ns O:3.25ns )   --->   "%tt2_load = load i4 %tt2_addr" [src/fpx.c:350->src/fpx.c:147->src/fpx.c:203]   --->   Operation 25 'load' 'tt2_load' <Predicate = (!icmp_ln349)> <Delay = 3.25> <CoreInst = "RAM">   --->   Core 81 'RAM' <Latency = 1> <II = 1> <Delay = 3.25> <Storage> <Opcode : 'load' 'store'> <Ports = 2> <Width = 64> <Depth = 16> <RAM>
ST_2 : Operation 42 [1/1] (1.58ns)   --->   "%ret_ln0 = ret"   --->   Operation 42 'ret' 'ret_ln0' <Predicate = (icmp_ln349)> <Delay = 1.58>

State 3 <SV = 2> <Delay = 6.77>
ST_3 : Operation 26 [1/1] (0.00ns)   --->   "%specpipeline_ln347 = specpipeline void @_ssdm_op_SpecPipeline, i32 4294967295, i32 0, i32 0, i32 0, void @empty_44" [src/fpx.c:347->src/fpx.c:147->src/fpx.c:203]   --->   Operation 26 'specpipeline' 'specpipeline_ln347' <Predicate = (!icmp_ln349)> <Delay = 0.00>
ST_3 : Operation 27 [1/1] (0.00ns)   --->   "%specloopname_ln349 = specloopname void @_ssdm_op_SpecLoopName, void @empty_32" [src/fpx.c:349->src/fpx.c:147->src/fpx.c:203]   --->   Operation 27 'specloopname' 'specloopname_ln349' <Predicate = (!icmp_ln349)> <Delay = 0.00>
ST_3 : Operation 28 [1/1] (3.52ns)   --->   "%add_ln350 = add i64 %tt2_load, i64 %tempReg" [src/fpx.c:350->src/fpx.c:147->src/fpx.c:203]   --->   Operation 28 'add' 'add_ln350' <Predicate = (!icmp_ln349)> <Delay = 3.52> <CoreInst = "Adder">   --->   Core 1 'Adder' <Latency = 0> <II = 1> <Delay = 3.52> <FuncUnit> <Opcode : 'add' 'sub'> <InPorts = 2> <OutPorts = 1>
ST_3 : Operation 29 [1/1] ( I:3.25ns O:3.25ns )   --->   "%store_ln350 = store i64 %add_ln350, i4 %tt1_addr" [src/fpx.c:350->src/fpx.c:147->src/fpx.c:203]   --->   Operation 29 'store' 'store_ln350' <Predicate = (!icmp_ln349)> <Delay = 3.25> <CoreInst = "RAM">   --->   Core 81 'RAM' <Latency = 1> <II = 1> <Delay = 3.25> <Storage> <Opcode : 'load' 'store'> <Ports = 2> <Width = 64> <Depth = 16> <RAM>
ST_3 : Operation 30 [1/1] (0.00ns) (grouped into LUT with out node xor_ln350_148)   --->   "%xor_ln350 = xor i64 %add_ln350, i64 %tempReg" [src/fpx.c:350->src/fpx.c:147->src/fpx.c:203]   --->   Operation 30 'xor' 'xor_ln350' <Predicate = (!icmp_ln349)> <Delay = 0.00> <CoreInst = "LogicGate">   --->   Core 74 'LogicGate' <Latency = 0> <II = 1> <Delay = 0.99> <FuncUnit> <Opcode : 'and' 'or' 'xor'> <InPorts = 2> <OutPorts = 1>
ST_3 : Operation 31 [1/1] (0.00ns) (grouped into LUT with out node xor_ln350_148)   --->   "%xor_ln350_146 = xor i64 %tt2_load, i64 %tempReg" [src/fpx.c:350->src/fpx.c:147->src/fpx.c:203]   --->   Operation 31 'xor' 'xor_ln350_146' <Predicate = (!icmp_ln349)> <Delay = 0.00> <CoreInst = "LogicGate">   --->   Core 74 'LogicGate' <Latency = 0> <II = 1> <Delay = 0.99> <FuncUnit> <Opcode : 'and' 'or' 'xor'> <InPorts = 2> <OutPorts = 1>
ST_3 : Operation 32 [1/1] (0.00ns) (grouped into LUT with out node xor_ln350_148)   --->   "%or_ln350 = or i64 %xor_ln350, i64 %xor_ln350_146" [src/fpx.c:350->src/fpx.c:147->src/fpx.c:203]   --->   Operation 32 'or' 'or_ln350' <Predicate = (!icmp_ln349)> <Delay = 0.00> <CoreInst = "LogicGate">   --->   Core 74 'LogicGate' <Latency = 0> <II = 1> <Delay = 0.99> <FuncUnit> <Opcode : 'and' 'or' 'xor'> <InPorts = 2> <OutPorts = 1>
ST_3 : Operation 33 [1/1] (0.00ns) (grouped into LUT with out node or_ln350_56)   --->   "%bit_sel7 = bitselect i1 @_ssdm_op_BitSelect.i1.i64.i64, i64 %tempReg, i64 63" [src/fpx.c:350->src/fpx.c:147->src/fpx.c:203]   --->   Operation 33 'bitselect' 'bit_sel7' <Predicate = (!icmp_ln349)> <Delay = 0.00>
ST_3 : Operation 34 [1/1] (0.00ns) (grouped into LUT with out node or_ln350_56)   --->   "%xor_ln350_147 = xor i1 %bit_sel7, i1 1" [src/fpx.c:350->src/fpx.c:147->src/fpx.c:203]   --->   Operation 34 'xor' 'xor_ln350_147' <Predicate = (!icmp_ln349)> <Delay = 0.00> <CoreInst = "LogicGate">   --->   Core 74 'LogicGate' <Latency = 0> <II = 1> <Delay = 0.97> <FuncUnit> <Opcode : 'and' 'or' 'xor'> <InPorts = 2> <OutPorts = 1>
ST_3 : Operation 35 [1/1] (0.00ns) (grouped into LUT with out node or_ln350_56)   --->   "%trunc_ln350_66 = trunc i64 %tempReg" [src/fpx.c:350->src/fpx.c:147->src/fpx.c:203]   --->   Operation 35 'trunc' 'trunc_ln350_66' <Predicate = (!icmp_ln349)> <Delay = 0.00>
ST_3 : Operation 36 [1/1] (0.00ns) (grouped into LUT with out node or_ln350_56)   --->   "%xor_ln350_s = bitconcatenate i64 @_ssdm_op_BitConcatenate.i64.i1.i63, i1 %xor_ln350_147, i63 %trunc_ln350_66" [src/fpx.c:350->src/fpx.c:147->src/fpx.c:203]   --->   Operation 36 'bitconcatenate' 'xor_ln350_s' <Predicate = (!icmp_ln349)> <Delay = 0.00>
ST_3 : Operation 37 [1/1] (0.00ns) (grouped into LUT with out node or_ln350_56)   --->   "%and_ln350 = and i64 %tt1_load, i64 %xor_ln350_s" [src/fpx.c:350->src/fpx.c:147->src/fpx.c:203]   --->   Operation 37 'and' 'and_ln350' <Predicate = (!icmp_ln349)> <Delay = 0.00> <CoreInst = "LogicGate">   --->   Core 74 'LogicGate' <Latency = 0> <II = 1> <Delay = 0.99> <FuncUnit> <Opcode : 'and' 'or' 'xor'> <InPorts = 2> <OutPorts = 1>
ST_3 : Operation 38 [1/1] (0.99ns) (out node of the LUT)   --->   "%xor_ln350_148 = xor i64 %or_ln350, i64 %add_ln350" [src/fpx.c:350->src/fpx.c:147->src/fpx.c:203]   --->   Operation 38 'xor' 'xor_ln350_148' <Predicate = (!icmp_ln349)> <Delay = 0.99> <CoreInst = "LogicGate">   --->   Core 74 'LogicGate' <Latency = 0> <II = 1> <Delay = 0.99> <FuncUnit> <Opcode : 'and' 'or' 'xor'> <InPorts = 2> <OutPorts = 1>
ST_3 : Operation 39 [1/1] (0.99ns) (out node of the LUT)   --->   "%or_ln350_56 = or i64 %xor_ln350_148, i64 %and_ln350" [src/fpx.c:350->src/fpx.c:147->src/fpx.c:203]   --->   Operation 39 'or' 'or_ln350_56' <Predicate = (!icmp_ln349)> <Delay = 0.99> <CoreInst = "LogicGate">   --->   Core 74 'LogicGate' <Latency = 0> <II = 1> <Delay = 0.99> <FuncUnit> <Opcode : 'and' 'or' 'xor'> <InPorts = 2> <OutPorts = 1>
ST_3 : Operation 40 [1/1] (0.00ns)   --->   "%tmp = bitselect i1 @_ssdm_op_BitSelect.i1.i64.i32, i64 %or_ln350_56, i32 63" [src/fpx.c:349->src/fpx.c:147->src/fpx.c:203]   --->   Operation 40 'bitselect' 'tmp' <Predicate = (!icmp_ln349)> <Delay = 0.00>
ST_3 : Operation 41 [1/1] (0.00ns)   --->   "%br_ln349 = br void %for.inc.i.i84" [src/fpx.c:349->src/fpx.c:147->src/fpx.c:203]   --->   Operation 41 'br' 'br_ln349' <Predicate = (!icmp_ln349)> <Delay = 0.00>


============================================================
+ Verbose Summary: Timing violations
============================================================
Target clock period: 10.000ns, clock uncertainty: 2.700ns.

 <State 1>: 4.956ns
The critical path consists of the following:
	'store' operation 0 bit ('store_ln347', src/fpx.c:347->src/fpx.c:147->src/fpx.c:203) of constant 0 on local variable 'i', src/fpx.c:347->src/fpx.c:147->src/fpx.c:203 [4]  (1.588 ns)
	'load' operation 5 bit ('i', src/fpx.c:350->src/fpx.c:147->src/fpx.c:203) on local variable 'i', src/fpx.c:347->src/fpx.c:147->src/fpx.c:203 [8]  (0.000 ns)
	'add' operation 5 bit ('add_ln349', src/fpx.c:349->src/fpx.c:147->src/fpx.c:203) [11]  (1.780 ns)
	'store' operation 0 bit ('store_ln347', src/fpx.c:347->src/fpx.c:147->src/fpx.c:203) of variable 'add_ln349', src/fpx.c:349->src/fpx.c:147->src/fpx.c:203 on local variable 'i', src/fpx.c:347->src/fpx.c:147->src/fpx.c:203 [37]  (1.588 ns)

 <State 2>: 6.774ns
The critical path consists of the following:
	'load' operation 64 bit ('tt1_load', src/fpx.c:350->src/fpx.c:147->src/fpx.c:203) on array 'tt1' [19]  (3.254 ns)
	'add' operation 64 bit ('tempReg', src/fpx.c:350->src/fpx.c:147->src/fpx.c:203) [21]  (3.520 ns)

 <State 3>: 6.774ns
The critical path consists of the following:
	'add' operation 64 bit ('x', src/fpx.c:350->src/fpx.c:147->src/fpx.c:203) [24]  (3.520 ns)
	'store' operation 0 bit ('store_ln350', src/fpx.c:350->src/fpx.c:147->src/fpx.c:203) of variable 'x', src/fpx.c:350->src/fpx.c:147->src/fpx.c:203 on array 'tt1' [25]  (3.254 ns)


============================================================
+ Verbose Summary: Binding
============================================================
N/A
* FSMD analyzer results:
  - Output states:
 - Input state : 
  - Chain level:
	State 1
	State 2
	State 3


============================================================
+ Verbose Summary: Datapath Resource usage 
============================================================
N/A
