

================================================================
== Vitis HLS Report for 'fp2mul503_mont_78_1_Pipeline_VITIS_LOOP_199_1'
================================================================
* Date:           Tue May 20 14:33:13 2025

* Version:        2024.2.2 (Build 6049644 on Mar  5 2025)
* Project:        sikep503_hls
* Solution:       solution1 (Vivado IP Flow Target)
* Product family: zynq
* Target device:  xc7z020-clg484-1


================================================================
== Performance Estimates
================================================================
+ Timing: 
    * Summary: 
    +--------+----------+----------+------------+
    |  Clock |  Target  | Estimated| Uncertainty|
    +--------+----------+----------+------------+
    |ap_clk  |  10.00 ns|  6.774 ns|     2.70 ns|
    +--------+----------+----------+------------+

+ Latency: 
    * Summary: 
    +---------+---------+----------+----------+-----+-----+------------------------------------------------+
    |  Latency (cycles) |  Latency (absolute) |  Interval |                    Pipeline                    |
    |   min   |   max   |    min   |    max   | min | max |                      Type                      |
    +---------+---------+----------+----------+-----+-----+------------------------------------------------+
    |       20|       20|  0.200 us|  0.200 us|   18|   18|  loop auto-rewind stp (delay=0 clock cycles(s))|
    +---------+---------+----------+----------+-----+-----+------------------------------------------------+

    + Detail: 
        * Instance: 
        N/A

        * Loop: 
        +--------------------+---------+---------+----------+-----------+-----------+------+----------+
        |                    |  Latency (cycles) | Iteration|  Initiation Interval  | Trip |          |
        |      Loop Name     |   min   |   max   |  Latency |  achieved |   target  | Count| Pipelined|
        +--------------------+---------+---------+----------+-----------+-----------+------+----------+
        |- VITIS_LOOP_199_1  |       18|       18|         4|          2|          1|     8|       yes|
        +--------------------+---------+---------+----------+-----------+-----------+------+----------+

============================================================
+ Verbose Summary: Synthesis Manager
============================================================
InlineROM: 1
ExposeGlobal: 0
============================================================
+ Verbose Summary: CDFG Model
============================================================
IsTopModel: 0
ResetActiveHigh: 1
IsCombinational: 0
IsDatapathOnly: 0
HasWiredReturn: 1
HasMFsm: 2
HasVarLatency: 1
IsPipeline: 0
IsRtlPipelined: 0
IsInstanceOverlapped: 0
IsDontTouch: 0
HasImplIP: 0
IsGatedGlobalClock: 0

+ Individual pipeline summary: 
  * Pipeline-0: initiation interval (II) = 2, depth = 5


============================================================
+ Verbose Summary: Schedule
============================================================
* Number of FSM states : 5
* Pipeline : 1
  Pipeline-0 : II = 2, D = 5, States = { 1 2 3 4 5 }
* Dataflow Pipeline: 0

* FSM state transitions: 
1 --> 2 
2 --> 3 
3 --> 4 
4 --> 5 
5 --> 

* FSM state operations: 

State 1 <SV = 0> <Delay = 1.58>
ST_1 : Operation 7 [1/1] (0.00ns)   --->   "%reuse_addr_reg = alloca i32 1"   --->   Operation 7 'alloca' 'reuse_addr_reg' <Predicate = true> <Delay = 0.00>
ST_1 : Operation 8 [1/1] (0.00ns)   --->   "%reuse_reg = alloca i32 1"   --->   Operation 8 'alloca' 'reuse_reg' <Predicate = true> <Delay = 0.00>
ST_1 : Operation 9 [1/1] (0.00ns)   --->   "%i_188 = alloca i32 1" [src/fpx.c:192]   --->   Operation 9 'alloca' 'i_188' <Predicate = true> <Delay = 0.00>
ST_1 : Operation 10 [1/1] (0.00ns)   --->   "%sext_ln191_read = read i1 @_ssdm_op_Read.ap_auto.i1, i1 %sext_ln191"   --->   Operation 10 'read' 'sext_ln191_read' <Predicate = true> <Delay = 0.00>
ST_1 : Operation 11 [1/1] (0.99ns)   --->   "%sext_ln191_cast = select i1 %sext_ln191_read, i64 18446744073709551615, i64 0"   --->   Operation 11 'select' 'sext_ln191_cast' <Predicate = true> <Delay = 0.99> <CoreInst = "Sel">   --->   Core 73 'Sel' <Latency = 0> <II = 1> <Delay = 0.99> <FuncUnit> <Opcode : 'select'> <InPorts = 3> <OutPorts = 1>
ST_1 : Operation 12 [1/1] (1.58ns)   --->   "%store_ln192 = store i4 0, i4 %i_188" [src/fpx.c:192]   --->   Operation 12 'store' 'store_ln192' <Predicate = true> <Delay = 1.58>
ST_1 : Operation 13 [1/1] (1.58ns)   --->   "%store_ln0 = store i64 0, i64 %reuse_reg"   --->   Operation 13 'store' 'store_ln0' <Predicate = true> <Delay = 1.58>
ST_1 : Operation 14 [1/1] (1.58ns)   --->   "%store_ln0 = store i32 4294967295, i32 %reuse_addr_reg"   --->   Operation 14 'store' 'store_ln0' <Predicate = true> <Delay = 1.58>
ST_1 : Operation 15 [1/1] (1.58ns)   --->   "%br_ln0 = br void %for.inc"   --->   Operation 15 'br' 'br_ln0' <Predicate = true> <Delay = 1.58>

State 2 <SV = 1> <Delay = 3.32>
ST_2 : Operation 16 [1/1] (0.00ns)   --->   "%i = load i4 %i_188" [src/fpx.c:200]   --->   Operation 16 'load' 'i' <Predicate = true> <Delay = 0.00>
ST_2 : Operation 17 [1/1] (1.73ns)   --->   "%icmp_ln199 = icmp_eq  i4 %i, i4 8" [src/fpx.c:199]   --->   Operation 17 'icmp' 'icmp_ln199' <Predicate = true> <Delay = 1.73> <CoreInst = "Cmp">   --->   Core 9 'Cmp' <Latency = 0> <II = 1> <Delay = 1.73> <FuncUnit> <Opcode : 'seteq' 'setne' 'setle' 'setge' 'setlt' 'setgt'> <InPorts = 2> <OutPorts = 1>
ST_2 : Operation 18 [1/1] (0.00ns)   --->   "%br_ln199 = br i1 %icmp_ln199, void %for.inc.split, void %for.end.exitStub" [src/fpx.c:199]   --->   Operation 18 'br' 'br_ln199' <Predicate = true> <Delay = 0.00>
ST_2 : Operation 19 [1/1] (0.00ns)   --->   "%trunc_ln200 = trunc i4 %i" [src/fpx.c:200]   --->   Operation 19 'trunc' 'trunc_ln200' <Predicate = (!icmp_ln199)> <Delay = 0.00>
ST_2 : Operation 20 [1/1] (0.00ns)   --->   "%zext_ln200 = zext i3 %trunc_ln200" [src/fpx.c:200]   --->   Operation 20 'zext' 'zext_ln200' <Predicate = (!icmp_ln199)> <Delay = 0.00>
ST_2 : Operation 21 [1/1] (0.00ns)   --->   "%zext_ln200_5_cast = bitconcatenate i4 @_ssdm_op_BitConcatenate.i4.i1.i3, i1 1, i3 %trunc_ln200" [src/fpx.c:200]   --->   Operation 21 'bitconcatenate' 'zext_ln200_5_cast' <Predicate = (!icmp_ln199)> <Delay = 0.00>
ST_2 : Operation 22 [1/1] (0.00ns)   --->   "%zext_ln200_9 = zext i4 %zext_ln200_5_cast" [src/fpx.c:200]   --->   Operation 22 'zext' 'zext_ln200_9' <Predicate = (!icmp_ln199)> <Delay = 0.00>
ST_2 : Operation 23 [1/1] (0.00ns)   --->   "%tt3_addr = getelementptr i64 %tt3, i32 0, i32 %zext_ln200_9" [src/fpx.c:200]   --->   Operation 23 'getelementptr' 'tt3_addr' <Predicate = (!icmp_ln199)> <Delay = 0.00>
ST_2 : Operation 24 [1/1] (0.00ns)   --->   "%reuse_addr_reg_load = load i32 %reuse_addr_reg"   --->   Operation 24 'load' 'reuse_addr_reg_load' <Predicate = (!icmp_ln199)> <Delay = 0.00>
ST_2 : Operation 25 [2/2] (3.25ns)   --->   "%tt3_load = load i4 %tt3_addr" [src/fpx.c:200]   --->   Operation 25 'load' 'tt3_load' <Predicate = (!icmp_ln199)> <Delay = 3.25> <CoreInst = "RAM">   --->   Core 81 'RAM' <Latency = 1> <II = 1> <Delay = 3.25> <Storage> <Opcode : 'load' 'store'> <Ports = 2> <Width = 64> <Depth = 16> <RAM>
ST_2 : Operation 26 [1/1] (2.55ns)   --->   "%addr_cmp = icmp_eq  i32 %reuse_addr_reg_load, i32 %zext_ln200_9" [src/fpx.c:200]   --->   Operation 26 'icmp' 'addr_cmp' <Predicate = (!icmp_ln199)> <Delay = 2.55> <CoreInst = "Cmp">   --->   Core 9 'Cmp' <Latency = 0> <II = 1> <Delay = 2.55> <FuncUnit> <Opcode : 'seteq' 'setne' 'setle' 'setge' 'setlt' 'setgt'> <InPorts = 2> <OutPorts = 1>
ST_2 : Operation 27 [1/1] (0.00ns)   --->   "%p503_1_addr = getelementptr i64 %p503_1, i32 0, i32 %zext_ln200" [src/fpx.c:200]   --->   Operation 27 'getelementptr' 'p503_1_addr' <Predicate = (!icmp_ln199)> <Delay = 0.00>
ST_2 : Operation 28 [2/2] (2.32ns)   --->   "%p503_1_load = load i3 %p503_1_addr" [src/fpx.c:200]   --->   Operation 28 'load' 'p503_1_load' <Predicate = (!icmp_ln199)> <Delay = 2.32> <CoreInst = "ROM">   --->   Core 94 'ROM' <Latency = 1> <II = 1> <Delay = 2.32> <Storage> <Opcode : 'load'> <Ports = 0> <Width = 64> <Depth = 8> <ROM>
ST_2 : Operation 29 [1/1] (1.58ns)   --->   "%store_ln200 = store i32 %zext_ln200_9, i32 %reuse_addr_reg" [src/fpx.c:200]   --->   Operation 29 'store' 'store_ln200' <Predicate = (!icmp_ln199)> <Delay = 1.58>

State 3 <SV = 2> <Delay = 3.32>
ST_3 : Operation 30 [1/1] (1.73ns)   --->   "%add_ln199 = add i4 %i, i4 1" [src/fpx.c:199]   --->   Operation 30 'add' 'add_ln199' <Predicate = true> <Delay = 1.73> <CoreInst = "Adder">   --->   Core 1 'Adder' <Latency = 0> <II = 1> <Delay = 1.73> <FuncUnit> <Opcode : 'add' 'sub'> <InPorts = 2> <OutPorts = 1>
ST_3 : Operation 31 [1/2] ( I:3.25ns O:3.25ns )   --->   "%tt3_load = load i4 %tt3_addr" [src/fpx.c:200]   --->   Operation 31 'load' 'tt3_load' <Predicate = (!icmp_ln199)> <Delay = 3.25> <CoreInst = "RAM">   --->   Core 81 'RAM' <Latency = 1> <II = 1> <Delay = 3.25> <Storage> <Opcode : 'load' 'store'> <Ports = 2> <Width = 64> <Depth = 16> <RAM>
ST_3 : Operation 32 [1/2] ( I:2.32ns O:2.32ns )   --->   "%p503_1_load = load i3 %p503_1_addr" [src/fpx.c:200]   --->   Operation 32 'load' 'p503_1_load' <Predicate = (!icmp_ln199)> <Delay = 2.32> <CoreInst = "ROM">   --->   Core 94 'ROM' <Latency = 1> <II = 1> <Delay = 2.32> <Storage> <Opcode : 'load'> <Ports = 0> <Width = 64> <Depth = 8> <ROM>
ST_3 : Operation 33 [1/1] (0.99ns)   --->   "%and_ln200 = and i64 %p503_1_load, i64 %sext_ln191_cast" [src/fpx.c:200]   --->   Operation 33 'and' 'and_ln200' <Predicate = (!icmp_ln199)> <Delay = 0.99> <CoreInst = "LogicGate">   --->   Core 74 'LogicGate' <Latency = 0> <II = 1> <Delay = 0.99> <FuncUnit> <Opcode : 'and' 'or' 'xor'> <InPorts = 2> <OutPorts = 1>
ST_3 : Operation 34 [1/1] (1.58ns)   --->   "%store_ln192 = store i4 %add_ln199, i4 %i_188" [src/fpx.c:192]   --->   Operation 34 'store' 'store_ln192' <Predicate = (!icmp_ln199)> <Delay = 1.58>

State 4 <SV = 3> <Delay = 5.00>
ST_4 : Operation 35 [1/1] (0.00ns)   --->   "%borrow = phi i1 0, void %newFuncRoot, i1 %tmp, void %for.inc.split" [src/fpx.c:199]   --->   Operation 35 'phi' 'borrow' <Predicate = true> <Delay = 0.00>
ST_4 : Operation 36 [1/1] (0.00ns)   --->   "%reuse_reg_load = load i64 %reuse_reg"   --->   Operation 36 'load' 'reuse_reg_load' <Predicate = (!icmp_ln199 & addr_cmp)> <Delay = 0.00>
ST_4 : Operation 37 [1/1] (1.48ns)   --->   "%reuse_select = select i1 %addr_cmp, i64 %reuse_reg_load, i64 %tt3_load" [src/fpx.c:200]   --->   Operation 37 'select' 'reuse_select' <Predicate = (!icmp_ln199)> <Delay = 1.48> <CoreInst = "Sel">   --->   Core 73 'Sel' <Latency = 0> <II = 1> <Delay = 1.48> <FuncUnit> <Opcode : 'select'> <InPorts = 3> <OutPorts = 1>
ST_4 : Operation 38 [1/1] (0.00ns)   --->   "%zext_ln200_6 = zext i1 %borrow" [src/fpx.c:200]   --->   Operation 38 'zext' 'zext_ln200_6' <Predicate = (!icmp_ln199)> <Delay = 0.00>
ST_4 : Operation 39 [1/1] (3.52ns)   --->   "%tempReg = add i64 %reuse_select, i64 %zext_ln200_6" [src/fpx.c:200]   --->   Operation 39 'add' 'tempReg' <Predicate = (!icmp_ln199)> <Delay = 3.52> <CoreInst = "Adder">   --->   Core 1 'Adder' <Latency = 0> <II = 1> <Delay = 3.52> <FuncUnit> <Opcode : 'add' 'sub'> <InPorts = 2> <OutPorts = 1>
ST_4 : Operation 58 [1/1] (1.58ns)   --->   "%ret_ln0 = ret"   --->   Operation 58 'ret' 'ret_ln0' <Predicate = (icmp_ln199)> <Delay = 1.58>

State 5 <SV = 4> <Delay = 6.77>
ST_5 : Operation 40 [1/1] (0.00ns)   --->   "%specpipeline_ln192 = specpipeline void @_ssdm_op_SpecPipeline, i32 4294967295, i32 0, i32 0, i32 0, void @empty_44" [src/fpx.c:192]   --->   Operation 40 'specpipeline' 'specpipeline_ln192' <Predicate = (!icmp_ln199)> <Delay = 0.00>
ST_5 : Operation 41 [1/1] (0.00ns)   --->   "%speclooptripcount_ln192 = speclooptripcount void @_ssdm_op_SpecLoopTripCount, i64 8, i64 8, i64 8" [src/fpx.c:192]   --->   Operation 41 'speclooptripcount' 'speclooptripcount_ln192' <Predicate = (!icmp_ln199)> <Delay = 0.00>
ST_5 : Operation 42 [1/1] (0.00ns)   --->   "%specloopname_ln199 = specloopname void @_ssdm_op_SpecLoopName, void @empty_33" [src/fpx.c:199]   --->   Operation 42 'specloopname' 'specloopname_ln199' <Predicate = (!icmp_ln199)> <Delay = 0.00>
ST_5 : Operation 43 [1/1] (3.52ns)   --->   "%add_ln200 = add i64 %and_ln200, i64 %tempReg" [src/fpx.c:200]   --->   Operation 43 'add' 'add_ln200' <Predicate = (!icmp_ln199)> <Delay = 3.52> <CoreInst = "Adder">   --->   Core 1 'Adder' <Latency = 0> <II = 1> <Delay = 3.52> <FuncUnit> <Opcode : 'add' 'sub'> <InPorts = 2> <OutPorts = 1>
ST_5 : Operation 44 [1/1] ( I:3.25ns O:3.25ns )   --->   "%store_ln200 = store i64 %add_ln200, i4 %tt3_addr" [src/fpx.c:200]   --->   Operation 44 'store' 'store_ln200' <Predicate = (!icmp_ln199)> <Delay = 3.25> <CoreInst = "RAM">   --->   Core 81 'RAM' <Latency = 1> <II = 1> <Delay = 3.25> <Storage> <Opcode : 'load' 'store'> <Ports = 2> <Width = 64> <Depth = 16> <RAM>
ST_5 : Operation 45 [1/1] (1.58ns)   --->   "%store_ln200 = store i64 %add_ln200, i64 %reuse_reg" [src/fpx.c:200]   --->   Operation 45 'store' 'store_ln200' <Predicate = (!icmp_ln199)> <Delay = 1.58>
ST_5 : Operation 46 [1/1] (0.00ns) (grouped into LUT with out node xor_ln200_9)   --->   "%xor_ln200 = xor i64 %add_ln200, i64 %tempReg" [src/fpx.c:200]   --->   Operation 46 'xor' 'xor_ln200' <Predicate = (!icmp_ln199)> <Delay = 0.00> <CoreInst = "LogicGate">   --->   Core 74 'LogicGate' <Latency = 0> <II = 1> <Delay = 0.99> <FuncUnit> <Opcode : 'and' 'or' 'xor'> <InPorts = 2> <OutPorts = 1>
ST_5 : Operation 47 [1/1] (0.00ns) (grouped into LUT with out node xor_ln200_9)   --->   "%xor_ln200_7 = xor i64 %and_ln200, i64 %tempReg" [src/fpx.c:200]   --->   Operation 47 'xor' 'xor_ln200_7' <Predicate = (!icmp_ln199)> <Delay = 0.00> <CoreInst = "LogicGate">   --->   Core 74 'LogicGate' <Latency = 0> <II = 1> <Delay = 0.99> <FuncUnit> <Opcode : 'and' 'or' 'xor'> <InPorts = 2> <OutPorts = 1>
ST_5 : Operation 48 [1/1] (0.00ns) (grouped into LUT with out node xor_ln200_9)   --->   "%or_ln200 = or i64 %xor_ln200, i64 %xor_ln200_7" [src/fpx.c:200]   --->   Operation 48 'or' 'or_ln200' <Predicate = (!icmp_ln199)> <Delay = 0.00> <CoreInst = "LogicGate">   --->   Core 74 'LogicGate' <Latency = 0> <II = 1> <Delay = 0.99> <FuncUnit> <Opcode : 'and' 'or' 'xor'> <InPorts = 2> <OutPorts = 1>
ST_5 : Operation 49 [1/1] (0.00ns) (grouped into LUT with out node or_ln200_3)   --->   "%bit_sel4 = bitselect i1 @_ssdm_op_BitSelect.i1.i64.i64, i64 %tempReg, i64 63" [src/fpx.c:200]   --->   Operation 49 'bitselect' 'bit_sel4' <Predicate = (!icmp_ln199)> <Delay = 0.00>
ST_5 : Operation 50 [1/1] (0.00ns) (grouped into LUT with out node or_ln200_3)   --->   "%xor_ln200_10 = xor i1 %bit_sel4, i1 1" [src/fpx.c:200]   --->   Operation 50 'xor' 'xor_ln200_10' <Predicate = (!icmp_ln199)> <Delay = 0.00> <CoreInst = "LogicGate">   --->   Core 74 'LogicGate' <Latency = 0> <II = 1> <Delay = 0.97> <FuncUnit> <Opcode : 'and' 'or' 'xor'> <InPorts = 2> <OutPorts = 1>
ST_5 : Operation 51 [1/1] (0.00ns) (grouped into LUT with out node or_ln200_3)   --->   "%trunc_ln200_6 = trunc i64 %tempReg" [src/fpx.c:200]   --->   Operation 51 'trunc' 'trunc_ln200_6' <Predicate = (!icmp_ln199)> <Delay = 0.00>
ST_5 : Operation 52 [1/1] (0.00ns) (grouped into LUT with out node or_ln200_3)   --->   "%xor_ln200_8 = bitconcatenate i64 @_ssdm_op_BitConcatenate.i64.i1.i63, i1 %xor_ln200_10, i63 %trunc_ln200_6" [src/fpx.c:200]   --->   Operation 52 'bitconcatenate' 'xor_ln200_8' <Predicate = (!icmp_ln199)> <Delay = 0.00>
ST_5 : Operation 53 [1/1] (0.00ns) (grouped into LUT with out node or_ln200_3)   --->   "%and_ln200_3 = and i64 %reuse_select, i64 %xor_ln200_8" [src/fpx.c:200]   --->   Operation 53 'and' 'and_ln200_3' <Predicate = (!icmp_ln199)> <Delay = 0.00> <CoreInst = "LogicGate">   --->   Core 74 'LogicGate' <Latency = 0> <II = 1> <Delay = 0.99> <FuncUnit> <Opcode : 'and' 'or' 'xor'> <InPorts = 2> <OutPorts = 1>
ST_5 : Operation 54 [1/1] (0.99ns) (out node of the LUT)   --->   "%xor_ln200_9 = xor i64 %or_ln200, i64 %add_ln200" [src/fpx.c:200]   --->   Operation 54 'xor' 'xor_ln200_9' <Predicate = (!icmp_ln199)> <Delay = 0.99> <CoreInst = "LogicGate">   --->   Core 74 'LogicGate' <Latency = 0> <II = 1> <Delay = 0.99> <FuncUnit> <Opcode : 'and' 'or' 'xor'> <InPorts = 2> <OutPorts = 1>
ST_5 : Operation 55 [1/1] (0.99ns) (out node of the LUT)   --->   "%or_ln200_3 = or i64 %xor_ln200_9, i64 %and_ln200_3" [src/fpx.c:200]   --->   Operation 55 'or' 'or_ln200_3' <Predicate = (!icmp_ln199)> <Delay = 0.99> <CoreInst = "LogicGate">   --->   Core 74 'LogicGate' <Latency = 0> <II = 1> <Delay = 0.99> <FuncUnit> <Opcode : 'and' 'or' 'xor'> <InPorts = 2> <OutPorts = 1>
ST_5 : Operation 56 [1/1] (0.00ns)   --->   "%tmp = bitselect i1 @_ssdm_op_BitSelect.i1.i64.i32, i64 %or_ln200_3, i32 63" [src/fpx.c:199]   --->   Operation 56 'bitselect' 'tmp' <Predicate = (!icmp_ln199)> <Delay = 0.00>
ST_5 : Operation 57 [1/1] (0.00ns)   --->   "%br_ln199 = br void %for.inc" [src/fpx.c:199]   --->   Operation 57 'br' 'br_ln199' <Predicate = (!icmp_ln199)> <Delay = 0.00>


============================================================
+ Verbose Summary: Timing violations
============================================================
Target clock period: 10.000ns, clock uncertainty: 2.700ns.

 <State 1>: 1.588ns
The critical path consists of the following:
	'alloca' operation 4 bit ('i', src/fpx.c:192) [6]  (0.000 ns)
	'store' operation 0 bit ('store_ln192', src/fpx.c:192) of constant 0 on local variable 'i', src/fpx.c:192 [9]  (1.588 ns)

 <State 2>: 3.323ns
The critical path consists of the following:
	'load' operation 4 bit ('i', src/fpx.c:200) on local variable 'i', src/fpx.c:192 [15]  (0.000 ns)
	'icmp' operation 1 bit ('icmp_ln199', src/fpx.c:199) [16]  (1.735 ns)
	'store' operation 0 bit ('store_ln200', src/fpx.c:200) of variable 'zext_ln200_9', src/fpx.c:200 on local variable 'reuse_addr_reg' [41]  (1.588 ns)

 <State 3>: 3.323ns
The critical path consists of the following:
	'add' operation 4 bit ('add_ln199', src/fpx.c:199) [17]  (1.735 ns)
	'store' operation 0 bit ('store_ln192', src/fpx.c:192) of variable 'add_ln199', src/fpx.c:199 on local variable 'i', src/fpx.c:192 [53]  (1.588 ns)

 <State 4>: 5.001ns
The critical path consists of the following:
	'load' operation 64 bit ('reuse_reg_load') on local variable 'reuse_reg' [28]  (0.000 ns)
	'select' operation 64 bit ('reuse_select', src/fpx.c:200) [32]  (1.481 ns)
	'add' operation 64 bit ('tempReg', src/fpx.c:200) [34]  (3.520 ns)

 <State 5>: 6.774ns
The critical path consists of the following:
	'add' operation 64 bit ('x', src/fpx.c:200) [38]  (3.520 ns)
	'store' operation 0 bit ('store_ln200', src/fpx.c:200) of variable 'x', src/fpx.c:200 on array 'tt3' [39]  (3.254 ns)


============================================================
+ Verbose Summary: Binding
============================================================
N/A
* FSMD analyzer results:
  - Output states:
 - Input state : 
  - Chain level:
	State 1
	State 2
	State 3
	State 4
	State 5


============================================================
+ Verbose Summary: Datapath Resource usage 
============================================================
N/A
