

================================================================
== Vitis HLS Report for 'fp2mul503_mont_2_Pipeline_VITIS_LOOP_349_1'
================================================================
* Date:           Tue May 20 14:30:44 2025

* Version:        2024.2.2 (Build 6049644 on Mar  5 2025)
* Project:        sikep503_hls
* Solution:       solution1 (Vivado IP Flow Target)
* Product family: zynq
* Target device:  xc7z020-clg484-1


================================================================
== Performance Estimates
================================================================
+ Timing: 
    * Summary: 
    +--------+----------+----------+------------+
    |  Clock |  Target  | Estimated| Uncertainty|
    +--------+----------+----------+------------+
    |ap_clk  |  10.00 ns|  6.774 ns|     2.70 ns|
    +--------+----------+----------+------------+

+ Latency: 
    * Summary: 
    +---------+---------+----------+----------+-----+-----+------------------------------------------------+
    |  Latency (cycles) |  Latency (absolute) |  Interval |                    Pipeline                    |
    |   min   |   max   |    min   |    max   | min | max |                      Type                      |
    +---------+---------+----------+----------+-----+-----+------------------------------------------------+
    |       19|       19|  0.190 us|  0.190 us|   18|   18|  loop auto-rewind stp (delay=0 clock cycles(s))|
    +---------+---------+----------+----------+-----+-----+------------------------------------------------+

    + Detail: 
        * Instance: 
        N/A

        * Loop: 
        +--------------------+---------+---------+----------+-----------+-----------+------+----------+
        |                    |  Latency (cycles) | Iteration|  Initiation Interval  | Trip |          |
        |      Loop Name     |   min   |   max   |  Latency |  achieved |   target  | Count| Pipelined|
        +--------------------+---------+---------+----------+-----------+-----------+------+----------+
        |- VITIS_LOOP_349_1  |       17|       17|         3|          2|          1|     8|       yes|
        +--------------------+---------+---------+----------+-----------+-----------+------+----------+

============================================================
+ Verbose Summary: Synthesis Manager
============================================================
InlineROM: 1
ExposeGlobal: 0
============================================================
+ Verbose Summary: CDFG Model
============================================================
IsTopModel: 0
ResetActiveHigh: 1
IsCombinational: 0
IsDatapathOnly: 0
HasWiredReturn: 1
HasMFsm: 2
HasVarLatency: 1
IsPipeline: 0
IsRtlPipelined: 0
IsInstanceOverlapped: 0
IsDontTouch: 0
HasImplIP: 0
IsGatedGlobalClock: 0

+ Individual pipeline summary: 
  * Pipeline-0: initiation interval (II) = 2, depth = 3


============================================================
+ Verbose Summary: Schedule
============================================================
* Number of FSM states : 3
* Pipeline : 1
  Pipeline-0 : II = 2, D = 3, States = { 1 2 3 }
* Dataflow Pipeline: 0

* FSM state transitions: 
1 --> 2 
2 --> 3 
3 --> 

* FSM state operations: 

State 1 <SV = 0> <Delay = 4.91>
ST_1 : Operation 6 [1/1] (0.00ns)   --->   "%i = alloca i32 1" [src/fpx.c:347->src/fpx.c:140->src/fpx.c:196]   --->   Operation 6 'alloca' 'i' <Predicate = true> <Delay = 0.00>
ST_1 : Operation 7 [1/1] (1.58ns)   --->   "%store_ln347 = store i4 0, i4 %i" [src/fpx.c:347->src/fpx.c:140->src/fpx.c:196]   --->   Operation 7 'store' 'store_ln347' <Predicate = true> <Delay = 1.58>
ST_1 : Operation 8 [1/1] (1.58ns)   --->   "%br_ln0 = br void %for.inc.i.i"   --->   Operation 8 'br' 'br_ln0' <Predicate = true> <Delay = 1.58>
ST_1 : Operation 9 [1/1] (0.00ns)   --->   "%i_259 = load i4 %i" [src/fpx.c:350->src/fpx.c:140->src/fpx.c:196]   --->   Operation 9 'load' 'i_259' <Predicate = true> <Delay = 0.00>
ST_1 : Operation 10 [1/1] (1.73ns)   --->   "%icmp_ln349 = icmp_eq  i4 %i_259, i4 8" [src/fpx.c:349->src/fpx.c:140->src/fpx.c:196]   --->   Operation 10 'icmp' 'icmp_ln349' <Predicate = true> <Delay = 1.73> <CoreInst = "Cmp">   --->   Core 9 'Cmp' <Latency = 0> <II = 1> <Delay = 1.73> <FuncUnit> <Opcode : 'seteq' 'setne' 'setle' 'setge' 'setlt' 'setgt'> <InPorts = 2> <OutPorts = 1>
ST_1 : Operation 11 [1/1] (1.73ns)   --->   "%add_ln349 = add i4 %i_259, i4 1" [src/fpx.c:349->src/fpx.c:140->src/fpx.c:196]   --->   Operation 11 'add' 'add_ln349' <Predicate = true> <Delay = 1.73> <CoreInst = "Adder">   --->   Core 1 'Adder' <Latency = 0> <II = 1> <Delay = 1.73> <FuncUnit> <Opcode : 'add' 'sub'> <InPorts = 2> <OutPorts = 1>
ST_1 : Operation 12 [1/1] (0.00ns)   --->   "%br_ln349 = br i1 %icmp_ln349, void %for.inc.i.i.split, void %for.inc.i.i38.preheader.exitStub" [src/fpx.c:349->src/fpx.c:140->src/fpx.c:196]   --->   Operation 12 'br' 'br_ln349' <Predicate = true> <Delay = 0.00>
ST_1 : Operation 13 [1/1] (0.00ns)   --->   "%trunc_ln350 = trunc i4 %i_259" [src/fpx.c:350->src/fpx.c:140->src/fpx.c:196]   --->   Operation 13 'trunc' 'trunc_ln350' <Predicate = (!icmp_ln349)> <Delay = 0.00>
ST_1 : Operation 14 [1/1] (0.00ns)   --->   "%zext_ln350 = zext i3 %trunc_ln350" [src/fpx.c:350->src/fpx.c:140->src/fpx.c:196]   --->   Operation 14 'zext' 'zext_ln350' <Predicate = (!icmp_ln349)> <Delay = 0.00>
ST_1 : Operation 15 [1/1] (0.00ns)   --->   "%a_addr = getelementptr i64 %a, i32 0, i32 %zext_ln350" [src/fpx.c:350->src/fpx.c:140->src/fpx.c:196]   --->   Operation 15 'getelementptr' 'a_addr' <Predicate = (!icmp_ln349)> <Delay = 0.00>
ST_1 : Operation 16 [1/1] (0.00ns)   --->   "%tmp_960_cast = bitconcatenate i4 @_ssdm_op_BitConcatenate.i4.i1.i3, i1 1, i3 %trunc_ln350" [src/fpx.c:350->src/fpx.c:140->src/fpx.c:196]   --->   Operation 16 'bitconcatenate' 'tmp_960_cast' <Predicate = (!icmp_ln349)> <Delay = 0.00>
ST_1 : Operation 17 [1/1] (0.00ns)   --->   "%zext_ln350_97 = zext i4 %tmp_960_cast" [src/fpx.c:350->src/fpx.c:140->src/fpx.c:196]   --->   Operation 17 'zext' 'zext_ln350_97' <Predicate = (!icmp_ln349)> <Delay = 0.00>
ST_1 : Operation 18 [1/1] (0.00ns)   --->   "%a_addr_9 = getelementptr i64 %a, i32 0, i32 %zext_ln350_97" [src/fpx.c:350->src/fpx.c:140->src/fpx.c:196]   --->   Operation 18 'getelementptr' 'a_addr_9' <Predicate = (!icmp_ln349)> <Delay = 0.00>
ST_1 : Operation 19 [2/2] (3.25ns)   --->   "%a_load = load i4 %a_addr" [src/fpx.c:350->src/fpx.c:140->src/fpx.c:196]   --->   Operation 19 'load' 'a_load' <Predicate = (!icmp_ln349)> <Delay = 3.25> <CoreInst = "RAM">   --->   Core 81 'RAM' <Latency = 1> <II = 1> <Delay = 3.25> <Storage> <Opcode : 'load' 'store'> <Ports = 2> <Width = 64> <Depth = 16> <RAM>
ST_1 : Operation 20 [2/2] (3.25ns)   --->   "%a_load_7 = load i4 %a_addr_9" [src/fpx.c:350->src/fpx.c:140->src/fpx.c:196]   --->   Operation 20 'load' 'a_load_7' <Predicate = (!icmp_ln349)> <Delay = 3.25> <CoreInst = "RAM">   --->   Core 81 'RAM' <Latency = 1> <II = 1> <Delay = 3.25> <Storage> <Opcode : 'load' 'store'> <Ports = 2> <Width = 64> <Depth = 16> <RAM>
ST_1 : Operation 21 [1/1] (1.58ns)   --->   "%store_ln347 = store i4 %add_ln349, i4 %i" [src/fpx.c:347->src/fpx.c:140->src/fpx.c:196]   --->   Operation 21 'store' 'store_ln347' <Predicate = (!icmp_ln349)> <Delay = 1.58>

State 2 <SV = 1> <Delay = 6.77>
ST_2 : Operation 22 [1/1] (0.00ns)   --->   "%carry = phi i1 0, void %newFuncRoot, i1 %tmp, void %for.inc.i.i.split" [src/fpx.c:349->src/fpx.c:140->src/fpx.c:196]   --->   Operation 22 'phi' 'carry' <Predicate = true> <Delay = 0.00>
ST_2 : Operation 23 [1/1] (0.00ns)   --->   "%speclooptripcount_ln0 = speclooptripcount void @_ssdm_op_SpecLoopTripCount, i64 8, i64 8, i64 8"   --->   Operation 23 'speclooptripcount' 'speclooptripcount_ln0' <Predicate = true> <Delay = 0.00>
ST_2 : Operation 24 [1/2] ( I:3.25ns O:3.25ns )   --->   "%a_load = load i4 %a_addr" [src/fpx.c:350->src/fpx.c:140->src/fpx.c:196]   --->   Operation 24 'load' 'a_load' <Predicate = (!icmp_ln349)> <Delay = 3.25> <CoreInst = "RAM">   --->   Core 81 'RAM' <Latency = 1> <II = 1> <Delay = 3.25> <Storage> <Opcode : 'load' 'store'> <Ports = 2> <Width = 64> <Depth = 16> <RAM>
ST_2 : Operation 25 [1/1] (0.00ns)   --->   "%zext_ln350_98 = zext i1 %carry" [src/fpx.c:350->src/fpx.c:140->src/fpx.c:196]   --->   Operation 25 'zext' 'zext_ln350_98' <Predicate = (!icmp_ln349)> <Delay = 0.00>
ST_2 : Operation 26 [1/1] (3.52ns)   --->   "%tempReg = add i64 %a_load, i64 %zext_ln350_98" [src/fpx.c:350->src/fpx.c:140->src/fpx.c:196]   --->   Operation 26 'add' 'tempReg' <Predicate = (!icmp_ln349)> <Delay = 3.52> <CoreInst = "Adder">   --->   Core 1 'Adder' <Latency = 0> <II = 1> <Delay = 3.52> <FuncUnit> <Opcode : 'add' 'sub'> <InPorts = 2> <OutPorts = 1>
ST_2 : Operation 27 [1/2] ( I:3.25ns O:3.25ns )   --->   "%a_load_7 = load i4 %a_addr_9" [src/fpx.c:350->src/fpx.c:140->src/fpx.c:196]   --->   Operation 27 'load' 'a_load_7' <Predicate = (!icmp_ln349)> <Delay = 3.25> <CoreInst = "RAM">   --->   Core 81 'RAM' <Latency = 1> <II = 1> <Delay = 3.25> <Storage> <Opcode : 'load' 'store'> <Ports = 2> <Width = 64> <Depth = 16> <RAM>
ST_2 : Operation 45 [1/1] (1.58ns)   --->   "%ret_ln0 = ret"   --->   Operation 45 'ret' 'ret_ln0' <Predicate = (icmp_ln349)> <Delay = 1.58>

State 3 <SV = 2> <Delay = 5.84>
ST_3 : Operation 28 [1/1] (0.00ns)   --->   "%specpipeline_ln347 = specpipeline void @_ssdm_op_SpecPipeline, i32 4294967295, i32 0, i32 0, i32 0, void @empty_44" [src/fpx.c:347->src/fpx.c:140->src/fpx.c:196]   --->   Operation 28 'specpipeline' 'specpipeline_ln347' <Predicate = (!icmp_ln349)> <Delay = 0.00>
ST_3 : Operation 29 [1/1] (0.00ns)   --->   "%specloopname_ln349 = specloopname void @_ssdm_op_SpecLoopName, void @empty_32" [src/fpx.c:349->src/fpx.c:140->src/fpx.c:196]   --->   Operation 29 'specloopname' 'specloopname_ln349' <Predicate = (!icmp_ln349)> <Delay = 0.00>
ST_3 : Operation 30 [1/1] (3.52ns)   --->   "%add_ln350 = add i64 %a_load_7, i64 %tempReg" [src/fpx.c:350->src/fpx.c:140->src/fpx.c:196]   --->   Operation 30 'add' 'add_ln350' <Predicate = (!icmp_ln349)> <Delay = 3.52> <CoreInst = "Adder">   --->   Core 1 'Adder' <Latency = 0> <II = 1> <Delay = 3.52> <FuncUnit> <Opcode : 'add' 'sub'> <InPorts = 2> <OutPorts = 1>
ST_3 : Operation 31 [1/1] (0.00ns)   --->   "%t1_addr = getelementptr i64 %t1, i32 0, i32 %zext_ln350" [src/fpx.c:350->src/fpx.c:140->src/fpx.c:196]   --->   Operation 31 'getelementptr' 't1_addr' <Predicate = (!icmp_ln349)> <Delay = 0.00>
ST_3 : Operation 32 [1/1] ( I:2.32ns O:2.32ns )   --->   "%store_ln350 = store i64 %add_ln350, i3 %t1_addr" [src/fpx.c:350->src/fpx.c:140->src/fpx.c:196]   --->   Operation 32 'store' 'store_ln350' <Predicate = (!icmp_ln349)> <Delay = 2.32> <CoreInst = "RAM">   --->   Core 81 'RAM' <Latency = 1> <II = 1> <Delay = 2.32> <Storage> <Opcode : 'load' 'store'> <Ports = 2> <Width = 64> <Depth = 8> <RAM>
ST_3 : Operation 33 [1/1] (0.00ns) (grouped into LUT with out node xor_ln350_136)   --->   "%xor_ln350 = xor i64 %add_ln350, i64 %tempReg" [src/fpx.c:350->src/fpx.c:140->src/fpx.c:196]   --->   Operation 33 'xor' 'xor_ln350' <Predicate = (!icmp_ln349)> <Delay = 0.00> <CoreInst = "LogicGate">   --->   Core 74 'LogicGate' <Latency = 0> <II = 1> <Delay = 0.99> <FuncUnit> <Opcode : 'and' 'or' 'xor'> <InPorts = 2> <OutPorts = 1>
ST_3 : Operation 34 [1/1] (0.00ns) (grouped into LUT with out node xor_ln350_136)   --->   "%xor_ln350_134 = xor i64 %a_load_7, i64 %tempReg" [src/fpx.c:350->src/fpx.c:140->src/fpx.c:196]   --->   Operation 34 'xor' 'xor_ln350_134' <Predicate = (!icmp_ln349)> <Delay = 0.00> <CoreInst = "LogicGate">   --->   Core 74 'LogicGate' <Latency = 0> <II = 1> <Delay = 0.99> <FuncUnit> <Opcode : 'and' 'or' 'xor'> <InPorts = 2> <OutPorts = 1>
ST_3 : Operation 35 [1/1] (0.00ns) (grouped into LUT with out node xor_ln350_136)   --->   "%or_ln350 = or i64 %xor_ln350, i64 %xor_ln350_134" [src/fpx.c:350->src/fpx.c:140->src/fpx.c:196]   --->   Operation 35 'or' 'or_ln350' <Predicate = (!icmp_ln349)> <Delay = 0.00> <CoreInst = "LogicGate">   --->   Core 74 'LogicGate' <Latency = 0> <II = 1> <Delay = 0.99> <FuncUnit> <Opcode : 'and' 'or' 'xor'> <InPorts = 2> <OutPorts = 1>
ST_3 : Operation 36 [1/1] (0.00ns) (grouped into LUT with out node or_ln350_52)   --->   "%bit_sel = bitselect i1 @_ssdm_op_BitSelect.i1.i64.i64, i64 %tempReg, i64 63" [src/fpx.c:350->src/fpx.c:140->src/fpx.c:196]   --->   Operation 36 'bitselect' 'bit_sel' <Predicate = (!icmp_ln349)> <Delay = 0.00>
ST_3 : Operation 37 [1/1] (0.00ns) (grouped into LUT with out node or_ln350_52)   --->   "%xor_ln350_135 = xor i1 %bit_sel, i1 1" [src/fpx.c:350->src/fpx.c:140->src/fpx.c:196]   --->   Operation 37 'xor' 'xor_ln350_135' <Predicate = (!icmp_ln349)> <Delay = 0.00> <CoreInst = "LogicGate">   --->   Core 74 'LogicGate' <Latency = 0> <II = 1> <Delay = 0.97> <FuncUnit> <Opcode : 'and' 'or' 'xor'> <InPorts = 2> <OutPorts = 1>
ST_3 : Operation 38 [1/1] (0.00ns) (grouped into LUT with out node or_ln350_52)   --->   "%trunc_ln350_62 = trunc i64 %tempReg" [src/fpx.c:350->src/fpx.c:140->src/fpx.c:196]   --->   Operation 38 'trunc' 'trunc_ln350_62' <Predicate = (!icmp_ln349)> <Delay = 0.00>
ST_3 : Operation 39 [1/1] (0.00ns) (grouped into LUT with out node or_ln350_52)   --->   "%xor_ln350_s = bitconcatenate i64 @_ssdm_op_BitConcatenate.i64.i1.i63, i1 %xor_ln350_135, i63 %trunc_ln350_62" [src/fpx.c:350->src/fpx.c:140->src/fpx.c:196]   --->   Operation 39 'bitconcatenate' 'xor_ln350_s' <Predicate = (!icmp_ln349)> <Delay = 0.00>
ST_3 : Operation 40 [1/1] (0.00ns) (grouped into LUT with out node or_ln350_52)   --->   "%and_ln350 = and i64 %a_load, i64 %xor_ln350_s" [src/fpx.c:350->src/fpx.c:140->src/fpx.c:196]   --->   Operation 40 'and' 'and_ln350' <Predicate = (!icmp_ln349)> <Delay = 0.00> <CoreInst = "LogicGate">   --->   Core 74 'LogicGate' <Latency = 0> <II = 1> <Delay = 0.99> <FuncUnit> <Opcode : 'and' 'or' 'xor'> <InPorts = 2> <OutPorts = 1>
ST_3 : Operation 41 [1/1] (0.99ns) (out node of the LUT)   --->   "%xor_ln350_136 = xor i64 %or_ln350, i64 %add_ln350" [src/fpx.c:350->src/fpx.c:140->src/fpx.c:196]   --->   Operation 41 'xor' 'xor_ln350_136' <Predicate = (!icmp_ln349)> <Delay = 0.99> <CoreInst = "LogicGate">   --->   Core 74 'LogicGate' <Latency = 0> <II = 1> <Delay = 0.99> <FuncUnit> <Opcode : 'and' 'or' 'xor'> <InPorts = 2> <OutPorts = 1>
ST_3 : Operation 42 [1/1] (0.99ns) (out node of the LUT)   --->   "%or_ln350_52 = or i64 %xor_ln350_136, i64 %and_ln350" [src/fpx.c:350->src/fpx.c:140->src/fpx.c:196]   --->   Operation 42 'or' 'or_ln350_52' <Predicate = (!icmp_ln349)> <Delay = 0.99> <CoreInst = "LogicGate">   --->   Core 74 'LogicGate' <Latency = 0> <II = 1> <Delay = 0.99> <FuncUnit> <Opcode : 'and' 'or' 'xor'> <InPorts = 2> <OutPorts = 1>
ST_3 : Operation 43 [1/1] (0.00ns)   --->   "%tmp = bitselect i1 @_ssdm_op_BitSelect.i1.i64.i32, i64 %or_ln350_52, i32 63" [src/fpx.c:349->src/fpx.c:140->src/fpx.c:196]   --->   Operation 43 'bitselect' 'tmp' <Predicate = (!icmp_ln349)> <Delay = 0.00>
ST_3 : Operation 44 [1/1] (0.00ns)   --->   "%br_ln349 = br void %for.inc.i.i" [src/fpx.c:349->src/fpx.c:140->src/fpx.c:196]   --->   Operation 44 'br' 'br_ln349' <Predicate = (!icmp_ln349)> <Delay = 0.00>


============================================================
+ Verbose Summary: Timing violations
============================================================
Target clock period: 10.000ns, clock uncertainty: 2.700ns.

 <State 1>: 4.911ns
The critical path consists of the following:
	'store' operation 0 bit ('store_ln347', src/fpx.c:347->src/fpx.c:140->src/fpx.c:196) of constant 0 on local variable 'i', src/fpx.c:347->src/fpx.c:140->src/fpx.c:196 [4]  (1.588 ns)
	'load' operation 4 bit ('i', src/fpx.c:350->src/fpx.c:140->src/fpx.c:196) on local variable 'i', src/fpx.c:347->src/fpx.c:140->src/fpx.c:196 [8]  (0.000 ns)
	'icmp' operation 1 bit ('icmp_ln349', src/fpx.c:349->src/fpx.c:140->src/fpx.c:196) [9]  (1.735 ns)
	'store' operation 0 bit ('store_ln347', src/fpx.c:347->src/fpx.c:140->src/fpx.c:196) of variable 'add_ln349', src/fpx.c:349->src/fpx.c:140->src/fpx.c:196 on local variable 'i', src/fpx.c:347->src/fpx.c:140->src/fpx.c:196 [40]  (1.588 ns)

 <State 2>: 6.774ns
The critical path consists of the following:
	'load' operation 64 bit ('a_load', src/fpx.c:350->src/fpx.c:140->src/fpx.c:196) on array 'a' [22]  (3.254 ns)
	'add' operation 64 bit ('tempReg', src/fpx.c:350->src/fpx.c:140->src/fpx.c:196) [24]  (3.520 ns)

 <State 3>: 5.842ns
The critical path consists of the following:
	'add' operation 64 bit ('x', src/fpx.c:350->src/fpx.c:140->src/fpx.c:196) [26]  (3.520 ns)
	'store' operation 0 bit ('store_ln350', src/fpx.c:350->src/fpx.c:140->src/fpx.c:196) of variable 'x', src/fpx.c:350->src/fpx.c:140->src/fpx.c:196 on array 't1' [28]  (2.322 ns)


============================================================
+ Verbose Summary: Binding
============================================================
N/A
* FSMD analyzer results:
  - Output states:
 - Input state : 
  - Chain level:
	State 1
	State 2
	State 3


============================================================
+ Verbose Summary: Datapath Resource usage 
============================================================
N/A
