

================================================================
== Vitis HLS Report for 'fp2sqr503_mont'
================================================================
* Date:           Tue May 20 14:30:17 2025

* Version:        2024.2.2 (Build 6049644 on Mar  5 2025)
* Project:        sikep503_hls
* Solution:       solution1 (Vivado IP Flow Target)
* Product family: zynq
* Target device:  xc7z020-clg484-1


================================================================
== Performance Estimates
================================================================
+ Timing: 
    * Summary: 
    +--------+----------+----------+------------+
    |  Clock |  Target  | Estimated| Uncertainty|
    +--------+----------+----------+------------+
    |ap_clk  |  10.00 ns|  7.040 ns|     2.70 ns|
    +--------+----------+----------+------------+

+ Latency: 
    * Summary: 
    +---------+---------+----------+-----------+-----+------+---------+
    |  Latency (cycles) |  Latency (absolute)  |  Interval  | Pipeline|
    |   min   |   max   |    min   |    max    | min |  max |   Type  |
    +---------+---------+----------+-----------+-----+------+---------+
    |      667|     1089|  6.670 us|  10.890 us|  667|  1089|       no|
    +---------+---------+----------+-----------+-----+------+---------+

    + Detail: 
        * Instance: 
        N/A

        * Loop: 
        N/A

============================================================
+ Verbose Summary: Synthesis Manager
============================================================
InlineROM: 1
ExposeGlobal: 0
============================================================
+ Verbose Summary: CDFG Model
============================================================
IsTopModel: 0
ResetActiveHigh: 1
IsCombinational: 0
IsDatapathOnly: 0
HasWiredReturn: 1
HasMFsm: 0
HasVarLatency: 1
IsPipeline: 0
IsRtlPipelined: 0
IsInstanceOverlapped: 0
IsDontTouch: 0
HasImplIP: 0
IsGatedGlobalClock: 0


============================================================
+ Verbose Summary: Schedule
============================================================
* Number of FSM states : 12
* Pipeline : 0
* Dataflow Pipeline: 0

* FSM state transitions: 
1 --> 2 
2 --> 3 
3 --> 4 
4 --> 5 
5 --> 6 
6 --> 7 
7 --> 8 
8 --> 9 
9 --> 10 
10 --> 11 
11 --> 12 
12 --> 

* FSM state operations: 

State 1 <SV = 0> <Delay = 0.00>
ST_1 : Operation 13 [1/1] (0.00ns)   --->   "%borrow_loc = alloca i32 1"   --->   Operation 13 'alloca' 'borrow_loc' <Predicate = true> <Delay = 0.00>
ST_1 : Operation 14 [1/1] (0.00ns)   --->   "%temp = alloca i32 1" [src/fpx.c:60->src/fpx.c:161]   --->   Operation 14 'alloca' 'temp' <Predicate = true> <Delay = 0.00>
ST_1 : Operation 15 [1/1] (0.00ns)   --->   "%temp_64 = alloca i32 1" [src/fpx.c:60->src/fpx.c:160]   --->   Operation 15 'alloca' 'temp_64' <Predicate = true> <Delay = 0.00>
ST_1 : Operation 16 [1/1] (0.00ns)   --->   "%t1 = alloca i32 1" [src/fpx.c:155]   --->   Operation 16 'alloca' 't1' <Predicate = true> <Delay = 0.00>
ST_1 : Operation 17 [1/1] (0.00ns)   --->   "%t2 = alloca i32 1" [src/fpx.c:155]   --->   Operation 17 'alloca' 't2' <Predicate = true> <Delay = 0.00>
ST_1 : Operation 18 [1/1] (0.00ns)   --->   "%t3 = alloca i32 1" [src/fpx.c:155]   --->   Operation 18 'alloca' 't3' <Predicate = true> <Delay = 0.00>
ST_1 : Operation 19 [2/2] (0.00ns)   --->   "%call_ln0 = call void @fp2sqr503_mont_Pipeline_VITIS_LOOP_349_1, i64 %a, i64 %t1"   --->   Operation 19 'call' 'call_ln0' <Predicate = true> <Delay = 0.00> <CoreType = "Generic">   --->   Generic Core
ST_1 : Operation 20 [2/2] (0.00ns)   --->   "%call_ln0 = call void @fp2sqr503_mont_Pipeline_5, i64 %temp_64"   --->   Operation 20 'call' 'call_ln0' <Predicate = true> <Delay = 0.00> <CoreType = "Generic">   --->   Generic Core
ST_1 : Operation 21 [2/2] (0.00ns)   --->   "%call_ln0 = call void @fp2sqr503_mont_Pipeline_6, i64 %temp"   --->   Operation 21 'call' 'call_ln0' <Predicate = true> <Delay = 0.00> <CoreType = "Generic">   --->   Generic Core

State 2 <SV = 1> <Delay = 4.95>
ST_2 : Operation 22 [1/2] (0.00ns)   --->   "%call_ln0 = call void @fp2sqr503_mont_Pipeline_VITIS_LOOP_349_1, i64 %a, i64 %t1"   --->   Operation 22 'call' 'call_ln0' <Predicate = true> <Delay = 0.00> <CoreType = "Generic">   --->   Generic Core
ST_2 : Operation 23 [1/2] (4.95ns)   --->   "%call_ln0 = call void @fp2sqr503_mont_Pipeline_5, i64 %temp_64"   --->   Operation 23 'call' 'call_ln0' <Predicate = true> <Delay = 4.95> <CoreType = "Generic">   --->   Generic Core
ST_2 : Operation 24 [1/2] (4.95ns)   --->   "%call_ln0 = call void @fp2sqr503_mont_Pipeline_6, i64 %temp"   --->   Operation 24 'call' 'call_ln0' <Predicate = true> <Delay = 4.95> <CoreType = "Generic">   --->   Generic Core

State 3 <SV = 2> <Delay = 0.00>
ST_3 : Operation 25 [2/2] (0.00ns)   --->   "%call_ln0 = call void @fp2sqr503_mont_Pipeline_VITIS_LOOP_47_1, i64 %a, i64 %t2, i1 %borrow_loc"   --->   Operation 25 'call' 'call_ln0' <Predicate = true> <Delay = 0.00> <CoreType = "Generic">   --->   Generic Core

State 4 <SV = 3> <Delay = 0.00>
ST_4 : Operation 26 [1/2] (0.00ns)   --->   "%call_ln0 = call void @fp2sqr503_mont_Pipeline_VITIS_LOOP_47_1, i64 %a, i64 %t2, i1 %borrow_loc"   --->   Operation 26 'call' 'call_ln0' <Predicate = true> <Delay = 0.00> <CoreType = "Generic">   --->   Generic Core

State 5 <SV = 4> <Delay = 0.99>
ST_5 : Operation 27 [1/1] (0.00ns)   --->   "%borrow_loc_load = load i1 %borrow_loc"   --->   Operation 27 'load' 'borrow_loc_load' <Predicate = true> <Delay = 0.00>
ST_5 : Operation 28 [2/2] (0.99ns)   --->   "%call_ln0 = call void @fp2sqr503_mont_Pipeline_VITIS_LOOP_53_2, i64 %t2, i1 %borrow_loc_load, i64 %p503x2_1"   --->   Operation 28 'call' 'call_ln0' <Predicate = true> <Delay = 0.99> <CoreType = "Generic">   --->   Generic Core
ST_5 : Operation 29 [2/2] (0.00ns)   --->   "%call_ln0 = call void @fp2sqr503_mont_Pipeline_VITIS_LOOP_349_1136, i64 %a, i64 %t3"   --->   Operation 29 'call' 'call_ln0' <Predicate = true> <Delay = 0.00> <CoreType = "Generic">   --->   Generic Core

State 6 <SV = 5> <Delay = 0.00>
ST_6 : Operation 30 [1/2] (0.00ns)   --->   "%call_ln0 = call void @fp2sqr503_mont_Pipeline_VITIS_LOOP_53_2, i64 %t2, i1 %borrow_loc_load, i64 %p503x2_1"   --->   Operation 30 'call' 'call_ln0' <Predicate = true> <Delay = 0.00> <CoreType = "Generic">   --->   Generic Core
ST_6 : Operation 31 [1/2] (0.00ns)   --->   "%call_ln0 = call void @fp2sqr503_mont_Pipeline_VITIS_LOOP_349_1136, i64 %a, i64 %t3"   --->   Operation 31 'call' 'call_ln0' <Predicate = true> <Delay = 0.00> <CoreType = "Generic">   --->   Generic Core

State 7 <SV = 6> <Delay = 0.00>
ST_7 : Operation 32 [2/2] (0.00ns)   --->   "%call_ln62 = call void @mp_mul.152, i64 %t1, i64 %t2, i64 %temp_64" [src/fpx.c:62->src/fpx.c:160]   --->   Operation 32 'call' 'call_ln62' <Predicate = true> <Delay = 0.00> <CoreType = "Generic">   --->   Generic Core
ST_7 : Operation 33 [2/2] (0.00ns)   --->   "%call_ln62 = call void @mp_mul.150, i64 %t3, i64 %a, i64 %temp" [src/fpx.c:62->src/fpx.c:161]   --->   Operation 33 'call' 'call_ln62' <Predicate = true> <Delay = 0.00> <CoreType = "Generic">   --->   Generic Core

State 8 <SV = 7> <Delay = 1.73>
ST_8 : Operation 34 [1/2] (1.73ns)   --->   "%call_ln62 = call void @mp_mul.152, i64 %t1, i64 %t2, i64 %temp_64" [src/fpx.c:62->src/fpx.c:160]   --->   Operation 34 'call' 'call_ln62' <Predicate = true> <Delay = 1.73> <CoreType = "Generic">   --->   Generic Core
ST_8 : Operation 35 [1/2] (1.73ns)   --->   "%call_ln62 = call void @mp_mul.150, i64 %t3, i64 %a, i64 %temp" [src/fpx.c:62->src/fpx.c:161]   --->   Operation 35 'call' 'call_ln62' <Predicate = true> <Delay = 1.73> <CoreType = "Generic">   --->   Generic Core

State 9 <SV = 8> <Delay = 3.25>
ST_9 : Operation 36 [2/2] (3.25ns)   --->   "%call_ln63 = call void @rdc_mont.14183, i64 %temp_64, i64 %c, i1 0, i64 %p503p1_1" [src/fpx.c:63->src/fpx.c:160]   --->   Operation 36 'call' 'call_ln63' <Predicate = true> <Delay = 3.25> <CoreType = "Generic">   --->   Generic Core

State 10 <SV = 9> <Delay = 0.00>
ST_10 : Operation 37 [1/2] (0.00ns)   --->   "%call_ln63 = call void @rdc_mont.14183, i64 %temp_64, i64 %c, i1 0, i64 %p503p1_1" [src/fpx.c:63->src/fpx.c:160]   --->   Operation 37 'call' 'call_ln63' <Predicate = true> <Delay = 0.00> <CoreType = "Generic">   --->   Generic Core

State 11 <SV = 10> <Delay = 3.25>
ST_11 : Operation 38 [2/2] (3.25ns)   --->   "%call_ln63 = call void @rdc_mont.14183, i64 %temp, i64 %c, i1 1, i64 %p503p1_1" [src/fpx.c:63->src/fpx.c:161]   --->   Operation 38 'call' 'call_ln63' <Predicate = true> <Delay = 3.25> <CoreType = "Generic">   --->   Generic Core

State 12 <SV = 11> <Delay = 0.00>
ST_12 : Operation 39 [1/2] (0.00ns)   --->   "%call_ln63 = call void @rdc_mont.14183, i64 %temp, i64 %c, i1 1, i64 %p503p1_1" [src/fpx.c:63->src/fpx.c:161]   --->   Operation 39 'call' 'call_ln63' <Predicate = true> <Delay = 0.00> <CoreType = "Generic">   --->   Generic Core
ST_12 : Operation 40 [1/1] (0.00ns)   --->   "%ret_ln162 = ret" [src/fpx.c:162]   --->   Operation 40 'ret' 'ret_ln162' <Predicate = true> <Delay = 0.00>


============================================================
+ Verbose Summary: Timing violations
============================================================
Target clock period: 10.000ns, clock uncertainty: 2.700ns.

 <State 1>: 0.000ns
The critical path consists of the following:

 <State 2>: 4.956ns
The critical path consists of the following:
	'call' operation 0 bit ('call_ln0') to 'fp2sqr503_mont_Pipeline_5' [16]  (4.956 ns)

 <State 3>: 0.000ns
The critical path consists of the following:

 <State 4>: 0.000ns
The critical path consists of the following:

 <State 5>: 0.993ns
The critical path consists of the following:
	'load' operation 1 bit ('borrow_loc_load') on local variable 'borrow_loc' [13]  (0.000 ns)
	'call' operation 0 bit ('call_ln0') to 'fp2sqr503_mont_Pipeline_VITIS_LOOP_53_2' [14]  (0.993 ns)

 <State 6>: 0.000ns
The critical path consists of the following:

 <State 7>: 0.000ns
The critical path consists of the following:

 <State 8>: 1.735ns
The critical path consists of the following:
	'call' operation 0 bit ('call_ln62', src/fpx.c:62->src/fpx.c:160) to 'mp_mul.152' [17]  (1.735 ns)

 <State 9>: 3.254ns
The critical path consists of the following:
	'call' operation 0 bit ('call_ln63', src/fpx.c:63->src/fpx.c:160) to 'rdc_mont.14183' [18]  (3.254 ns)

 <State 10>: 0.000ns
The critical path consists of the following:

 <State 11>: 3.254ns
The critical path consists of the following:
	'call' operation 0 bit ('call_ln63', src/fpx.c:63->src/fpx.c:161) to 'rdc_mont.14183' [21]  (3.254 ns)

 <State 12>: 0.000ns
The critical path consists of the following:


============================================================
+ Verbose Summary: Binding
============================================================
N/A
* FSMD analyzer results:
  - Output states:
 - Input state : 
  - Chain level:
	State 1
	State 2
	State 3
	State 4
	State 5
	State 6
	State 7
	State 8
	State 9
	State 10
	State 11
	State 12


============================================================
+ Verbose Summary: Datapath Resource usage 
============================================================
N/A
