

================================================================
== Vitis HLS Report for 'fpadd503_60_6167_Pipeline_VITIS_LOOP_28_2'
================================================================
* Date:           Tue May 20 14:30:12 2025

* Version:        2024.2.2 (Build 6049644 on Mar  5 2025)
* Project:        sikep503_hls
* Solution:       solution1 (Vivado IP Flow Target)
* Product family: zynq
* Target device:  xc7z020-clg484-1


================================================================
== Performance Estimates
================================================================
+ Timing: 
    * Summary: 
    +--------+----------+----------+------------+
    |  Clock |  Target  | Estimated| Uncertainty|
    +--------+----------+----------+------------+
    |ap_clk  |  10.00 ns|  6.832 ns|     2.70 ns|
    +--------+----------+----------+------------+

+ Latency: 
    * Summary: 
    +---------+---------+----------+----------+-----+-----+------------------------------------------------+
    |  Latency (cycles) |  Latency (absolute) |  Interval |                    Pipeline                    |
    |   min   |   max   |    min   |    max   | min | max |                      Type                      |
    +---------+---------+----------+----------+-----+-----+------------------------------------------------+
    |       12|       12|  0.120 us|  0.120 us|    9|    9|  loop auto-rewind stp (delay=0 clock cycles(s))|
    +---------+---------+----------+----------+-----+-----+------------------------------------------------+

    + Detail: 
        * Instance: 
        N/A

        * Loop: 
        +-------------------+---------+---------+----------+-----------+-----------+------+----------+
        |                   |  Latency (cycles) | Iteration|  Initiation Interval  | Trip |          |
        |     Loop Name     |   min   |   max   |  Latency |  achieved |   target  | Count| Pipelined|
        +-------------------+---------+---------+----------+-----------+-----------+------+----------+
        |- VITIS_LOOP_28_2  |       10|       10|         4|          1|          1|     8|       yes|
        +-------------------+---------+---------+----------+-----------+-----------+------+----------+

============================================================
+ Verbose Summary: Synthesis Manager
============================================================
InlineROM: 1
ExposeGlobal: 0
============================================================
+ Verbose Summary: CDFG Model
============================================================
IsTopModel: 0
ResetActiveHigh: 1
IsCombinational: 0
IsDatapathOnly: 0
HasWiredReturn: 1
HasMFsm: 2
HasVarLatency: 1
IsPipeline: 0
IsRtlPipelined: 0
IsInstanceOverlapped: 0
IsDontTouch: 0
HasImplIP: 0
IsGatedGlobalClock: 0

+ Individual pipeline summary: 
  * Pipeline-0: initiation interval (II) = 1, depth = 4


============================================================
+ Verbose Summary: Schedule
============================================================
* Number of FSM states : 4
* Pipeline : 1
  Pipeline-0 : II = 1, D = 4, States = { 1 2 3 4 }
* Dataflow Pipeline: 0

* FSM state transitions: 
1 --> 2 
2 --> 3 
3 --> 4 
4 --> 

* FSM state operations: 

State 1 <SV = 0> <Delay = 4.91>
ST_1 : Operation 7 [1/1] (0.00ns)   --->   "%i_133 = alloca i32 1" [src/generic/fp_generic.c:20]   --->   Operation 7 'alloca' 'i_133' <Predicate = true> <Delay = 0.00>
ST_1 : Operation 8 [1/1] (0.00ns)   --->   "%c_1_offset_read = read i1 @_ssdm_op_Read.ap_auto.i1, i1 %c_1_offset"   --->   Operation 8 'read' 'c_1_offset_read' <Predicate = true> <Delay = 0.00>
ST_1 : Operation 9 [1/1] (0.00ns)   --->   "%c_0_offset_read = read i1 @_ssdm_op_Read.ap_auto.i1, i1 %c_0_offset"   --->   Operation 9 'read' 'c_0_offset_read' <Predicate = true> <Delay = 0.00>
ST_1 : Operation 10 [1/1] (1.58ns)   --->   "%store_ln20 = store i4 0, i4 %i_133" [src/generic/fp_generic.c:20]   --->   Operation 10 'store' 'store_ln20' <Predicate = true> <Delay = 1.58>
ST_1 : Operation 11 [1/1] (1.58ns)   --->   "%br_ln0 = br void %for.inc29"   --->   Operation 11 'br' 'br_ln0' <Predicate = true> <Delay = 1.58>
ST_1 : Operation 12 [1/1] (0.00ns)   --->   "%i = load i4 %i_133" [src/generic/fp_generic.c:28]   --->   Operation 12 'load' 'i' <Predicate = true> <Delay = 0.00>
ST_1 : Operation 13 [1/1] (1.73ns)   --->   "%icmp_ln28 = icmp_eq  i4 %i, i4 8" [src/generic/fp_generic.c:28]   --->   Operation 13 'icmp' 'icmp_ln28' <Predicate = true> <Delay = 1.73> <CoreInst = "Cmp">   --->   Core 9 'Cmp' <Latency = 0> <II = 1> <Delay = 1.73> <FuncUnit> <Opcode : 'seteq' 'setne' 'setle' 'setge' 'setlt' 'setgt'> <InPorts = 2> <OutPorts = 1>
ST_1 : Operation 14 [1/1] (1.73ns)   --->   "%add_ln28 = add i4 %i, i4 1" [src/generic/fp_generic.c:28]   --->   Operation 14 'add' 'add_ln28' <Predicate = true> <Delay = 1.73> <CoreInst = "Adder">   --->   Core 1 'Adder' <Latency = 0> <II = 1> <Delay = 1.73> <FuncUnit> <Opcode : 'add' 'sub'> <InPorts = 2> <OutPorts = 1>
ST_1 : Operation 15 [1/1] (0.00ns)   --->   "%lshr_ln20_3 = partselect i2 @_ssdm_op_PartSelect.i2.i4.i32.i32, i4 %i, i32 1, i32 2" [src/generic/fp_generic.c:20]   --->   Operation 15 'partselect' 'lshr_ln20_3' <Predicate = (!icmp_ln28)> <Delay = 0.00>
ST_1 : Operation 16 [1/1] (0.00ns)   --->   "%tmp_s = bitconcatenate i3 @_ssdm_op_BitConcatenate.i3.i1.i2, i1 %c_0_offset_read, i2 %lshr_ln20_3" [src/generic/fp_generic.c:29]   --->   Operation 16 'bitconcatenate' 'tmp_s' <Predicate = (!icmp_ln28)> <Delay = 0.00>
ST_1 : Operation 17 [1/1] (0.00ns)   --->   "%zext_ln29_9 = zext i3 %tmp_s" [src/generic/fp_generic.c:29]   --->   Operation 17 'zext' 'zext_ln29_9' <Predicate = (!icmp_ln28)> <Delay = 0.00>
ST_1 : Operation 18 [1/1] (0.00ns)   --->   "%c_0_addr = getelementptr i64 %c_0, i32 0, i32 %zext_ln29_9" [src/generic/fp_generic.c:29]   --->   Operation 18 'getelementptr' 'c_0_addr' <Predicate = (!icmp_ln28)> <Delay = 0.00>
ST_1 : Operation 19 [1/1] (0.00ns)   --->   "%tmp_516 = bitconcatenate i3 @_ssdm_op_BitConcatenate.i3.i1.i2, i1 %c_1_offset_read, i2 %lshr_ln20_3" [src/generic/fp_generic.c:29]   --->   Operation 19 'bitconcatenate' 'tmp_516' <Predicate = (!icmp_ln28)> <Delay = 0.00>
ST_1 : Operation 20 [1/1] (0.00ns)   --->   "%zext_ln29_11 = zext i3 %tmp_516" [src/generic/fp_generic.c:29]   --->   Operation 20 'zext' 'zext_ln29_11' <Predicate = (!icmp_ln28)> <Delay = 0.00>
ST_1 : Operation 21 [1/1] (0.00ns)   --->   "%c_1_addr = getelementptr i64 %c_1, i32 0, i32 %zext_ln29_11" [src/generic/fp_generic.c:29]   --->   Operation 21 'getelementptr' 'c_1_addr' <Predicate = (!icmp_ln28)> <Delay = 0.00>
ST_1 : Operation 22 [2/2] (2.32ns)   --->   "%c_0_load = load i3 %c_0_addr" [src/generic/fp_generic.c:29]   --->   Operation 22 'load' 'c_0_load' <Predicate = (!icmp_ln28)> <Delay = 2.32> <CoreInst = "RAM">   --->   Core 81 'RAM' <Latency = 1> <II = 1> <Delay = 2.32> <Storage> <Opcode : 'load' 'store'> <Ports = 2> <Width = 64> <Depth = 8> <RAM>
ST_1 : Operation 23 [2/2] (2.32ns)   --->   "%c_1_load = load i3 %c_1_addr" [src/generic/fp_generic.c:29]   --->   Operation 23 'load' 'c_1_load' <Predicate = (!icmp_ln28)> <Delay = 2.32> <CoreInst = "RAM">   --->   Core 81 'RAM' <Latency = 1> <II = 1> <Delay = 2.32> <Storage> <Opcode : 'load' 'store'> <Ports = 2> <Width = 64> <Depth = 8> <RAM>
ST_1 : Operation 24 [1/1] (1.58ns)   --->   "%store_ln20 = store i4 %add_ln28, i4 %i_133" [src/generic/fp_generic.c:20]   --->   Operation 24 'store' 'store_ln20' <Predicate = (!icmp_ln28)> <Delay = 1.58>
ST_1 : Operation 25 [1/1] (0.00ns)   --->   "%br_ln28 = br void %for.inc29" [src/generic/fp_generic.c:28]   --->   Operation 25 'br' 'br_ln28' <Predicate = (!icmp_ln28)> <Delay = 0.00>

State 2 <SV = 1> <Delay = 3.80>
ST_2 : Operation 26 [1/1] (0.00ns)   --->   "%trunc_ln28 = trunc i4 %i" [src/generic/fp_generic.c:28]   --->   Operation 26 'trunc' 'trunc_ln28' <Predicate = (!icmp_ln28)> <Delay = 0.00>
ST_2 : Operation 27 [1/1] (0.00ns)   --->   "%trunc_ln28_2 = trunc i4 %i" [src/generic/fp_generic.c:28]   --->   Operation 27 'trunc' 'trunc_ln28_2' <Predicate = (!icmp_ln28)> <Delay = 0.00>
ST_2 : Operation 28 [1/2] ( I:2.32ns O:2.32ns )   --->   "%c_0_load = load i3 %c_0_addr" [src/generic/fp_generic.c:29]   --->   Operation 28 'load' 'c_0_load' <Predicate = (!icmp_ln28)> <Delay = 2.32> <CoreInst = "RAM">   --->   Core 81 'RAM' <Latency = 1> <II = 1> <Delay = 2.32> <Storage> <Opcode : 'load' 'store'> <Ports = 2> <Width = 64> <Depth = 8> <RAM>
ST_2 : Operation 29 [1/2] ( I:2.32ns O:2.32ns )   --->   "%c_1_load = load i3 %c_1_addr" [src/generic/fp_generic.c:29]   --->   Operation 29 'load' 'c_1_load' <Predicate = (!icmp_ln28)> <Delay = 2.32> <CoreInst = "RAM">   --->   Core 81 'RAM' <Latency = 1> <II = 1> <Delay = 2.32> <Storage> <Opcode : 'load' 'store'> <Ports = 2> <Width = 64> <Depth = 8> <RAM>
ST_2 : Operation 30 [1/1] (1.48ns)   --->   "%select_ln29 = select i1 %trunc_ln28, i64 %c_1_load, i64 %c_0_load" [src/generic/fp_generic.c:29]   --->   Operation 30 'select' 'select_ln29' <Predicate = (!icmp_ln28)> <Delay = 1.48> <CoreInst = "Sel">   --->   Core 73 'Sel' <Latency = 0> <II = 1> <Delay = 1.48> <FuncUnit> <Opcode : 'select'> <InPorts = 3> <OutPorts = 1>
ST_2 : Operation 31 [1/1] (0.00ns)   --->   "%zext_ln29_10 = zext i3 %trunc_ln28_2" [src/generic/fp_generic.c:29]   --->   Operation 31 'zext' 'zext_ln29_10' <Predicate = (!icmp_ln28)> <Delay = 0.00>
ST_2 : Operation 32 [1/1] (0.00ns)   --->   "%p503x2_1_addr = getelementptr i64 %p503x2_1, i32 0, i32 %zext_ln29_10" [src/generic/fp_generic.c:29]   --->   Operation 32 'getelementptr' 'p503x2_1_addr' <Predicate = (!icmp_ln28)> <Delay = 0.00>
ST_2 : Operation 33 [2/2] (2.32ns)   --->   "%p503x2_1_load = load i3 %p503x2_1_addr" [src/generic/fp_generic.c:29]   --->   Operation 33 'load' 'p503x2_1_load' <Predicate = (!icmp_ln28)> <Delay = 2.32> <CoreInst = "ROM">   --->   Core 94 'ROM' <Latency = 1> <II = 1> <Delay = 2.32> <Storage> <Opcode : 'load'> <Ports = 0> <Width = 64> <Depth = 8> <ROM>
ST_2 : Operation 34 [1/1] (0.00ns)   --->   "%br_ln29 = br i1 %trunc_ln28, void %arrayidx159.case.0, void %arrayidx159.case.1" [src/generic/fp_generic.c:29]   --->   Operation 34 'br' 'br_ln29' <Predicate = (!icmp_ln28)> <Delay = 0.00>

State 3 <SV = 2> <Delay = 6.83>
ST_3 : Operation 35 [1/1] (0.00ns)   --->   "%carry = phi i1 %carry_63, void %arrayidx159.exit, i1 0, void %newFuncRoot"   --->   Operation 35 'phi' 'carry' <Predicate = true> <Delay = 0.00>
ST_3 : Operation 36 [1/1] (0.00ns)   --->   "%br_ln28 = br i1 %icmp_ln28, void %for.inc29.split, void %for.end31.exitStub" [src/generic/fp_generic.c:28]   --->   Operation 36 'br' 'br_ln28' <Predicate = true> <Delay = 0.00>
ST_3 : Operation 37 [1/2] ( I:2.32ns O:2.32ns )   --->   "%p503x2_1_load = load i3 %p503x2_1_addr" [src/generic/fp_generic.c:29]   --->   Operation 37 'load' 'p503x2_1_load' <Predicate = (!icmp_ln28)> <Delay = 2.32> <CoreInst = "ROM">   --->   Core 94 'ROM' <Latency = 1> <II = 1> <Delay = 2.32> <Storage> <Opcode : 'load'> <Ports = 0> <Width = 64> <Depth = 8> <ROM>
ST_3 : Operation 38 [1/1] (3.52ns)   --->   "%tempReg = sub i64 %select_ln29, i64 %p503x2_1_load" [src/generic/fp_generic.c:29]   --->   Operation 38 'sub' 'tempReg' <Predicate = (!icmp_ln28)> <Delay = 3.52> <CoreInst = "Adder">   --->   Core 1 'Adder' <Latency = 0> <II = 1> <Delay = 3.52> <FuncUnit> <Opcode : 'add' 'sub'> <InPorts = 2> <OutPorts = 1>
ST_3 : Operation 39 [1/1] (0.00ns) (grouped into LUT with out node tmp)   --->   "%xor_ln105 = xor i64 %p503x2_1_load, i64 %select_ln29" [src/config.h:105->src/generic/fp_generic.c:29]   --->   Operation 39 'xor' 'xor_ln105' <Predicate = (!icmp_ln28)> <Delay = 0.00> <CoreInst = "LogicGate">   --->   Core 74 'LogicGate' <Latency = 0> <II = 1> <Delay = 0.99> <FuncUnit> <Opcode : 'and' 'or' 'xor'> <InPorts = 2> <OutPorts = 1>
ST_3 : Operation 40 [1/1] (0.00ns) (grouped into LUT with out node tmp)   --->   "%xor_ln105_96 = xor i64 %p503x2_1_load, i64 %tempReg" [src/config.h:105->src/generic/fp_generic.c:29]   --->   Operation 40 'xor' 'xor_ln105_96' <Predicate = (!icmp_ln28)> <Delay = 0.00> <CoreInst = "LogicGate">   --->   Core 74 'LogicGate' <Latency = 0> <II = 1> <Delay = 0.99> <FuncUnit> <Opcode : 'and' 'or' 'xor'> <InPorts = 2> <OutPorts = 1>
ST_3 : Operation 41 [1/1] (0.00ns) (grouped into LUT with out node tmp)   --->   "%or_ln105 = or i64 %xor_ln105_96, i64 %xor_ln105" [src/config.h:105->src/generic/fp_generic.c:29]   --->   Operation 41 'or' 'or_ln105' <Predicate = (!icmp_ln28)> <Delay = 0.00> <CoreInst = "LogicGate">   --->   Core 74 'LogicGate' <Latency = 0> <II = 1> <Delay = 0.99> <FuncUnit> <Opcode : 'and' 'or' 'xor'> <InPorts = 2> <OutPorts = 1>
ST_3 : Operation 42 [1/1] (0.00ns) (grouped into LUT with out node tmp)   --->   "%xor_ln105_97 = xor i64 %or_ln105, i64 %select_ln29" [src/config.h:105->src/generic/fp_generic.c:29]   --->   Operation 42 'xor' 'xor_ln105_97' <Predicate = (!icmp_ln28)> <Delay = 0.00> <CoreInst = "LogicGate">   --->   Core 74 'LogicGate' <Latency = 0> <II = 1> <Delay = 0.99> <FuncUnit> <Opcode : 'and' 'or' 'xor'> <InPorts = 2> <OutPorts = 1>
ST_3 : Operation 43 [1/1] (0.99ns) (out node of the LUT)   --->   "%tmp = bitselect i1 @_ssdm_op_BitSelect.i1.i64.i32, i64 %xor_ln105_97, i32 63" [src/config.h:98->src/generic/fp_generic.c:29]   --->   Operation 43 'bitselect' 'tmp' <Predicate = (!icmp_ln28)> <Delay = 0.99>
ST_3 : Operation 59 [1/1] (0.00ns)   --->   "%write_ln29 = write void @_ssdm_op_Write.ap_auto.i1P0A, i1 %carry_out, i1 %carry" [src/generic/fp_generic.c:29]   --->   Operation 59 'write' 'write_ln29' <Predicate = (icmp_ln28)> <Delay = 0.00>
ST_3 : Operation 60 [1/1] (1.58ns)   --->   "%ret_ln0 = ret"   --->   Operation 60 'ret' 'ret_ln0' <Predicate = (icmp_ln28)> <Delay = 1.58>

State 4 <SV = 3> <Delay = 6.09>
ST_4 : Operation 44 [1/1] (0.00ns)   --->   "%specpipeline_ln20 = specpipeline void @_ssdm_op_SpecPipeline, i32 4294967295, i32 0, i32 0, i32 0, void @empty_44" [src/generic/fp_generic.c:20]   --->   Operation 44 'specpipeline' 'specpipeline_ln20' <Predicate = (!icmp_ln28)> <Delay = 0.00>
ST_4 : Operation 45 [1/1] (0.00ns)   --->   "%speclooptripcount_ln20 = speclooptripcount void @_ssdm_op_SpecLoopTripCount, i64 8, i64 8, i64 8" [src/generic/fp_generic.c:20]   --->   Operation 45 'speclooptripcount' 'speclooptripcount_ln20' <Predicate = (!icmp_ln28)> <Delay = 0.00>
ST_4 : Operation 46 [1/1] (0.00ns)   --->   "%specloopname_ln28 = specloopname void @_ssdm_op_SpecLoopName, void @empty_27" [src/generic/fp_generic.c:28]   --->   Operation 46 'specloopname' 'specloopname_ln28' <Predicate = (!icmp_ln28)> <Delay = 0.00>
ST_4 : Operation 47 [1/1] (3.52ns)   --->   "%sub_ln95 = sub i64 0, i64 %tempReg" [src/config.h:95->src/config.h:100->src/generic/fp_generic.c:29]   --->   Operation 47 'sub' 'sub_ln95' <Predicate = (!icmp_ln28)> <Delay = 3.52> <CoreInst = "Adder">   --->   Core 1 'Adder' <Latency = 0> <II = 1> <Delay = 3.52> <FuncUnit> <Opcode : 'add' 'sub'> <InPorts = 2> <OutPorts = 1>
ST_4 : Operation 48 [1/1] (0.00ns) (grouped into LUT with out node carry_63)   --->   "%or_ln95 = or i64 %tempReg, i64 %sub_ln95" [src/config.h:95->src/config.h:100->src/generic/fp_generic.c:29]   --->   Operation 48 'or' 'or_ln95' <Predicate = (!icmp_ln28)> <Delay = 0.00> <CoreInst = "LogicGate">   --->   Core 74 'LogicGate' <Latency = 0> <II = 1> <Delay = 0.99> <FuncUnit> <Opcode : 'and' 'or' 'xor'> <InPorts = 2> <OutPorts = 1>
ST_4 : Operation 49 [1/1] (0.00ns) (grouped into LUT with out node carry_63)   --->   "%tmp_204 = bitselect i1 @_ssdm_op_BitSelect.i1.i64.i32, i64 %or_ln95, i32 63" [src/generic/fp_generic.c:29]   --->   Operation 49 'bitselect' 'tmp_204' <Predicate = (!icmp_ln28)> <Delay = 0.00>
ST_4 : Operation 50 [1/1] (0.00ns) (grouped into LUT with out node carry_63)   --->   "%xor_ln29 = xor i1 %tmp_204, i1 1" [src/generic/fp_generic.c:29]   --->   Operation 50 'xor' 'xor_ln29' <Predicate = (!icmp_ln28)> <Delay = 0.00> <CoreInst = "LogicGate">   --->   Core 74 'LogicGate' <Latency = 0> <II = 1> <Delay = 0.97> <FuncUnit> <Opcode : 'and' 'or' 'xor'> <InPorts = 2> <OutPorts = 1>
ST_4 : Operation 51 [1/1] (0.00ns) (grouped into LUT with out node carry_63)   --->   "%and_ln29 = and i1 %carry, i1 %xor_ln29" [src/generic/fp_generic.c:29]   --->   Operation 51 'and' 'and_ln29' <Predicate = (!icmp_ln28)> <Delay = 0.00> <CoreInst = "LogicGate">   --->   Core 74 'LogicGate' <Latency = 0> <II = 1> <Delay = 0.97> <FuncUnit> <Opcode : 'and' 'or' 'xor'> <InPorts = 2> <OutPorts = 1>
ST_4 : Operation 52 [1/1] (0.99ns) (out node of the LUT)   --->   "%carry_63 = or i1 %and_ln29, i1 %tmp" [src/generic/fp_generic.c:29]   --->   Operation 52 'or' 'carry_63' <Predicate = (!icmp_ln28)> <Delay = 0.99> <CoreInst = "LogicGate">   --->   Core 74 'LogicGate' <Latency = 0> <II = 1> <Delay = 0.97> <FuncUnit> <Opcode : 'and' 'or' 'xor'> <InPorts = 2> <OutPorts = 1>
ST_4 : Operation 53 [1/1] (0.00ns)   --->   "%zext_ln29 = zext i1 %carry" [src/generic/fp_generic.c:29]   --->   Operation 53 'zext' 'zext_ln29' <Predicate = (!icmp_ln28)> <Delay = 0.00>
ST_4 : Operation 54 [1/1] (3.52ns)   --->   "%sub_ln29 = sub i64 %tempReg, i64 %zext_ln29" [src/generic/fp_generic.c:29]   --->   Operation 54 'sub' 'sub_ln29' <Predicate = (!icmp_ln28)> <Delay = 3.52> <CoreInst = "Adder">   --->   Core 1 'Adder' <Latency = 0> <II = 1> <Delay = 3.52> <FuncUnit> <Opcode : 'add' 'sub'> <InPorts = 2> <OutPorts = 1>
ST_4 : Operation 55 [1/1] ( I:2.32ns O:2.32ns )   --->   "%store_ln29 = store i64 %sub_ln29, i3 %c_0_addr" [src/generic/fp_generic.c:29]   --->   Operation 55 'store' 'store_ln29' <Predicate = (!trunc_ln28)> <Delay = 2.32> <CoreInst = "RAM">   --->   Core 81 'RAM' <Latency = 1> <II = 1> <Delay = 2.32> <Storage> <Opcode : 'load' 'store'> <Ports = 2> <Width = 64> <Depth = 8> <RAM>
ST_4 : Operation 56 [1/1] (0.00ns)   --->   "%br_ln29 = br void %arrayidx159.exit" [src/generic/fp_generic.c:29]   --->   Operation 56 'br' 'br_ln29' <Predicate = (!trunc_ln28)> <Delay = 0.00>
ST_4 : Operation 57 [1/1] ( I:2.32ns O:2.32ns )   --->   "%store_ln29 = store i64 %sub_ln29, i3 %c_1_addr" [src/generic/fp_generic.c:29]   --->   Operation 57 'store' 'store_ln29' <Predicate = (trunc_ln28)> <Delay = 2.32> <CoreInst = "RAM">   --->   Core 81 'RAM' <Latency = 1> <II = 1> <Delay = 2.32> <Storage> <Opcode : 'load' 'store'> <Ports = 2> <Width = 64> <Depth = 8> <RAM>
ST_4 : Operation 58 [1/1] (0.00ns)   --->   "%br_ln29 = br void %arrayidx159.exit" [src/generic/fp_generic.c:29]   --->   Operation 58 'br' 'br_ln29' <Predicate = (trunc_ln28)> <Delay = 0.00>


============================================================
+ Verbose Summary: Timing violations
============================================================
Target clock period: 10.000ns, clock uncertainty: 2.700ns.

 <State 1>: 4.911ns
The critical path consists of the following:
	'store' operation 0 bit ('store_ln20', src/generic/fp_generic.c:20) of constant 0 on local variable 'i', src/generic/fp_generic.c:20 [10]  (1.588 ns)
	'load' operation 4 bit ('i', src/generic/fp_generic.c:28) on local variable 'i', src/generic/fp_generic.c:20 [14]  (0.000 ns)
	'icmp' operation 1 bit ('icmp_ln28', src/generic/fp_generic.c:28) [15]  (1.735 ns)
	'store' operation 0 bit ('store_ln20', src/generic/fp_generic.c:20) of variable 'add_ln28', src/generic/fp_generic.c:28 on local variable 'i', src/generic/fp_generic.c:20 [59]  (1.588 ns)

 <State 2>: 3.803ns
The critical path consists of the following:
	'load' operation 64 bit ('c_0_load', src/generic/fp_generic.c:29) on array 'c_0' [31]  (2.322 ns)
	'select' operation 64 bit ('x', src/generic/fp_generic.c:29) [33]  (1.481 ns)

 <State 3>: 6.832ns
The critical path consists of the following:
	'load' operation 64 bit ('y', src/generic/fp_generic.c:29) on array 'p503x2_1' [36]  (2.322 ns)
	'sub' operation 64 bit ('tempReg', src/generic/fp_generic.c:29) [37]  (3.520 ns)
	'xor' operation 64 bit ('xor_ln105_96', src/config.h:105->src/generic/fp_generic.c:29) [39]  (0.000 ns)
	'or' operation 64 bit ('or_ln105', src/config.h:105->src/generic/fp_generic.c:29) [40]  (0.000 ns)
	'xor' operation 64 bit ('xor_ln105_97', src/config.h:105->src/generic/fp_generic.c:29) [41]  (0.000 ns)
	blocking operation 0.99 ns on control path)

 <State 4>: 6.098ns
The critical path consists of the following:
	'sub' operation 64 bit ('sub_ln95', src/config.h:95->src/config.h:100->src/generic/fp_generic.c:29) [43]  (3.520 ns)
	'or' operation 64 bit ('or_ln95', src/config.h:95->src/config.h:100->src/generic/fp_generic.c:29) [44]  (0.000 ns)
	'xor' operation 1 bit ('xor_ln29', src/generic/fp_generic.c:29) [46]  (0.000 ns)
	'and' operation 1 bit ('and_ln29', src/generic/fp_generic.c:29) [47]  (0.000 ns)
	'or' operation 1 bit ('borrowReg', src/generic/fp_generic.c:29) [48]  (0.990 ns)
	multiplexor before 'phi' operation 1 bit ('carry') with incoming values : ('borrowReg', src/generic/fp_generic.c:29) [13]  (1.588 ns)
	'phi' operation 1 bit ('carry') with incoming values : ('borrowReg', src/generic/fp_generic.c:29) [13]  (0.000 ns)


============================================================
+ Verbose Summary: Binding
============================================================
N/A
* FSMD analyzer results:
  - Output states:
 - Input state : 
  - Chain level:
	State 1
	State 2
	State 3
	State 4


============================================================
+ Verbose Summary: Datapath Resource usage 
============================================================
N/A
