

================================================================
== Vitis HLS Report for 'fpadd503_2_Pipeline_VITIS_LOOP_28_2'
================================================================
* Date:           Tue May 20 14:30:57 2025

* Version:        2024.2.2 (Build 6049644 on Mar  5 2025)
* Project:        sikep503_hls
* Solution:       solution1 (Vivado IP Flow Target)
* Product family: zynq
* Target device:  xc7z020-clg484-1


================================================================
== Performance Estimates
================================================================
+ Timing: 
    * Summary: 
    +--------+----------+----------+------------+
    |  Clock |  Target  | Estimated| Uncertainty|
    +--------+----------+----------+------------+
    |ap_clk  |  10.00 ns|  6.774 ns|     2.70 ns|
    +--------+----------+----------+------------+

+ Latency: 
    * Summary: 
    +---------+---------+----------+----------+-----+-----+------------------------------------------------+
    |  Latency (cycles) |  Latency (absolute) |  Interval |                    Pipeline                    |
    |   min   |   max   |    min   |    max   | min | max |                      Type                      |
    +---------+---------+----------+----------+-----+-----+------------------------------------------------+
    |       26|       26|  0.260 us|  0.260 us|   25|   25|  loop auto-rewind stp (delay=0 clock cycles(s))|
    +---------+---------+----------+----------+-----+-----+------------------------------------------------+

    + Detail: 
        * Instance: 
        N/A

        * Loop: 
        +-------------------+---------+---------+----------+-----------+-----------+------+----------+
        |                   |  Latency (cycles) | Iteration|  Initiation Interval  | Trip |          |
        |     Loop Name     |   min   |   max   |  Latency |  achieved |   target  | Count| Pipelined|
        +-------------------+---------+---------+----------+-----------+-----------+------+----------+
        |- VITIS_LOOP_28_2  |       24|       24|         3|          3|          1|     8|       yes|
        +-------------------+---------+---------+----------+-----------+-----------+------+----------+

============================================================
+ Verbose Summary: Synthesis Manager
============================================================
InlineROM: 1
ExposeGlobal: 0
============================================================
+ Verbose Summary: CDFG Model
============================================================
IsTopModel: 0
ResetActiveHigh: 1
IsCombinational: 0
IsDatapathOnly: 0
HasWiredReturn: 1
HasMFsm: 2
HasVarLatency: 1
IsPipeline: 0
IsRtlPipelined: 0
IsInstanceOverlapped: 0
IsDontTouch: 0
HasImplIP: 0
IsGatedGlobalClock: 0

+ Individual pipeline summary: 
  * Pipeline-0: initiation interval (II) = 3, depth = 3


============================================================
+ Verbose Summary: Schedule
============================================================
* Number of FSM states : 3
* Pipeline : 1
  Pipeline-0 : II = 3, D = 3, States = { 1 2 3 }
* Dataflow Pipeline: 0

* FSM state transitions: 
1 --> 2 
2 --> 3 
3 --> 

* FSM state operations: 

State 1 <SV = 0> <Delay = 4.91>
ST_1 : Operation 6 [1/1] (0.00ns)   --->   "%i_145 = alloca i32 1" [src/generic/fp_generic.c:20]   --->   Operation 6 'alloca' 'i_145' <Predicate = true> <Delay = 0.00>
ST_1 : Operation 7 [1/1] (0.00ns)   --->   "%specbramwithbyteenable_ln0 = specbramwithbyteenable void @_ssdm_op_SpecBRAMWithByteEnable, i64 %coeff"   --->   Operation 7 'specbramwithbyteenable' 'specbramwithbyteenable_ln0' <Predicate = true> <Delay = 0.00>
ST_1 : Operation 8 [1/1] (1.58ns)   --->   "%store_ln20 = store i4 0, i4 %i_145" [src/generic/fp_generic.c:20]   --->   Operation 8 'store' 'store_ln20' <Predicate = true> <Delay = 1.58>
ST_1 : Operation 9 [1/1] (1.58ns)   --->   "%br_ln0 = br void %for.inc29"   --->   Operation 9 'br' 'br_ln0' <Predicate = true> <Delay = 1.58>
ST_1 : Operation 10 [1/1] (0.00ns)   --->   "%carry = phi i1 %borrowReg, void %for.inc29.split, i1 0, void %newFuncRoot"   --->   Operation 10 'phi' 'carry' <Predicate = true> <Delay = 0.00>
ST_1 : Operation 11 [1/1] (0.00ns)   --->   "%i = load i4 %i_145" [src/generic/fp_generic.c:29]   --->   Operation 11 'load' 'i' <Predicate = true> <Delay = 0.00>
ST_1 : Operation 12 [1/1] (1.73ns)   --->   "%icmp_ln28 = icmp_eq  i4 %i, i4 8" [src/generic/fp_generic.c:28]   --->   Operation 12 'icmp' 'icmp_ln28' <Predicate = true> <Delay = 1.73> <CoreInst = "Cmp">   --->   Core 9 'Cmp' <Latency = 0> <II = 1> <Delay = 1.73> <FuncUnit> <Opcode : 'seteq' 'setne' 'setle' 'setge' 'setlt' 'setgt'> <InPorts = 2> <OutPorts = 1>
ST_1 : Operation 13 [1/1] (1.73ns)   --->   "%add_ln28 = add i4 %i, i4 1" [src/generic/fp_generic.c:28]   --->   Operation 13 'add' 'add_ln28' <Predicate = true> <Delay = 1.73> <CoreInst = "Adder">   --->   Core 1 'Adder' <Latency = 0> <II = 1> <Delay = 1.73> <FuncUnit> <Opcode : 'add' 'sub'> <InPorts = 2> <OutPorts = 1>
ST_1 : Operation 14 [1/1] (0.00ns)   --->   "%br_ln28 = br i1 %icmp_ln28, void %for.inc29.split, void %for.end31.exitStub" [src/generic/fp_generic.c:28]   --->   Operation 14 'br' 'br_ln28' <Predicate = true> <Delay = 0.00>
ST_1 : Operation 15 [1/1] (0.00ns)   --->   "%trunc_ln29 = trunc i4 %i" [src/generic/fp_generic.c:29]   --->   Operation 15 'trunc' 'trunc_ln29' <Predicate = (!icmp_ln28)> <Delay = 0.00>
ST_1 : Operation 16 [1/1] (0.00ns)   --->   "%zext_ln29_s = bitconcatenate i6 @_ssdm_op_BitConcatenate.i6.i3.i3, i3 5, i3 %trunc_ln29" [src/generic/fp_generic.c:29]   --->   Operation 16 'bitconcatenate' 'zext_ln29_s' <Predicate = (!icmp_ln28)> <Delay = 0.00>
ST_1 : Operation 17 [1/1] (0.00ns)   --->   "%zext_ln29_19 = zext i6 %zext_ln29_s" [src/generic/fp_generic.c:29]   --->   Operation 17 'zext' 'zext_ln29_19' <Predicate = (!icmp_ln28)> <Delay = 0.00>
ST_1 : Operation 18 [1/1] (0.00ns)   --->   "%coeff_addr = getelementptr i64 %coeff, i32 0, i32 %zext_ln29_19" [src/generic/fp_generic.c:29]   --->   Operation 18 'getelementptr' 'coeff_addr' <Predicate = (!icmp_ln28)> <Delay = 0.00>
ST_1 : Operation 19 [2/2] (3.25ns)   --->   "%coeff_load = load i6 %coeff_addr" [src/generic/fp_generic.c:29]   --->   Operation 19 'load' 'coeff_load' <Predicate = (!icmp_ln28)> <Delay = 3.25> <CoreInst = "RAM">   --->   Core 81 'RAM' <Latency = 1> <II = 1> <Delay = 3.25> <Storage> <Opcode : 'load' 'store'> <Ports = 2> <Width = 64> <Depth = 48> <RAM>
ST_1 : Operation 20 [1/1] (0.00ns)   --->   "%zext_ln29_20 = zext i3 %trunc_ln29" [src/generic/fp_generic.c:29]   --->   Operation 20 'zext' 'zext_ln29_20' <Predicate = (!icmp_ln28)> <Delay = 0.00>
ST_1 : Operation 21 [1/1] (0.00ns)   --->   "%p503x2_1_addr = getelementptr i64 %p503x2_1, i32 0, i32 %zext_ln29_20" [src/generic/fp_generic.c:29]   --->   Operation 21 'getelementptr' 'p503x2_1_addr' <Predicate = (!icmp_ln28)> <Delay = 0.00>
ST_1 : Operation 22 [2/2] (2.32ns)   --->   "%p503x2_1_load = load i3 %p503x2_1_addr" [src/generic/fp_generic.c:29]   --->   Operation 22 'load' 'p503x2_1_load' <Predicate = (!icmp_ln28)> <Delay = 2.32> <CoreInst = "ROM">   --->   Core 94 'ROM' <Latency = 1> <II = 1> <Delay = 2.32> <Storage> <Opcode : 'load'> <Ports = 0> <Width = 64> <Depth = 8> <ROM>
ST_1 : Operation 23 [1/1] (1.58ns)   --->   "%store_ln20 = store i4 %add_ln28, i4 %i_145" [src/generic/fp_generic.c:20]   --->   Operation 23 'store' 'store_ln20' <Predicate = (!icmp_ln28)> <Delay = 1.58>
ST_1 : Operation 45 [1/1] (0.00ns)   --->   "%write_ln29 = write void @_ssdm_op_Write.ap_auto.i1P0A, i1 %carry_184_out, i1 %carry" [src/generic/fp_generic.c:29]   --->   Operation 45 'write' 'write_ln29' <Predicate = (icmp_ln28)> <Delay = 0.00>
ST_1 : Operation 46 [1/1] (1.58ns)   --->   "%ret_ln0 = ret"   --->   Operation 46 'ret' 'ret_ln0' <Predicate = (icmp_ln28)> <Delay = 1.58>

State 2 <SV = 1> <Delay = 6.77>
ST_2 : Operation 24 [1/2] ( I:3.25ns O:3.25ns )   --->   "%coeff_load = load i6 %coeff_addr" [src/generic/fp_generic.c:29]   --->   Operation 24 'load' 'coeff_load' <Predicate = true> <Delay = 3.25> <CoreInst = "RAM">   --->   Core 81 'RAM' <Latency = 1> <II = 1> <Delay = 3.25> <Storage> <Opcode : 'load' 'store'> <Ports = 2> <Width = 64> <Depth = 48> <RAM>
ST_2 : Operation 25 [1/2] ( I:2.32ns O:2.32ns )   --->   "%p503x2_1_load = load i3 %p503x2_1_addr" [src/generic/fp_generic.c:29]   --->   Operation 25 'load' 'p503x2_1_load' <Predicate = true> <Delay = 2.32> <CoreInst = "ROM">   --->   Core 94 'ROM' <Latency = 1> <II = 1> <Delay = 2.32> <Storage> <Opcode : 'load'> <Ports = 0> <Width = 64> <Depth = 8> <ROM>
ST_2 : Operation 26 [1/1] (3.52ns)   --->   "%tempReg = sub i64 %coeff_load, i64 %p503x2_1_load" [src/generic/fp_generic.c:29]   --->   Operation 26 'sub' 'tempReg' <Predicate = true> <Delay = 3.52> <CoreInst = "Adder">   --->   Core 1 'Adder' <Latency = 0> <II = 1> <Delay = 3.52> <FuncUnit> <Opcode : 'add' 'sub'> <InPorts = 2> <OutPorts = 1>

State 3 <SV = 2> <Delay = 6.77>
ST_3 : Operation 27 [1/1] (0.00ns)   --->   "%specpipeline_ln20 = specpipeline void @_ssdm_op_SpecPipeline, i32 4294967295, i32 0, i32 0, i32 0, void @empty_44" [src/generic/fp_generic.c:20]   --->   Operation 27 'specpipeline' 'specpipeline_ln20' <Predicate = true> <Delay = 0.00>
ST_3 : Operation 28 [1/1] (0.00ns)   --->   "%speclooptripcount_ln20 = speclooptripcount void @_ssdm_op_SpecLoopTripCount, i64 8, i64 8, i64 8" [src/generic/fp_generic.c:20]   --->   Operation 28 'speclooptripcount' 'speclooptripcount_ln20' <Predicate = true> <Delay = 0.00>
ST_3 : Operation 29 [1/1] (0.00ns)   --->   "%specloopname_ln28 = specloopname void @_ssdm_op_SpecLoopName, void @empty_27" [src/generic/fp_generic.c:28]   --->   Operation 29 'specloopname' 'specloopname_ln28' <Predicate = true> <Delay = 0.00>
ST_3 : Operation 30 [1/1] (0.00ns) (grouped into LUT with out node tmp)   --->   "%xor_ln105 = xor i64 %p503x2_1_load, i64 %coeff_load" [src/config.h:105->src/generic/fp_generic.c:29]   --->   Operation 30 'xor' 'xor_ln105' <Predicate = true> <Delay = 0.00> <CoreInst = "LogicGate">   --->   Core 74 'LogicGate' <Latency = 0> <II = 1> <Delay = 0.99> <FuncUnit> <Opcode : 'and' 'or' 'xor'> <InPorts = 2> <OutPorts = 1>
ST_3 : Operation 31 [1/1] (0.00ns) (grouped into LUT with out node tmp)   --->   "%xor_ln105_108 = xor i64 %p503x2_1_load, i64 %tempReg" [src/config.h:105->src/generic/fp_generic.c:29]   --->   Operation 31 'xor' 'xor_ln105_108' <Predicate = true> <Delay = 0.00> <CoreInst = "LogicGate">   --->   Core 74 'LogicGate' <Latency = 0> <II = 1> <Delay = 0.99> <FuncUnit> <Opcode : 'and' 'or' 'xor'> <InPorts = 2> <OutPorts = 1>
ST_3 : Operation 32 [1/1] (0.00ns) (grouped into LUT with out node tmp)   --->   "%or_ln105 = or i64 %xor_ln105_108, i64 %xor_ln105" [src/config.h:105->src/generic/fp_generic.c:29]   --->   Operation 32 'or' 'or_ln105' <Predicate = true> <Delay = 0.00> <CoreInst = "LogicGate">   --->   Core 74 'LogicGate' <Latency = 0> <II = 1> <Delay = 0.99> <FuncUnit> <Opcode : 'and' 'or' 'xor'> <InPorts = 2> <OutPorts = 1>
ST_3 : Operation 33 [1/1] (0.00ns) (grouped into LUT with out node tmp)   --->   "%xor_ln105_109 = xor i64 %coeff_load, i64 %or_ln105" [src/config.h:105->src/generic/fp_generic.c:29]   --->   Operation 33 'xor' 'xor_ln105_109' <Predicate = true> <Delay = 0.00> <CoreInst = "LogicGate">   --->   Core 74 'LogicGate' <Latency = 0> <II = 1> <Delay = 0.99> <FuncUnit> <Opcode : 'and' 'or' 'xor'> <InPorts = 2> <OutPorts = 1>
ST_3 : Operation 34 [1/1] (0.99ns) (out node of the LUT)   --->   "%tmp = bitselect i1 @_ssdm_op_BitSelect.i1.i64.i32, i64 %xor_ln105_109, i32 63" [src/config.h:98->src/generic/fp_generic.c:29]   --->   Operation 34 'bitselect' 'tmp' <Predicate = true> <Delay = 0.99>
ST_3 : Operation 35 [1/1] (3.52ns)   --->   "%sub_ln95 = sub i64 0, i64 %tempReg" [src/config.h:95->src/config.h:100->src/generic/fp_generic.c:29]   --->   Operation 35 'sub' 'sub_ln95' <Predicate = true> <Delay = 3.52> <CoreInst = "Adder">   --->   Core 1 'Adder' <Latency = 0> <II = 1> <Delay = 3.52> <FuncUnit> <Opcode : 'add' 'sub'> <InPorts = 2> <OutPorts = 1>
ST_3 : Operation 36 [1/1] (0.00ns) (grouped into LUT with out node borrowReg)   --->   "%or_ln95 = or i64 %tempReg, i64 %sub_ln95" [src/config.h:95->src/config.h:100->src/generic/fp_generic.c:29]   --->   Operation 36 'or' 'or_ln95' <Predicate = true> <Delay = 0.00> <CoreInst = "LogicGate">   --->   Core 74 'LogicGate' <Latency = 0> <II = 1> <Delay = 0.99> <FuncUnit> <Opcode : 'and' 'or' 'xor'> <InPorts = 2> <OutPorts = 1>
ST_3 : Operation 37 [1/1] (0.00ns) (grouped into LUT with out node borrowReg)   --->   "%tmp_212 = bitselect i1 @_ssdm_op_BitSelect.i1.i64.i32, i64 %or_ln95, i32 63" [src/generic/fp_generic.c:29]   --->   Operation 37 'bitselect' 'tmp_212' <Predicate = true> <Delay = 0.00>
ST_3 : Operation 38 [1/1] (0.00ns) (grouped into LUT with out node borrowReg)   --->   "%xor_ln29 = xor i1 %tmp_212, i1 1" [src/generic/fp_generic.c:29]   --->   Operation 38 'xor' 'xor_ln29' <Predicate = true> <Delay = 0.00> <CoreInst = "LogicGate">   --->   Core 74 'LogicGate' <Latency = 0> <II = 1> <Delay = 0.97> <FuncUnit> <Opcode : 'and' 'or' 'xor'> <InPorts = 2> <OutPorts = 1>
ST_3 : Operation 39 [1/1] (0.00ns) (grouped into LUT with out node borrowReg)   --->   "%and_ln29 = and i1 %carry, i1 %xor_ln29" [src/generic/fp_generic.c:29]   --->   Operation 39 'and' 'and_ln29' <Predicate = true> <Delay = 0.00> <CoreInst = "LogicGate">   --->   Core 74 'LogicGate' <Latency = 0> <II = 1> <Delay = 0.97> <FuncUnit> <Opcode : 'and' 'or' 'xor'> <InPorts = 2> <OutPorts = 1>
ST_3 : Operation 40 [1/1] (0.99ns) (out node of the LUT)   --->   "%borrowReg = or i1 %and_ln29, i1 %tmp" [src/generic/fp_generic.c:29]   --->   Operation 40 'or' 'borrowReg' <Predicate = true> <Delay = 0.99> <CoreInst = "LogicGate">   --->   Core 74 'LogicGate' <Latency = 0> <II = 1> <Delay = 0.97> <FuncUnit> <Opcode : 'and' 'or' 'xor'> <InPorts = 2> <OutPorts = 1>
ST_3 : Operation 41 [1/1] (0.00ns)   --->   "%zext_ln29 = zext i1 %carry" [src/generic/fp_generic.c:29]   --->   Operation 41 'zext' 'zext_ln29' <Predicate = true> <Delay = 0.00>
ST_3 : Operation 42 [1/1] (3.52ns)   --->   "%sub_ln29 = sub i64 %tempReg, i64 %zext_ln29" [src/generic/fp_generic.c:29]   --->   Operation 42 'sub' 'sub_ln29' <Predicate = true> <Delay = 3.52> <CoreInst = "Adder">   --->   Core 1 'Adder' <Latency = 0> <II = 1> <Delay = 3.52> <FuncUnit> <Opcode : 'add' 'sub'> <InPorts = 2> <OutPorts = 1>
ST_3 : Operation 43 [1/1] ( I:3.25ns O:3.25ns )   --->   "%store_ln29 = store void @_ssdm_op_Write.bram.i64, i6 %coeff_addr, i64 %sub_ln29, i8 255" [src/generic/fp_generic.c:29]   --->   Operation 43 'store' 'store_ln29' <Predicate = true> <Delay = 3.25> <CoreInst = "RAM">   --->   Core 81 'RAM' <Latency = 1> <II = 1> <Delay = 3.25> <Storage> <Opcode : 'load' 'store'> <Ports = 2> <Width = 64> <Depth = 48> <RAM>
ST_3 : Operation 44 [1/1] (0.00ns)   --->   "%br_ln28 = br void %for.inc29" [src/generic/fp_generic.c:28]   --->   Operation 44 'br' 'br_ln28' <Predicate = true> <Delay = 0.00>


============================================================
+ Verbose Summary: Timing violations
============================================================
Target clock period: 10.000ns, clock uncertainty: 2.700ns.

 <State 1>: 4.911ns
The critical path consists of the following:
	'store' operation 0 bit ('store_ln20', src/generic/fp_generic.c:20) of constant 0 on local variable 'i', src/generic/fp_generic.c:20 [6]  (1.588 ns)
	'load' operation 4 bit ('i', src/generic/fp_generic.c:29) on local variable 'i', src/generic/fp_generic.c:20 [10]  (0.000 ns)
	'icmp' operation 1 bit ('icmp_ln28', src/generic/fp_generic.c:28) [11]  (1.735 ns)
	'store' operation 0 bit ('store_ln20', src/generic/fp_generic.c:20) of variable 'add_ln28', src/generic/fp_generic.c:28 on local variable 'i', src/generic/fp_generic.c:20 [41]  (1.588 ns)

 <State 2>: 6.774ns
The critical path consists of the following:
	'load' operation 64 bit ('x', src/generic/fp_generic.c:29) on array 'coeff' [22]  (3.254 ns)
	'sub' operation 64 bit ('tempReg', src/generic/fp_generic.c:29) [26]  (3.520 ns)

 <State 3>: 6.774ns
The critical path consists of the following:
	'sub' operation 64 bit ('sub_ln29', src/generic/fp_generic.c:29) [39]  (3.520 ns)
	'store' operation 0 bit ('store_ln29', src/generic/fp_generic.c:29) of constant <constant:_ssdm_op_Write.bram.i64> on array 'coeff' [40]  (3.254 ns)


============================================================
+ Verbose Summary: Binding
============================================================
N/A
* FSMD analyzer results:
  - Output states:
 - Input state : 
  - Chain level:
	State 1
	State 2
	State 3


============================================================
+ Verbose Summary: Datapath Resource usage 
============================================================
N/A
