

================================================================
== Vitis HLS Report for 'mp_mul_141_2_Pipeline_VITIS_LOOP_144_2'
================================================================
* Date:           Tue May 20 14:32:02 2025

* Version:        2024.2.2 (Build 6049644 on Mar  5 2025)
* Project:        sikep503_hls
* Solution:       solution1 (Vivado IP Flow Target)
* Product family: zynq
* Target device:  xc7z020-clg484-1


================================================================
== Performance Estimates
================================================================
+ Timing: 
    * Summary: 
    +--------+----------+----------+------------+
    |  Clock |  Target  | Estimated| Uncertainty|
    +--------+----------+----------+------------+
    |ap_clk  |  10.00 ns|  7.040 ns|     2.70 ns|
    +--------+----------+----------+------------+

+ Latency: 
    * Summary: 
    +---------+---------+----------+----------+-----+-----+------------------------------------------------+
    |  Latency (cycles) |  Latency (absolute) |  Interval |                    Pipeline                    |
    |   min   |   max   |    min   |    max   | min | max |                      Type                      |
    +---------+---------+----------+----------+-----+-----+------------------------------------------------+
    |       10|       17|  0.100 us|  0.170 us|    2|    9|  loop auto-rewind stp (delay=0 clock cycles(s))|
    +---------+---------+----------+----------+-----+-----+------------------------------------------------+

    + Detail: 
        * Instance: 
        N/A

        * Loop: 
        +--------------------+---------+---------+----------+-----------+-----------+-------+----------+
        |                    |  Latency (cycles) | Iteration|  Initiation Interval  |  Trip |          |
        |      Loop Name     |   min   |   max   |  Latency |  achieved |   target  | Count | Pipelined|
        +--------------------+---------+---------+----------+-----------+-----------+-------+----------+
        |- VITIS_LOOP_144_2  |        8|       15|         9|          1|          1|  1 ~ 8|       yes|
        +--------------------+---------+---------+----------+-----------+-----------+-------+----------+

============================================================
+ Verbose Summary: Synthesis Manager
============================================================
InlineROM: 1
ExposeGlobal: 0
============================================================
+ Verbose Summary: CDFG Model
============================================================
IsTopModel: 0
ResetActiveHigh: 1
IsCombinational: 0
IsDatapathOnly: 0
HasWiredReturn: 1
HasMFsm: 2
HasVarLatency: 1
IsPipeline: 0
IsRtlPipelined: 0
IsInstanceOverlapped: 0
IsDontTouch: 0
HasImplIP: 0
IsGatedGlobalClock: 0

+ Individual pipeline summary: 
  * Pipeline-0: initiation interval (II) = 1, depth = 9


============================================================
+ Verbose Summary: Schedule
============================================================
* Number of FSM states : 9
* Pipeline : 1
  Pipeline-0 : II = 1, D = 9, States = { 1 2 3 4 5 6 7 8 9 }
* Dataflow Pipeline: 0

* FSM state transitions: 
1 --> 2 
2 --> 3 
3 --> 4 
4 --> 5 
5 --> 6 
6 --> 7 
7 --> 8 
8 --> 9 
9 --> 

* FSM state operations: 

State 1 <SV = 0> <Delay = 5.56>
ST_1 : Operation 12 [1/1] (0.00ns)   --->   "%v_114 = alloca i32 1" [src/generic/fp_generic.c:140]   --->   Operation 12 'alloca' 'v_114' <Predicate = true> <Delay = 0.00>
ST_1 : Operation 13 [1/1] (0.00ns)   --->   "%j = alloca i32 1" [src/generic/fp_generic.c:139]   --->   Operation 13 'alloca' 'j' <Predicate = true> <Delay = 0.00>
ST_1 : Operation 14 [1/1] (0.00ns)   --->   "%tmp = read i3 @_ssdm_op_Read.ap_auto.i3, i3 %empty"   --->   Operation 14 'read' 'tmp' <Predicate = true> <Delay = 0.00>
ST_1 : Operation 15 [1/1] (0.00ns)   --->   "%indvars_iv31_read = read i4 @_ssdm_op_Read.ap_auto.i4, i4 %indvars_iv31"   --->   Operation 15 'read' 'indvars_iv31_read' <Predicate = true> <Delay = 0.00>
ST_1 : Operation 16 [1/1] (0.00ns)   --->   "%zext_ln143_read = read i4 @_ssdm_op_Read.ap_auto.i4, i4 %zext_ln143"   --->   Operation 16 'read' 'zext_ln143_read' <Predicate = true> <Delay = 0.00>
ST_1 : Operation 17 [1/1] (0.00ns)   --->   "%v_017_read = read i64 @_ssdm_op_Read.ap_auto.i64, i64 %v_017"   --->   Operation 17 'read' 'v_017_read' <Predicate = true> <Delay = 0.00>
ST_1 : Operation 18 [1/1] (0.00ns)   --->   "%zext_ln143_cast = zext i4 %zext_ln143_read"   --->   Operation 18 'zext' 'zext_ln143_cast' <Predicate = true> <Delay = 0.00>
ST_1 : Operation 19 [1/1] (1.58ns)   --->   "%store_ln139 = store i4 0, i4 %j" [src/generic/fp_generic.c:139]   --->   Operation 19 'store' 'store_ln139' <Predicate = true> <Delay = 1.58>
ST_1 : Operation 20 [1/1] (1.58ns)   --->   "%store_ln140 = store i64 %v_017_read, i64 %v_114" [src/generic/fp_generic.c:140]   --->   Operation 20 'store' 'store_ln140' <Predicate = true> <Delay = 1.58>
ST_1 : Operation 21 [1/1] (1.58ns)   --->   "%store_ln140 = store i64 %zext_ln143_cast, i64 %u_95_out" [src/generic/fp_generic.c:140]   --->   Operation 21 'store' 'store_ln140' <Predicate = true> <Delay = 1.58>
ST_1 : Operation 22 [1/1] (1.58ns)   --->   "%store_ln140 = store i4 0, i4 %t_out" [src/generic/fp_generic.c:140]   --->   Operation 22 'store' 'store_ln140' <Predicate = true> <Delay = 1.58>
ST_1 : Operation 23 [1/1] (0.00ns)   --->   "%br_ln0 = br void %for.inc"   --->   Operation 23 'br' 'br_ln0' <Predicate = true> <Delay = 0.00>
ST_1 : Operation 24 [1/1] (0.00ns)   --->   "%j_44 = load i4 %j" [src/generic/fp_generic.c:144]   --->   Operation 24 'load' 'j_44' <Predicate = true> <Delay = 0.00>
ST_1 : Operation 25 [1/1] (1.73ns)   --->   "%icmp_ln144 = icmp_eq  i4 %j_44, i4 %indvars_iv31_read" [src/generic/fp_generic.c:144]   --->   Operation 25 'icmp' 'icmp_ln144' <Predicate = true> <Delay = 1.73> <CoreInst = "Cmp">   --->   Core 9 'Cmp' <Latency = 0> <II = 1> <Delay = 1.73> <FuncUnit> <Opcode : 'seteq' 'setne' 'setle' 'setge' 'setlt' 'setgt'> <InPorts = 2> <OutPorts = 1>
ST_1 : Operation 26 [1/1] (1.73ns)   --->   "%add_ln144 = add i4 %j_44, i4 1" [src/generic/fp_generic.c:144]   --->   Operation 26 'add' 'add_ln144' <Predicate = true> <Delay = 1.73> <CoreInst = "Adder">   --->   Core 1 'Adder' <Latency = 0> <II = 1> <Delay = 1.73> <FuncUnit> <Opcode : 'add' 'sub'> <InPorts = 2> <OutPorts = 1>
ST_1 : Operation 27 [1/1] (0.00ns)   --->   "%br_ln144 = br i1 %icmp_ln144, void %for.inc.split, void %for.inc22.exitStub" [src/generic/fp_generic.c:144]   --->   Operation 27 'br' 'br_ln144' <Predicate = true> <Delay = 0.00>
ST_1 : Operation 28 [1/1] (0.00ns)   --->   "%trunc_ln144 = trunc i4 %j_44" [src/generic/fp_generic.c:144]   --->   Operation 28 'trunc' 'trunc_ln144' <Predicate = (!icmp_ln144)> <Delay = 0.00>
ST_1 : Operation 29 [1/1] (0.00ns)   --->   "%zext_ln145 = zext i3 %trunc_ln144" [src/generic/fp_generic.c:145]   --->   Operation 29 'zext' 'zext_ln145' <Predicate = (!icmp_ln144)> <Delay = 0.00>
ST_1 : Operation 30 [1/1] (0.00ns)   --->   "%b_addr_2 = getelementptr i64 %b, i32 0, i32 %zext_ln145" [src/generic/fp_generic.c:145]   --->   Operation 30 'getelementptr' 'b_addr_2' <Predicate = (!icmp_ln144)> <Delay = 0.00>
ST_1 : Operation 31 [2/2] (2.32ns)   --->   "%b_load = load i3 %b_addr_2" [src/generic/fp_generic.c:145]   --->   Operation 31 'load' 'b_load' <Predicate = (!icmp_ln144)> <Delay = 2.32> <CoreInst = "RAM">   --->   Core 81 'RAM' <Latency = 1> <II = 1> <Delay = 2.32> <Storage> <Opcode : 'load' 'store'> <Ports = 2> <Width = 64> <Depth = 8> <RAM>
ST_1 : Operation 32 [1/1] (1.65ns)   --->   "%sub_ln145 = sub i3 %tmp, i3 %trunc_ln144" [src/generic/fp_generic.c:145]   --->   Operation 32 'sub' 'sub_ln145' <Predicate = (!icmp_ln144)> <Delay = 1.65> <CoreInst = "Adder">   --->   Core 1 'Adder' <Latency = 0> <II = 1> <Delay = 1.65> <FuncUnit> <Opcode : 'add' 'sub'> <InPorts = 2> <OutPorts = 1>
ST_1 : Operation 33 [1/1] (0.00ns)   --->   "%zext_ln145_25 = zext i3 %sub_ln145" [src/generic/fp_generic.c:145]   --->   Operation 33 'zext' 'zext_ln145_25' <Predicate = (!icmp_ln144)> <Delay = 0.00>
ST_1 : Operation 34 [1/1] (0.00ns)   --->   "%b_addr = getelementptr i64 %b, i32 0, i32 %zext_ln145_25" [src/generic/fp_generic.c:145]   --->   Operation 34 'getelementptr' 'b_addr' <Predicate = (!icmp_ln144)> <Delay = 0.00>
ST_1 : Operation 35 [2/2] (2.32ns)   --->   "%b_load_2 = load i3 %b_addr" [src/generic/fp_generic.c:145]   --->   Operation 35 'load' 'b_load_2' <Predicate = (!icmp_ln144)> <Delay = 2.32> <CoreInst = "RAM">   --->   Core 81 'RAM' <Latency = 1> <II = 1> <Delay = 2.32> <Storage> <Opcode : 'load' 'store'> <Ports = 2> <Width = 64> <Depth = 8> <RAM>
ST_1 : Operation 36 [1/1] (1.58ns)   --->   "%store_ln139 = store i4 %add_ln144, i4 %j" [src/generic/fp_generic.c:139]   --->   Operation 36 'store' 'store_ln139' <Predicate = (!icmp_ln144)> <Delay = 1.58>

State 2 <SV = 1> <Delay = 2.32>
ST_2 : Operation 37 [1/2] ( I:2.32ns O:2.32ns )   --->   "%b_load = load i3 %b_addr_2" [src/generic/fp_generic.c:145]   --->   Operation 37 'load' 'b_load' <Predicate = true> <Delay = 2.32> <CoreInst = "RAM">   --->   Core 81 'RAM' <Latency = 1> <II = 1> <Delay = 2.32> <Storage> <Opcode : 'load' 'store'> <Ports = 2> <Width = 64> <Depth = 8> <RAM>
ST_2 : Operation 38 [1/1] (0.00ns)   --->   "%al = trunc i64 %b_load" [src/generic/fp_generic.c:145]   --->   Operation 38 'trunc' 'al' <Predicate = true> <Delay = 0.00>
ST_2 : Operation 39 [1/2] ( I:2.32ns O:2.32ns )   --->   "%b_load_2 = load i3 %b_addr" [src/generic/fp_generic.c:145]   --->   Operation 39 'load' 'b_load_2' <Predicate = true> <Delay = 2.32> <CoreInst = "RAM">   --->   Core 81 'RAM' <Latency = 1> <II = 1> <Delay = 2.32> <Storage> <Opcode : 'load' 'store'> <Ports = 2> <Width = 64> <Depth = 8> <RAM>
ST_2 : Operation 40 [1/1] (0.00ns)   --->   "%bl = trunc i64 %b_load_2" [src/generic/fp_generic.c:103->src/generic/fp_generic.c:145]   --->   Operation 40 'trunc' 'bl' <Predicate = true> <Delay = 0.00>
ST_2 : Operation 41 [1/1] (0.00ns)   --->   "%ah = partselect i32 @_ssdm_op_PartSelect.i32.i64.i32.i32, i64 %b_load, i32 32, i32 63" [src/generic/fp_generic.c:110->src/generic/fp_generic.c:145]   --->   Operation 41 'partselect' 'ah' <Predicate = true> <Delay = 0.00>
ST_2 : Operation 42 [1/1] (0.00ns)   --->   "%bh = partselect i32 @_ssdm_op_PartSelect.i32.i64.i32.i32, i64 %b_load_2, i32 32, i32 63" [src/generic/fp_generic.c:112->src/generic/fp_generic.c:145]   --->   Operation 42 'partselect' 'bh' <Predicate = true> <Delay = 0.00>

State 3 <SV = 2> <Delay = 6.91>
ST_3 : Operation 43 [1/1] (0.00ns)   --->   "%zext_ln105 = zext i32 %al" [src/generic/fp_generic.c:105->src/generic/fp_generic.c:145]   --->   Operation 43 'zext' 'zext_ln105' <Predicate = true> <Delay = 0.00>
ST_3 : Operation 44 [1/1] (0.00ns)   --->   "%zext_ln110 = zext i32 %ah" [src/generic/fp_generic.c:110->src/generic/fp_generic.c:145]   --->   Operation 44 'zext' 'zext_ln110' <Predicate = true> <Delay = 0.00>
ST_3 : Operation 45 [1/1] (0.00ns)   --->   "%zext_ln105_171 = zext i32 %bl" [src/generic/fp_generic.c:105->src/generic/fp_generic.c:145]   --->   Operation 45 'zext' 'zext_ln105_171' <Predicate = true> <Delay = 0.00>
ST_3 : Operation 46 [1/1] (0.00ns)   --->   "%zext_ln112 = zext i32 %bh" [src/generic/fp_generic.c:112->src/generic/fp_generic.c:145]   --->   Operation 46 'zext' 'zext_ln112' <Predicate = true> <Delay = 0.00>
ST_3 : Operation 47 [2/2] (6.91ns)   --->   "%albl = mul i64 %zext_ln105_171, i64 %zext_ln105" [src/generic/fp_generic.c:114->src/generic/fp_generic.c:145]   --->   Operation 47 'mul' 'albl' <Predicate = true> <Delay = 6.91> <CoreInst = "Multiplier">   --->   Core 3 'Multiplier' <Latency = 1> <II = 1> <Delay = 6.91> <FuncUnit> <Opcode : 'mul'> <InPorts = 2> <OutPorts = 1>
ST_3 : Operation 48 [2/2] (6.91ns)   --->   "%albh = mul i64 %zext_ln112, i64 %zext_ln105" [src/generic/fp_generic.c:115->src/generic/fp_generic.c:145]   --->   Operation 48 'mul' 'albh' <Predicate = true> <Delay = 6.91> <CoreInst = "Multiplier">   --->   Core 3 'Multiplier' <Latency = 1> <II = 1> <Delay = 6.91> <FuncUnit> <Opcode : 'mul'> <InPorts = 2> <OutPorts = 1>
ST_3 : Operation 49 [2/2] (6.91ns)   --->   "%ahbl = mul i64 %zext_ln105_171, i64 %zext_ln110" [src/generic/fp_generic.c:116->src/generic/fp_generic.c:145]   --->   Operation 49 'mul' 'ahbl' <Predicate = true> <Delay = 6.91> <CoreInst = "Multiplier">   --->   Core 3 'Multiplier' <Latency = 1> <II = 1> <Delay = 6.91> <FuncUnit> <Opcode : 'mul'> <InPorts = 2> <OutPorts = 1>
ST_3 : Operation 50 [2/2] (6.91ns)   --->   "%ahbh = mul i64 %zext_ln112, i64 %zext_ln110" [src/generic/fp_generic.c:117->src/generic/fp_generic.c:145]   --->   Operation 50 'mul' 'ahbh' <Predicate = true> <Delay = 6.91> <CoreInst = "Multiplier">   --->   Core 3 'Multiplier' <Latency = 1> <II = 1> <Delay = 6.91> <FuncUnit> <Opcode : 'mul'> <InPorts = 2> <OutPorts = 1>

State 4 <SV = 3> <Delay = 6.91>
ST_4 : Operation 51 [1/2] (6.91ns)   --->   "%albl = mul i64 %zext_ln105_171, i64 %zext_ln105" [src/generic/fp_generic.c:114->src/generic/fp_generic.c:145]   --->   Operation 51 'mul' 'albl' <Predicate = true> <Delay = 6.91> <CoreInst = "Multiplier">   --->   Core 3 'Multiplier' <Latency = 1> <II = 1> <Delay = 6.91> <FuncUnit> <Opcode : 'mul'> <InPorts = 2> <OutPorts = 1>
ST_4 : Operation 52 [1/1] (0.00ns)   --->   "%trunc_ln106 = trunc i64 %albl" [src/generic/fp_generic.c:106->src/generic/fp_generic.c:145]   --->   Operation 52 'trunc' 'trunc_ln106' <Predicate = true> <Delay = 0.00>
ST_4 : Operation 53 [1/2] (6.91ns)   --->   "%albh = mul i64 %zext_ln112, i64 %zext_ln105" [src/generic/fp_generic.c:115->src/generic/fp_generic.c:145]   --->   Operation 53 'mul' 'albh' <Predicate = true> <Delay = 6.91> <CoreInst = "Multiplier">   --->   Core 3 'Multiplier' <Latency = 1> <II = 1> <Delay = 6.91> <FuncUnit> <Opcode : 'mul'> <InPorts = 2> <OutPorts = 1>
ST_4 : Operation 54 [1/1] (0.00ns)   --->   "%trunc_ln106_255 = trunc i64 %albh" [src/generic/fp_generic.c:106->src/generic/fp_generic.c:145]   --->   Operation 54 'trunc' 'trunc_ln106_255' <Predicate = true> <Delay = 0.00>
ST_4 : Operation 55 [1/2] (6.91ns)   --->   "%ahbl = mul i64 %zext_ln105_171, i64 %zext_ln110" [src/generic/fp_generic.c:116->src/generic/fp_generic.c:145]   --->   Operation 55 'mul' 'ahbl' <Predicate = true> <Delay = 6.91> <CoreInst = "Multiplier">   --->   Core 3 'Multiplier' <Latency = 1> <II = 1> <Delay = 6.91> <FuncUnit> <Opcode : 'mul'> <InPorts = 2> <OutPorts = 1>
ST_4 : Operation 56 [1/1] (0.00ns)   --->   "%trunc_ln106_256 = trunc i64 %ahbl" [src/generic/fp_generic.c:106->src/generic/fp_generic.c:145]   --->   Operation 56 'trunc' 'trunc_ln106_256' <Predicate = true> <Delay = 0.00>
ST_4 : Operation 57 [1/2] (6.91ns)   --->   "%ahbh = mul i64 %zext_ln112, i64 %zext_ln110" [src/generic/fp_generic.c:117->src/generic/fp_generic.c:145]   --->   Operation 57 'mul' 'ahbh' <Predicate = true> <Delay = 6.91> <CoreInst = "Multiplier">   --->   Core 3 'Multiplier' <Latency = 1> <II = 1> <Delay = 6.91> <FuncUnit> <Opcode : 'mul'> <InPorts = 2> <OutPorts = 1>
ST_4 : Operation 58 [1/1] (0.00ns)   --->   "%trunc_ln106_257 = trunc i64 %ahbh" [src/generic/fp_generic.c:106->src/generic/fp_generic.c:145]   --->   Operation 58 'trunc' 'trunc_ln106_257' <Predicate = true> <Delay = 0.00>
ST_4 : Operation 59 [1/1] (0.00ns)   --->   "%tmp_468 = partselect i32 @_ssdm_op_PartSelect.i32.i64.i32.i32, i64 %albl, i32 32, i32 63" [src/generic/fp_generic.c:106->src/generic/fp_generic.c:145]   --->   Operation 59 'partselect' 'tmp_468' <Predicate = true> <Delay = 0.00>
ST_4 : Operation 60 [1/1] (0.00ns)   --->   "%tmp_470 = partselect i32 @_ssdm_op_PartSelect.i32.i64.i32.i32, i64 %ahbl, i32 32, i32 63" [src/generic/fp_generic.c:106->src/generic/fp_generic.c:145]   --->   Operation 60 'partselect' 'tmp_470' <Predicate = true> <Delay = 0.00>
ST_4 : Operation 61 [1/1] (0.00ns)   --->   "%tmp_471 = partselect i32 @_ssdm_op_PartSelect.i32.i64.i32.i32, i64 %albh, i32 32, i32 63" [src/generic/fp_generic.c:106->src/generic/fp_generic.c:145]   --->   Operation 61 'partselect' 'tmp_471' <Predicate = true> <Delay = 0.00>
ST_4 : Operation 62 [1/1] (0.00ns)   --->   "%tmp_472 = partselect i32 @_ssdm_op_PartSelect.i32.i64.i32.i32, i64 %ahbh, i32 32, i32 63" [src/generic/fp_generic.c:133->src/generic/fp_generic.c:145]   --->   Operation 62 'partselect' 'tmp_472' <Predicate = true> <Delay = 0.00>

State 5 <SV = 4> <Delay = 5.14>
ST_5 : Operation 63 [1/1] (0.00ns)   --->   "%zext_ln106 = zext i32 %tmp_468" [src/generic/fp_generic.c:106->src/generic/fp_generic.c:145]   --->   Operation 63 'zext' 'zext_ln106' <Predicate = true> <Delay = 0.00>
ST_5 : Operation 64 [1/1] (0.00ns)   --->   "%zext_ln123 = zext i32 %trunc_ln106_256" [src/generic/fp_generic.c:123->src/generic/fp_generic.c:145]   --->   Operation 64 'zext' 'zext_ln123' <Predicate = true> <Delay = 0.00>
ST_5 : Operation 65 [1/1] (0.00ns)   --->   "%zext_ln123_161 = zext i32 %trunc_ln106_255" [src/generic/fp_generic.c:123->src/generic/fp_generic.c:145]   --->   Operation 65 'zext' 'zext_ln123_161' <Predicate = true> <Delay = 0.00>
ST_5 : Operation 66 [1/1] (2.55ns)   --->   "%add_ln123 = add i33 %zext_ln123, i33 %zext_ln123_161" [src/generic/fp_generic.c:123->src/generic/fp_generic.c:145]   --->   Operation 66 'add' 'add_ln123' <Predicate = true> <Delay = 2.55> <CoreInst = "Adder">   --->   Core 1 'Adder' <Latency = 0> <II = 1> <Delay = 2.55> <FuncUnit> <Opcode : 'add' 'sub'> <InPorts = 2> <OutPorts = 1>
ST_5 : Operation 67 [1/1] (0.00ns)   --->   "%zext_ln123_162 = zext i33 %add_ln123" [src/generic/fp_generic.c:123->src/generic/fp_generic.c:145]   --->   Operation 67 'zext' 'zext_ln123_162' <Predicate = true> <Delay = 0.00>
ST_5 : Operation 68 [1/1] (2.59ns)   --->   "%temp = add i34 %zext_ln123_162, i34 %zext_ln106" [src/generic/fp_generic.c:123->src/generic/fp_generic.c:145]   --->   Operation 68 'add' 'temp' <Predicate = true> <Delay = 2.59> <CoreInst = "Adder">   --->   Core 1 'Adder' <Latency = 0> <II = 1> <Delay = 2.59> <FuncUnit> <Opcode : 'add' 'sub'> <InPorts = 2> <OutPorts = 1>
ST_5 : Operation 69 [1/1] (0.00ns)   --->   "%tmp_469 = partselect i2 @_ssdm_op_PartSelect.i2.i34.i32.i32, i34 %temp, i32 32, i32 33" [src/generic/fp_generic.c:106->src/generic/fp_generic.c:145]   --->   Operation 69 'partselect' 'tmp_469' <Predicate = true> <Delay = 0.00>
ST_5 : Operation 70 [1/1] (0.00ns)   --->   "%trunc_ln125 = trunc i34 %temp" [src/generic/fp_generic.c:125->src/generic/fp_generic.c:145]   --->   Operation 70 'trunc' 'trunc_ln125' <Predicate = true> <Delay = 0.00>

State 6 <SV = 5> <Delay = 6.92>
ST_6 : Operation 71 [1/1] (0.00ns)   --->   "%zext_ln106_220 = zext i2 %tmp_469" [src/generic/fp_generic.c:106->src/generic/fp_generic.c:145]   --->   Operation 71 'zext' 'zext_ln106_220' <Predicate = true> <Delay = 0.00>
ST_6 : Operation 72 [1/1] (0.00ns)   --->   "%zext_ln106_221 = zext i32 %tmp_470" [src/generic/fp_generic.c:106->src/generic/fp_generic.c:145]   --->   Operation 72 'zext' 'zext_ln106_221' <Predicate = true> <Delay = 0.00>
ST_6 : Operation 73 [1/1] (0.00ns)   --->   "%zext_ln106_222 = zext i32 %tmp_471" [src/generic/fp_generic.c:106->src/generic/fp_generic.c:145]   --->   Operation 73 'zext' 'zext_ln106_222' <Predicate = true> <Delay = 0.00>
ST_6 : Operation 74 [1/1] (0.00ns)   --->   "%zext_ln130 = zext i32 %trunc_ln106_257" [src/generic/fp_generic.c:130->src/generic/fp_generic.c:145]   --->   Operation 74 'zext' 'zext_ln130' <Predicate = true> <Delay = 0.00>
ST_6 : Operation 75 [1/1] (0.00ns) (grouped into TernaryAdder)   --->   "%add_ln130_200 = add i32 %trunc_ln106_257, i32 %tmp_470" [src/generic/fp_generic.c:130->src/generic/fp_generic.c:145]   --->   Operation 75 'add' 'add_ln130_200' <Predicate = true> <Delay = 0.00> <CoreInst = "TAddSub">   --->   Core 10 'TAddSub' <Latency = 0> <II = 1> <Delay = 2.18> <IPBlock> <Opcode : '' 'add' 'sub'> <InPorts = 3> <OutPorts = 1> <Sync> <CReg>
ST_6 : Operation 76 [1/1] (2.55ns)   --->   "%add_ln130 = add i33 %zext_ln130, i33 %zext_ln106_221" [src/generic/fp_generic.c:130->src/generic/fp_generic.c:145]   --->   Operation 76 'add' 'add_ln130' <Predicate = true> <Delay = 2.55> <CoreInst = "Adder">   --->   Core 1 'Adder' <Latency = 0> <II = 1> <Delay = 2.55> <FuncUnit> <Opcode : 'add' 'sub'> <InPorts = 2> <OutPorts = 1>
ST_6 : Operation 77 [1/1] (0.00ns)   --->   "%zext_ln130_161 = zext i33 %add_ln130" [src/generic/fp_generic.c:130->src/generic/fp_generic.c:145]   --->   Operation 77 'zext' 'zext_ln130_161' <Predicate = true> <Delay = 0.00>
ST_6 : Operation 78 [1/1] (2.55ns)   --->   "%add_ln130_191 = add i33 %zext_ln106_222, i33 %zext_ln106_220" [src/generic/fp_generic.c:130->src/generic/fp_generic.c:145]   --->   Operation 78 'add' 'add_ln130_191' <Predicate = true> <Delay = 2.55> <CoreInst = "Adder">   --->   Core 1 'Adder' <Latency = 0> <II = 1> <Delay = 2.55> <FuncUnit> <Opcode : 'add' 'sub'> <InPorts = 2> <OutPorts = 1>
ST_6 : Operation 79 [1/1] (0.00ns)   --->   "%trunc_ln130 = trunc i33 %add_ln130_191" [src/generic/fp_generic.c:130->src/generic/fp_generic.c:145]   --->   Operation 79 'trunc' 'trunc_ln130' <Predicate = true> <Delay = 0.00>
ST_6 : Operation 80 [1/1] (0.00ns)   --->   "%zext_ln130_162 = zext i33 %add_ln130_191" [src/generic/fp_generic.c:130->src/generic/fp_generic.c:145]   --->   Operation 80 'zext' 'zext_ln130_162' <Predicate = true> <Delay = 0.00>
ST_6 : Operation 81 [1/1] (4.37ns) (root node of TernaryAdder)   --->   "%add_ln105 = add i32 %trunc_ln130, i32 %add_ln130_200" [src/generic/fp_generic.c:105->src/generic/fp_generic.c:145]   --->   Operation 81 'add' 'add_ln105' <Predicate = true> <Delay = 4.37> <CoreInst = "TAddSub">   --->   Core 10 'TAddSub' <Latency = 0> <II = 1> <Delay = 2.18> <IPBlock> <Opcode : '' 'add' 'sub'> <InPorts = 3> <OutPorts = 1> <Sync> <CReg>
ST_6 : Operation 82 [1/1] (2.59ns)   --->   "%temp_84 = add i34 %zext_ln130_162, i34 %zext_ln130_161" [src/generic/fp_generic.c:130->src/generic/fp_generic.c:145]   --->   Operation 82 'add' 'temp_84' <Predicate = true> <Delay = 2.59> <CoreInst = "Adder">   --->   Core 1 'Adder' <Latency = 0> <II = 1> <Delay = 2.59> <FuncUnit> <Opcode : 'add' 'sub'> <InPorts = 2> <OutPorts = 1>
ST_6 : Operation 83 [1/1] (0.00ns)   --->   "%tmp_473 = partselect i2 @_ssdm_op_PartSelect.i2.i34.i32.i32, i34 %temp_84, i32 32, i32 33" [src/generic/fp_generic.c:133->src/generic/fp_generic.c:145]   --->   Operation 83 'partselect' 'tmp_473' <Predicate = true> <Delay = 0.00>

State 7 <SV = 6> <Delay = 7.04>
ST_7 : Operation 84 [1/1] (0.00ns)   --->   "%v_114_load = load i64 %v_114" [src/generic/fp_generic.c:146]   --->   Operation 84 'load' 'v_114_load' <Predicate = true> <Delay = 0.00>
ST_7 : Operation 85 [1/1] (0.00ns)   --->   "%shl_ln = bitconcatenate i64 @_ssdm_op_BitConcatenate.i64.i32.i32, i32 %trunc_ln125, i32 0" [src/generic/fp_generic.c:125->src/generic/fp_generic.c:145]   --->   Operation 85 'bitconcatenate' 'shl_ln' <Predicate = true> <Delay = 0.00>
ST_7 : Operation 86 [1/1] (0.00ns)   --->   "%and_ln = bitconcatenate i64 @_ssdm_op_BitConcatenate.i64.i32.i32, i32 %tmp_472, i32 0" [src/generic/fp_generic.c:133->src/generic/fp_generic.c:145]   --->   Operation 86 'bitconcatenate' 'and_ln' <Predicate = true> <Delay = 0.00>
ST_7 : Operation 87 [1/1] (0.00ns)   --->   "%and_ln133_s = bitconcatenate i34 @_ssdm_op_BitConcatenate.i34.i2.i32, i2 %tmp_473, i32 0" [src/generic/fp_generic.c:133->src/generic/fp_generic.c:145]   --->   Operation 87 'bitconcatenate' 'and_ln133_s' <Predicate = true> <Delay = 0.00>
ST_7 : Operation 88 [1/1] (0.00ns)   --->   "%zext_ln133 = zext i34 %and_ln133_s" [src/generic/fp_generic.c:133->src/generic/fp_generic.c:145]   --->   Operation 88 'zext' 'zext_ln133' <Predicate = true> <Delay = 0.00>
ST_7 : Operation 89 [1/1] (3.52ns)   --->   "%add_ln133 = add i64 %zext_ln133, i64 %and_ln" [src/generic/fp_generic.c:133->src/generic/fp_generic.c:145]   --->   Operation 89 'add' 'add_ln133' <Predicate = true> <Delay = 3.52> <CoreInst = "Adder">   --->   Core 1 'Adder' <Latency = 0> <II = 1> <Delay = 3.52> <FuncUnit> <Opcode : 'add' 'sub'> <InPorts = 2> <OutPorts = 1>
ST_7 : Operation 90 [1/1] (0.00ns)   --->   "%or_ln = bitconcatenate i64 @_ssdm_op_BitConcatenate.i64.i32.i32, i32 %trunc_ln125, i32 %trunc_ln106" [src/generic/fp_generic.c:146]   --->   Operation 90 'bitconcatenate' 'or_ln' <Predicate = true> <Delay = 0.00>
ST_7 : Operation 91 [1/1] (3.52ns)   --->   "%v_196 = add i64 %or_ln, i64 %v_114_load" [src/generic/fp_generic.c:146]   --->   Operation 91 'add' 'v_196' <Predicate = true> <Delay = 3.52> <CoreInst = "Adder">   --->   Core 1 'Adder' <Latency = 0> <II = 1> <Delay = 3.52> <FuncUnit> <Opcode : 'add' 'sub'> <InPorts = 2> <OutPorts = 1>
ST_7 : Operation 92 [1/1] (0.00ns) (grouped into LUT with out node tempReg)   --->   "%xor_ln105 = xor i64 %v_196, i64 %shl_ln" [src/config.h:105->src/generic/fp_generic.c:146]   --->   Operation 92 'xor' 'xor_ln105' <Predicate = true> <Delay = 0.00> <CoreInst = "LogicGate">   --->   Core 74 'LogicGate' <Latency = 0> <II = 1> <Delay = 0.99> <FuncUnit> <Opcode : 'and' 'or' 'xor'> <InPorts = 2> <OutPorts = 1>
ST_7 : Operation 93 [1/1] (0.00ns) (grouped into LUT with out node tempReg)   --->   "%xor_ln105_61 = xor i64 %shl_ln, i64 %v_114_load" [src/config.h:105->src/generic/fp_generic.c:146]   --->   Operation 93 'xor' 'xor_ln105_61' <Predicate = true> <Delay = 0.00> <CoreInst = "LogicGate">   --->   Core 74 'LogicGate' <Latency = 0> <II = 1> <Delay = 0.99> <FuncUnit> <Opcode : 'and' 'or' 'xor'> <InPorts = 2> <OutPorts = 1>
ST_7 : Operation 94 [1/1] (0.00ns) (grouped into LUT with out node tempReg)   --->   "%or_ln105 = or i64 %xor_ln105, i64 %xor_ln105_61" [src/config.h:105->src/generic/fp_generic.c:146]   --->   Operation 94 'or' 'or_ln105' <Predicate = true> <Delay = 0.00> <CoreInst = "LogicGate">   --->   Core 74 'LogicGate' <Latency = 0> <II = 1> <Delay = 0.99> <FuncUnit> <Opcode : 'and' 'or' 'xor'> <InPorts = 2> <OutPorts = 1>
ST_7 : Operation 95 [1/1] (0.00ns) (grouped into LUT with out node tempReg)   --->   "%xor_ln105_62 = xor i64 %or_ln105, i64 %v_196" [src/config.h:105->src/generic/fp_generic.c:146]   --->   Operation 95 'xor' 'xor_ln105_62' <Predicate = true> <Delay = 0.00> <CoreInst = "LogicGate">   --->   Core 74 'LogicGate' <Latency = 0> <II = 1> <Delay = 0.99> <FuncUnit> <Opcode : 'and' 'or' 'xor'> <InPorts = 2> <OutPorts = 1>
ST_7 : Operation 96 [1/1] (0.00ns) (grouped into LUT with out node tempReg)   --->   "%carry = bitselect i1 @_ssdm_op_BitSelect.i1.i64.i32, i64 %xor_ln105_62, i32 63" [src/config.h:105->src/generic/fp_generic.c:146]   --->   Operation 96 'bitselect' 'carry' <Predicate = true> <Delay = 0.00>
ST_7 : Operation 97 [1/1] (0.00ns) (grouped into LUT with out node tempReg)   --->   "%zext_ln105_172 = zext i1 %carry" [src/config.h:105->src/generic/fp_generic.c:146]   --->   Operation 97 'zext' 'zext_ln105_172' <Predicate = true> <Delay = 0.00>
ST_7 : Operation 98 [1/1] (0.00ns) (grouped into LUT with out node tempReg)   --->   "%tmp_s = partselect i32 @_ssdm_op_PartSelect.i32.i64.i32.i32, i64 %add_ln133, i32 32, i32 63" [src/generic/fp_generic.c:147]   --->   Operation 98 'partselect' 'tmp_s' <Predicate = true> <Delay = 0.00>
ST_7 : Operation 99 [1/1] (0.00ns) (grouped into LUT with out node tempReg)   --->   "%or_ln52 = bitconcatenate i64 @_ssdm_op_BitConcatenate.i64.i32.i32, i32 %tmp_s, i32 %add_ln105" [src/generic/fp_generic.c:147]   --->   Operation 99 'bitconcatenate' 'or_ln52' <Predicate = true> <Delay = 0.00>
ST_7 : Operation 100 [1/1] (3.52ns) (out node of the LUT)   --->   "%tempReg = add i64 %or_ln52, i64 %zext_ln105_172" [src/generic/fp_generic.c:147]   --->   Operation 100 'add' 'tempReg' <Predicate = true> <Delay = 3.52> <CoreInst = "Adder">   --->   Core 1 'Adder' <Latency = 0> <II = 1> <Delay = 3.52> <FuncUnit> <Opcode : 'add' 'sub'> <InPorts = 2> <OutPorts = 1>
ST_7 : Operation 101 [1/1] (1.58ns)   --->   "%store_ln140 = store i64 %v_196, i64 %v_114" [src/generic/fp_generic.c:140]   --->   Operation 101 'store' 'store_ln140' <Predicate = true> <Delay = 1.58>

State 8 <SV = 7> <Delay = 5.10>
ST_8 : Operation 102 [1/1] (0.00ns)   --->   "%u_95_out_load = load i64 %u_95_out" [src/generic/fp_generic.c:147]   --->   Operation 102 'load' 'u_95_out_load' <Predicate = true> <Delay = 0.00>
ST_8 : Operation 103 [1/1] (3.52ns)   --->   "%v = add i64 %tempReg, i64 %u_95_out_load" [src/generic/fp_generic.c:147]   --->   Operation 103 'add' 'v' <Predicate = true> <Delay = 3.52> <CoreInst = "Adder">   --->   Core 1 'Adder' <Latency = 0> <II = 1> <Delay = 3.52> <FuncUnit> <Opcode : 'add' 'sub'> <InPorts = 2> <OutPorts = 1>
ST_8 : Operation 104 [1/1] (1.58ns)   --->   "%store_ln140 = store i64 %v, i64 %u_95_out" [src/generic/fp_generic.c:140]   --->   Operation 104 'store' 'store_ln140' <Predicate = true> <Delay = 1.58>
ST_8 : Operation 124 [1/1] (0.00ns)   --->   "%v_114_load_7 = load i64 %v_114"   --->   Operation 124 'load' 'v_114_load_7' <Predicate = (icmp_ln144)> <Delay = 0.00>
ST_8 : Operation 125 [1/1] (0.00ns)   --->   "%write_ln0 = write void @_ssdm_op_Write.ap_auto.i64P0A, i64 %v_114_out, i64 %v_114_load_7"   --->   Operation 125 'write' 'write_ln0' <Predicate = (icmp_ln144)> <Delay = 0.00>
ST_8 : Operation 126 [1/1] (1.58ns)   --->   "%ret_ln0 = ret"   --->   Operation 126 'ret' 'ret_ln0' <Predicate = (icmp_ln144)> <Delay = 1.58>

State 9 <SV = 8> <Delay = 4.31>
ST_9 : Operation 105 [1/1] (0.00ns)   --->   "%t_out_load = load i4 %t_out" [src/generic/fp_generic.c:148]   --->   Operation 105 'load' 't_out_load' <Predicate = true> <Delay = 0.00>
ST_9 : Operation 106 [1/1] (0.00ns)   --->   "%specpipeline_ln139 = specpipeline void @_ssdm_op_SpecPipeline, i32 4294967295, i32 0, i32 0, i32 0, void @empty_44" [src/generic/fp_generic.c:139]   --->   Operation 106 'specpipeline' 'specpipeline_ln139' <Predicate = true> <Delay = 0.00>
ST_9 : Operation 107 [1/1] (0.00ns)   --->   "%speclooptripcount_ln139 = speclooptripcount void @_ssdm_op_SpecLoopTripCount, i64 1, i64 8, i64 4" [src/generic/fp_generic.c:139]   --->   Operation 107 'speclooptripcount' 'speclooptripcount_ln139' <Predicate = true> <Delay = 0.00>
ST_9 : Operation 108 [1/1] (0.00ns)   --->   "%specloopname_ln144 = specloopname void @_ssdm_op_SpecLoopName, void @empty_29" [src/generic/fp_generic.c:144]   --->   Operation 108 'specloopname' 'specloopname_ln144' <Predicate = true> <Delay = 0.00>
ST_9 : Operation 109 [1/1] (0.00ns) (grouped into LUT with out node xor_ln147_39)   --->   "%xor_ln147 = xor i64 %v, i64 %tempReg" [src/generic/fp_generic.c:147]   --->   Operation 109 'xor' 'xor_ln147' <Predicate = true> <Delay = 0.00> <CoreInst = "LogicGate">   --->   Core 74 'LogicGate' <Latency = 0> <II = 1> <Delay = 0.99> <FuncUnit> <Opcode : 'and' 'or' 'xor'> <InPorts = 2> <OutPorts = 1>
ST_9 : Operation 110 [1/1] (0.00ns) (grouped into LUT with out node xor_ln147_39)   --->   "%xor_ln147_37 = xor i64 %tempReg, i64 %u_95_out_load" [src/generic/fp_generic.c:147]   --->   Operation 110 'xor' 'xor_ln147_37' <Predicate = true> <Delay = 0.00> <CoreInst = "LogicGate">   --->   Core 74 'LogicGate' <Latency = 0> <II = 1> <Delay = 0.99> <FuncUnit> <Opcode : 'and' 'or' 'xor'> <InPorts = 2> <OutPorts = 1>
ST_9 : Operation 111 [1/1] (0.00ns) (grouped into LUT with out node xor_ln147_39)   --->   "%or_ln147_25 = or i64 %xor_ln147, i64 %xor_ln147_37" [src/generic/fp_generic.c:147]   --->   Operation 111 'or' 'or_ln147_25' <Predicate = true> <Delay = 0.00> <CoreInst = "LogicGate">   --->   Core 74 'LogicGate' <Latency = 0> <II = 1> <Delay = 0.99> <FuncUnit> <Opcode : 'and' 'or' 'xor'> <InPorts = 2> <OutPorts = 1>
ST_9 : Operation 112 [1/1] (0.00ns) (grouped into LUT with out node u)   --->   "%bit_sel = bitselect i1 @_ssdm_op_BitSelect.i1.i64.i64, i64 %tempReg, i64 63" [src/generic/fp_generic.c:147]   --->   Operation 112 'bitselect' 'bit_sel' <Predicate = true> <Delay = 0.00>
ST_9 : Operation 113 [1/1] (0.00ns) (grouped into LUT with out node u)   --->   "%xor_ln147_50 = xor i1 %bit_sel, i1 1" [src/generic/fp_generic.c:147]   --->   Operation 113 'xor' 'xor_ln147_50' <Predicate = true> <Delay = 0.00> <CoreInst = "LogicGate">   --->   Core 74 'LogicGate' <Latency = 0> <II = 1> <Delay = 0.97> <FuncUnit> <Opcode : 'and' 'or' 'xor'> <InPorts = 2> <OutPorts = 1>
ST_9 : Operation 114 [1/1] (0.00ns) (grouped into LUT with out node u)   --->   "%trunc_ln147 = trunc i64 %tempReg" [src/generic/fp_generic.c:147]   --->   Operation 114 'trunc' 'trunc_ln147' <Predicate = true> <Delay = 0.00>
ST_9 : Operation 115 [1/1] (0.00ns) (grouped into LUT with out node u)   --->   "%xor_ln147_s = bitconcatenate i64 @_ssdm_op_BitConcatenate.i64.i1.i63, i1 %xor_ln147_50, i63 %trunc_ln147" [src/generic/fp_generic.c:147]   --->   Operation 115 'bitconcatenate' 'xor_ln147_s' <Predicate = true> <Delay = 0.00>
ST_9 : Operation 116 [1/1] (0.00ns) (grouped into LUT with out node u)   --->   "%and_ln147 = and i64 %xor_ln147_s, i64 %add_ln133" [src/generic/fp_generic.c:147]   --->   Operation 116 'and' 'and_ln147' <Predicate = true> <Delay = 0.00> <CoreInst = "LogicGate">   --->   Core 74 'LogicGate' <Latency = 0> <II = 1> <Delay = 0.99> <FuncUnit> <Opcode : 'and' 'or' 'xor'> <InPorts = 2> <OutPorts = 1>
ST_9 : Operation 117 [1/1] (0.99ns) (out node of the LUT)   --->   "%xor_ln147_39 = xor i64 %or_ln147_25, i64 %v" [src/generic/fp_generic.c:147]   --->   Operation 117 'xor' 'xor_ln147_39' <Predicate = true> <Delay = 0.99> <CoreInst = "LogicGate">   --->   Core 74 'LogicGate' <Latency = 0> <II = 1> <Delay = 0.99> <FuncUnit> <Opcode : 'and' 'or' 'xor'> <InPorts = 2> <OutPorts = 1>
ST_9 : Operation 118 [1/1] (0.00ns) (grouped into LUT with out node u)   --->   "%or_ln147 = or i64 %xor_ln147_39, i64 %and_ln147" [src/generic/fp_generic.c:147]   --->   Operation 118 'or' 'or_ln147' <Predicate = true> <Delay = 0.00> <CoreInst = "LogicGate">   --->   Core 74 'LogicGate' <Latency = 0> <II = 1> <Delay = 0.99> <FuncUnit> <Opcode : 'and' 'or' 'xor'> <InPorts = 2> <OutPorts = 1>
ST_9 : Operation 119 [1/1] (0.00ns) (grouped into LUT with out node u)   --->   "%tmp_154 = bitselect i1 @_ssdm_op_BitSelect.i1.i64.i32, i64 %or_ln147, i32 63" [src/generic/fp_generic.c:148]   --->   Operation 119 'bitselect' 'tmp_154' <Predicate = true> <Delay = 0.00>
ST_9 : Operation 120 [1/1] (0.00ns) (grouped into LUT with out node u)   --->   "%zext_ln148 = zext i1 %tmp_154" [src/generic/fp_generic.c:148]   --->   Operation 120 'zext' 'zext_ln148' <Predicate = true> <Delay = 0.00>
ST_9 : Operation 121 [1/1] (1.73ns) (out node of the LUT)   --->   "%u = add i4 %zext_ln148, i4 %t_out_load" [src/generic/fp_generic.c:148]   --->   Operation 121 'add' 'u' <Predicate = true> <Delay = 1.73> <CoreInst = "Adder">   --->   Core 1 'Adder' <Latency = 0> <II = 1> <Delay = 1.73> <FuncUnit> <Opcode : 'add' 'sub'> <InPorts = 2> <OutPorts = 1>
ST_9 : Operation 122 [1/1] (1.58ns)   --->   "%store_ln140 = store i4 %u, i4 %t_out" [src/generic/fp_generic.c:140]   --->   Operation 122 'store' 'store_ln140' <Predicate = true> <Delay = 1.58>
ST_9 : Operation 123 [1/1] (0.00ns)   --->   "%br_ln144 = br void %for.inc" [src/generic/fp_generic.c:144]   --->   Operation 123 'br' 'br_ln144' <Predicate = true> <Delay = 0.00>


============================================================
+ Verbose Summary: Timing violations
============================================================
Target clock period: 10.000ns, clock uncertainty: 2.700ns.

 <State 1>: 5.560ns
The critical path consists of the following:
	'store' operation 0 bit ('store_ln139', src/generic/fp_generic.c:139) of constant 0 on local variable 'j', src/generic/fp_generic.c:139 [16]  (1.588 ns)
	'load' operation 4 bit ('j', src/generic/fp_generic.c:144) on local variable 'j', src/generic/fp_generic.c:139 [22]  (0.000 ns)
	'sub' operation 3 bit ('sub_ln145', src/generic/fp_generic.c:145) [38]  (1.650 ns)
	'getelementptr' operation 3 bit ('b_addr', src/generic/fp_generic.c:145) [40]  (0.000 ns)
	'load' operation 64 bit ('b', src/generic/fp_generic.c:145) on array 'b' [41]  (2.322 ns)

 <State 2>: 2.322ns
The critical path consists of the following:
	'load' operation 64 bit ('a', src/generic/fp_generic.c:145) on array 'b' [36]  (2.322 ns)

 <State 3>: 6.912ns
The critical path consists of the following:
	'mul' operation 64 bit ('albl', src/generic/fp_generic.c:114->src/generic/fp_generic.c:145) [49]  (6.912 ns)

 <State 4>: 6.912ns
The critical path consists of the following:
	'mul' operation 64 bit ('albl', src/generic/fp_generic.c:114->src/generic/fp_generic.c:145) [49]  (6.912 ns)

 <State 5>: 5.145ns
The critical path consists of the following:
	'add' operation 33 bit ('add_ln123', src/generic/fp_generic.c:123->src/generic/fp_generic.c:145) [61]  (2.552 ns)
	'add' operation 34 bit ('temp', src/generic/fp_generic.c:123->src/generic/fp_generic.c:145) [63]  (2.593 ns)

 <State 6>: 6.923ns
The critical path consists of the following:
	'add' operation 33 bit ('add_ln130_191', src/generic/fp_generic.c:130->src/generic/fp_generic.c:145) [76]  (2.552 ns)
	'add' operation 32 bit ('add_ln105', src/generic/fp_generic.c:105->src/generic/fp_generic.c:145) [79]  (4.371 ns)

 <State 7>: 7.040ns
The critical path consists of the following:
	'load' operation 64 bit ('v_114_load', src/generic/fp_generic.c:146) on local variable 'v', src/generic/fp_generic.c:140 [29]  (0.000 ns)
	'add' operation 64 bit ('x', src/generic/fp_generic.c:146) [88]  (3.520 ns)
	'xor' operation 64 bit ('xor_ln105_62', src/config.h:105->src/generic/fp_generic.c:146) [92]  (0.000 ns)
	'add' operation 64 bit ('tempReg', src/generic/fp_generic.c:147) [97]  (3.520 ns)

 <State 8>: 5.108ns
The critical path consists of the following:
	'load' operation 64 bit ('u_95_out_load', src/generic/fp_generic.c:147) on local variable 'u_95_out' [28]  (0.000 ns)
	'add' operation 64 bit ('v', src/generic/fp_generic.c:147) [98]  (3.520 ns)
	'store' operation 0 bit ('store_ln140', src/generic/fp_generic.c:140) of variable 'v', src/generic/fp_generic.c:147 on local variable 'u_95_out' [114]  (1.588 ns)

 <State 9>: 4.313ns
The critical path consists of the following:
	'xor' operation 64 bit ('xor_ln147', src/generic/fp_generic.c:147) [99]  (0.000 ns)
	'or' operation 64 bit ('or_ln147_25', src/generic/fp_generic.c:147) [101]  (0.000 ns)
	'xor' operation 64 bit ('xor_ln147_39', src/generic/fp_generic.c:147) [107]  (0.990 ns)
	'or' operation 64 bit ('or_ln147', src/generic/fp_generic.c:147) [108]  (0.000 ns)
	'add' operation 4 bit ('u', src/generic/fp_generic.c:148) [111]  (1.735 ns)
	'store' operation 0 bit ('store_ln140', src/generic/fp_generic.c:140) of variable 'u', src/generic/fp_generic.c:148 on local variable 't_out' [115]  (1.588 ns)


============================================================
+ Verbose Summary: Binding
============================================================
N/A
* FSMD analyzer results:
  - Output states:
 - Input state : 
  - Chain level:
	State 1
	State 2
	State 3
	State 4
	State 5
	State 6
	State 7
	State 8
	State 9


============================================================
+ Verbose Summary: Datapath Resource usage 
============================================================
N/A
